experiment	commit	metric	status	description
948	104.38	discard	MacDisplayKit=18964bcce2e7ac0e1dd80476d6d70259231903a8	MacDisplayKit: exp948: cache source note emission flags
949	104.17	discard	MacDisplayKit=fa1b178175cd65b2a484ff178a0af3fa3b58255e	MacDisplayKit: exp949: cache per-session encode plan
950	104.17	discard	MacDisplayKit=64c3e4a4ea5d9a0c46fca0bf57f0b947ec7fcf47	MacDisplayKit: exp950: flatten vt callback token access
951	104.17	discard	MacDisplayKit=10be620bc5c976b506ea110a090d5155bdf60e3f	MacDisplayKit: exp951: use cf keyframe attachment lookup
952	104.38	discard	MacDisplayKit=3cd68ff9ca6b0bb1bc63d7eea83357a14efa37ee	MacDisplayKit: exp952: stop rebuilding retained vt frames
953	104.38	discard	MacDisplayKit=3b952b9a896227cacffe8ed85e679364e245e2db	MacDisplayKit: exp953: skip failed-output frame assembly
954	104.17	discard	MacDisplayKit=3a1b1835aabd700768dbc4bcbd76358c3eb9bf66	MacDisplayKit: exp954: deliver vt output before bookkeeping
955	104.38	discard	MacDisplayKit=1ab00a8002723b36fc224ac3d040e06024067e02	MacDisplayKit: exp955: reuse staged pixel-buffer wrappers
956	104.17	discard	MacDisplayKit=cdf4f8cdcc8086857e88890d36d6cd7f171baaa2	MacDisplayKit: exp956: use cf keyframe lookup in encoded frames
957	103.87	discard	MacDisplayKit=827f34f712fca2d30691d98ee1b988d99b5ada68	MacDisplayKit: exp957: store replay buffers without wrappers
958	104.17	discard	MacDisplayKit=b7798bcfa7d0ca1477302e9df3fabdd4729374ca	MacDisplayKit: exp958: use cf keyframe lookup in vt callback
959	104.17	discard	MacDisplayKit=59cb15248d31256e4566d3f307db16f94250b472	MacDisplayKit: exp959: use mach ticks for vt callback latency
960	104.17	discard	MacDisplayKit=e8e8e0fdd5d690ead9881d6f8673d98413232b9f	MacDisplayKit: exp960: reuse force-keyframe properties
961	104.17	discard	MacDisplayKit=306bee73e8970e933a0a2fd16700fc0650111e03	MacDisplayKit: exp961: enqueue submitted frame bookkeeping
962	104.38	discard	MacDisplayKit=ebc15ac9b577038e8471127861052d8d7e04d5b4	MacDisplayKit: exp962: enqueue processing bookkeeping
963	104.17	discard	MacDisplayKit=d274db8ae86a4c21e76eb32b42691f46d58caa6e	MacDisplayKit: exp963: enqueue non-callback output bookkeeping
964	104.17	discard	MacDisplayKit=321a15a8532628bfe367d090762057445ef3fb80	MacDisplayKit: exp964: cache the last wrapped pixel buffer
965	104.17	discard	MacDisplayKit=e114d7f41a81ec29decf5cea527e95e87b570cc8	MacDisplayKit: exp965: cache the last source texture entry
966	104.17	discard	MacDisplayKit=a1ad44525c78bacdf46ae92d103831deb3aa7bba	MacDisplayKit: exp966: cache the last plane descriptors
967	104.17	discard	MacDisplayKit=954fca1b57414160a7d51964a72d35d91c88c7b2	MacDisplayKit: exp967: cache the last cursor texture
968	104.17	discard	MacDisplayKit=4d6102886616983f4788d15a953f808843a976d9	MacDisplayKit: exp968: reuse encode output dimensions
969	104.38	discard	MacDisplayKit=6e4e195d5283f8772c28ea43f0c043cc0c9c831a	MacDisplayKit: exp969: cache encode note emission flags
970	104.38	discard	MacDisplayKit=ab672538f0ce886ab125edacf5c3016d471f6b49	MacDisplayKit: exp970: reuse encode preprocessing flags
971	104.38	discard	MacDisplayKit=ff496d76797b5eda43ec48fb5e0bd2e973052b32	MacDisplayKit: exp971: read cursor texture directly
972	104.17	discard	MacDisplayKit=8240928c3b470901982bcb044e561c24e99e03ce	MacDisplayKit: exp972: skip repeated hdr buffer attachment
973	104.17	discard	MacDisplayKit=013439db8135fbf32b75845691cd9e73e09c7cd9	MacDisplayKit: exp973: compare source texture cache by surface metadata
974	104.38	discard	MacDisplayKit=8b057ba971c558af9f3238e792a30606a5be17cd	MacDisplayKit: exp974: lazily build cursor textures
975	104.17	discard	MacDisplayKit=93aa004189dc12e63a5a71cea53e18ae7c677e46	MacDisplayKit: exp975: skip nil cursor scaling helper
976	104.17	discard	MacDisplayKit=e25aa630d10dc787a5a25ccc0290cb168919b9e5	MacDisplayKit: exp976: reuse the scaling decision
977	104.17	discard	MacDisplayKit=18d8519ad18334763dd7a829a3f1b8eccce94015	MacDisplayKit: exp977: specialize common texture planes
978	104.38	discard	MacDisplayKit=ecde1b2e4e74e117ae05b1fbfa5eb143001ddff5	MacDisplayKit: exp978: inline the source texture lookup
979	104.38	discard	MacDisplayKit=767bddf673a53265972ba37a36fabacec22014e8	MacDisplayKit: exp979: stop rebuilding process frames
980	104.38	discard	MacDisplayKit=d6d6870f1182a11b84694a6142533abee482a039	MacDisplayKit: exp980: cache the last source textures
981	104.38	discard	MacDisplayKit=19276d30736ddb0561f43dc52601f6d40616d1b0	MacDisplayKit: exp981: defer output bookkeeping off submit path
982	104.38	discard	MacDisplayKit=e8be4cfa56d1a49aae84a8086d9a090aeb42c780	MacDisplayKit: exp982: track free staging slots with a set
983	104.38	discard	MacDisplayKit=11b5a65076a5075a24afc86b446d5d88397e8797	MacDisplayKit: exp983: fast-path the last wrapped pixel buffer
984	104.38	discard	MacDisplayKit=48d5b3f262c5ff3f124d3e1c55a4373799c393e0	MacDisplayKit: exp984: store replay buffers directly
985	104.17	discard	MacDisplayKit=cc355623da11d0faff01f5bb6f66b2b38f47c0b9	MacDisplayKit: exp985: drop no-op pending-frame plumbing
986	104.17	discard	MacDisplayKit=bdaf44815cafc8babe9a9e3bf00f6ef11661212e	MacDisplayKit: exp986: gate hdr augmentation to hevc pq
987	104.38	discard	MacDisplayKit=0b3e6506ab246ca2254032cb83bf38b4c43baa57	MacDisplayKit: exp987: skip callback frame work on empty outputs
988	104.17	discard	MacDisplayKit=0bae33c3a855263eac5f2a124225cf419bb40583	MacDisplayKit: exp988: deepen the high-refresh staging pool
989	104.38	discard	MacDisplayKit=6c397f1e8de82f0f9983d378dd2fcd7044789568	MacDisplayKit: exp989: let matching prores frames submit directly
990	104.17	discard	MacDisplayKit=495c703084347054fde19a80353697c8e5930cf0	MacDisplayKit: exp990: hint prores realtime frame rate
991	104.38	discard	MacDisplayKit=4b13a6b04aaf6a3d357dc5d8e30ab67cac907358	MacDisplayKit: exp991: double the prores frame-rate hint
992	104.38	discard	MacDisplayKit=2a25ad513d8534c4f94bd0e0d1fdda7a8f21e985	MacDisplayKit: exp992: shorten the prores duration hint
993	104.17	discard	MacDisplayKit=d021f6f0784952be9145652c2d3cae0333797b58	MacDisplayKit: exp993: relax the prores frame-delay budget
994	104.17	discard	MacDisplayKit=d0c3c66cc8b72c5c715a893a4f1e22bb7e34b6d8	MacDisplayKit: exp994: honor 10-bit prores inputs
995	104.17	discard	MacDisplayKit=e21c7ea0436339bf3f2c34a3d4445f3f8ab44378	MacDisplayKit: exp995: double the prores realtime ceiling
996	104.38	discard	MacDisplayKit=f8813292ad29265318a4d73fdc76022507836c25	MacDisplayKit: exp996: leave prores frame delay at default
997	104.17	discard	MacDisplayKit=4b292997359a07b798f660da997b3fa442c1a2ec	MacDisplayKit: exp997: leave prores temporal compression at default
998	104.17	discard	MacDisplayKit=11b81d2c7eb6bf18948d252cbc63123845f33134	MacDisplayKit: exp998: leave prores keyframe interval at default
999	104.38	discard	MacDisplayKit=4b266e58d42d5ef1ddca892af46c2b60613641a6	MacDisplayKit: exp999: leave prores power-efficiency at default
1000	104.38	discard	MacDisplayKit=7a0ac9762484f628558ce6c1d4e8801fbeab6e81	MacDisplayKit: exp1000: leave prores open-gop at default
1001	104.38	discard	MacDisplayKit=b6d5fed42ec8087034bfb53eb7fda0daa99faeac	MacDisplayKit: exp1001: leave prores frame reordering at default
1002	104.38	discard	MacDisplayKit=479787ba43ac47e76372f4f66a7ea190c25b77d6	MacDisplayKit: exp1002: force 10-bit hdr input for prores
1003	104.38	discard	MacDisplayKit=5fc2785b7dd93934ecb43a0fa824f89bd9e69727	MacDisplayKit: exp1003: always use 10-bit 422 for prores
1004	103.96	discard	MacDisplayKit=8906066d8da685c79c6cc47d654ee0766d0b1d37	MacDisplayKit: exp1004: leave hevc open-gop at default
1005	104.38	discard	MacDisplayKit=8512423749e301233b1d7002ca9e61b988533eac	MacDisplayKit: exp1005: align direct wraps with vt pixel buffer attrs
1006	25.0	discard	Lumen=c9dc0a26b936e2241fff65e7930f0236e94c187c	Lumen: exp1006: pair hevc overlay x422 capture with auto input
1007	103.96	discard	Lumen=aec0552419dabe556689ca29dc32e0a3c6994dd6,MacDisplayKit=9803dafccc6b86b3c4c22ba81da4c522e8955179	Lumen: exp1007: request x422 capture for hevc hdr overlay | MacDisplayKit: exp1007: preserve hevc x422 hdr input under 420v10 requests
1008	103.96	discard	Lumen=836e56bd8233064a376ea5ee876c5bb12e46827a,MacDisplayKit=cfd7490f32a53470466dccfd078259eb3fc84c96	Lumen: exp1008: request x422 full-range capture for hevc hdr overlay | MacDisplayKit: exp1008: preserve hevc x422 full-range hdr input
1009	103.96	discard	Lumen=3f023f7fb7be03bfdb2e7b5ef4e44f1bcb00266d,MacDisplayKit=7a22b64d0e8a348e48e077748eb62f501c7509d5	Lumen: exp1009: request x422 capture for hevc hdr overlay again | MacDisplayKit: exp1009: preserve hevc x422 hdr input without 422 bit-depth forcing
1010	104.17	discard	Lumen=b68e47a3838312c9fcd46b4d7dab089b9d5ee798,MacDisplayKit=715c14e1aab2c4ee3db1f2618aff3e46b099c74b	Lumen: exp1010: request x422 capture for hevc hdr overlay latency cut | MacDisplayKit: exp1010: zero hevc frame delay on x422 hdr path
1011	103.96	discard	Lumen=c0b2d735a9b86a666b4f2bdd23eea82e2384d844,MacDisplayKit=b2715853bf9ee035ddf5f53b85ca7617953bdefb	Lumen: exp1011: request x422 capture for hevc hdr overlay cadence test | MacDisplayKit: exp1011: align x422 hevc cadence to realtime ceiling
1012	25.0	discard	Lumen=d8b5ec79a263ac28e5e1a049a1b9de39906392ee	Lumen: exp1012: request x422 capture only for hevc hdr overlay
1013	103.96	discard	Lumen=d086b76508fd266b1e9a8fc789cc33dddc9aed13,MacDisplayKit=9791bdf5af59ff8071d5194d9ecc1a4676224687	Lumen: exp1013: request x422 capture for hevc hdr overlay target cadence | MacDisplayKit: exp1013: drop x422 hevc expected cadence to target fps
1014	103.96	discard	Lumen=e21dde3361bb752ca57137ad9469f6c233e3b30b,MacDisplayKit=87043718ada37b295f34015cbd11acc5d2715f16	Lumen: exp1014: reopen x422 capture for hevc hdr overlay | MacDisplayKit: exp1014: drop x422 hevc realtime ceiling
1015	98.0	discard	Lumen=32031996faf2cbde05bc733ece98b04f3ffa63d4	Lumen: exp1015: request x422 capture for overlay prores
1016	104.17	discard	MacDisplayKit=59189166a0f6be9dd91ea4a471f33fbe6de63257	MacDisplayKit: exp1016: prefer legacy 120hz q3 hevc bootstrap
1017	104.17	discard	MacDisplayKit=1bc95f9bc42fa01d4e5c57d85b270e1a2ea9de68	MacDisplayKit: exp1017: trim prores callback pending slack
1018	104.17	discard	MacDisplayKit=cd0f88beb9ed01fcd66e480d6a5c386701694d5b	MacDisplayKit: exp1018: cap prores callback pending at six
1019	104.17	discard	MacDisplayKit=99169a5f30caa93a3fbd40bb3c8bcada7b743878	MacDisplayKit: exp1019: trim hevc callback pending budget
1020	104.17	discard	MacDisplayKit=24fe9bf7ff272db8daeaf598b6749a3c83519d8a	MacDisplayKit: exp1020: raise hevc low-latency bitrate ceiling
1021	104.17	discard	MacDisplayKit=ba07105e3cbf53eff4b22d67f2a77d9e5b2cacdb	MacDisplayKit: exp1021: try 193mbps hevc low-latency ceiling
1022	104.17	discard	MacDisplayKit=77d0c85ea2c4f5a1df5f93409723d234b0d67f91	MacDisplayKit: exp1022: widen hevc one-second burst window
1023	104.38	discard	MacDisplayKit=36beacb6043556e0afbb9b36259ac519b19374a8	MacDisplayKit: exp1023: unblock vt drain before output delivery
1024	104.17	discard	MacDisplayKit=cf12f8e367045544616aa8e37c9fc16b8df46c3d	MacDisplayKit: exp1024: skip callback attachment array bridging
1025	104.17	discard	MacDisplayKit=98a70414cd6df923d5a7700ad43aa1888c92026d	MacDisplayKit: exp1025: skip hevc hdr payload presence scan
1026	104.17	discard	MacDisplayKit=27a852c641d9b82a21ce32b5a1ebe071d6e232c2	MacDisplayKit: exp1026: cache encoded frame hdr validation
1027	104.38	discard	MacDisplayKit=4ff944a1cd294102435647fca7a71fedab674873	MacDisplayKit: exp1027: reuse callback keyframe classification
1028	104.17	discard	MacDisplayKit=834fecaa0fdbf1fdefa8b14c65ecadc911b7bd8a	MacDisplayKit: exp1028: reuse callback hdr metadata classification
1029	104.38	discard	MacDisplayKit=1cc926194aebb548ad19270577739b36d686c19b	MacDisplayKit: exp1029: deliver vt output before bookkeeping
1030	104.38	discard	MacDisplayKit=66ac546cde966107f216c57917d4b5b786381b81	MacDisplayKit: exp1030: delay vt pending release until delivery
1031	104.38	discard	MacDisplayKit=b20d2f0f9dda0e68b2e3aedb325e40907d5ff280	MacDisplayKit: exp1031: unblock vt drain after delivery
1032	104.17	discard	MacDisplayKit=3f6dbaff35dbdd5fcb89beea07410dddecd67be0	MacDisplayKit: exp1032: release vt staging slot before packaging
1033	104.17	discard	MacDisplayKit=3c6724265121440bcd18ea769413bc9d53ad4d14	MacDisplayKit: exp1033: defer vt callback diagnostics until after drain
1034	104.17	discard	MacDisplayKit=4b69f04d88fb9b99cc03ec74d739c1872ac0be54	MacDisplayKit: exp1034: precompute vt callback diagnostics strings
1035	104.38	discard	MacDisplayKit=f282656fdb493e7e130e99fa7253ad686c899098	MacDisplayKit: exp1035: reuse hevc hdr presence inputs
1036	104.38	discard	MacDisplayKit=793a464cea7b1e9e79514656c748f56959dc3e43	MacDisplayKit: exp1036: delay hevc hdr payload copy until needed
1037	104.17	discard	MacDisplayKit=32320f78ea429d31600405dd28fa01c8215c3ef5	MacDisplayKit: exp1037: stop hevc hdr scan after required sei
1038	104.38	discard	MacDisplayKit=434c14d5b935daaba0b841d0565ae6733fcace40	MacDisplayKit: exp1038: stream hevc hdr sei presence parsing
1039	103.54	discard	MacDisplayKit=a10229a03dad2d9c0280788ce7ce8317223f4847	MacDisplayKit: exp1039: use single-sample timing fast path
1040	104.17	discard	MacDisplayKit=8fd8378215237e79247ac7973ee4bf3429d82a52	MacDisplayKit: exp1040: reuse hdr format description when primaries match
1041	104.38	discard	MacDisplayKit=7564a12eb96875b86c6ef0d4bfc47eaa996ebbce	MacDisplayKit: exp1041: fill hevc augmented payload in one pass
1042	104.38	discard	MacDisplayKit=e7b369e33c3b0ad08f4156d44e8252d81450d009	MacDisplayKit: exp1042: prefer contiguous hevc hdr payload scans
1043	104.17	discard	MacDisplayKit=d65a9c23183112a7eb5d82d0167f4dd5982da1dc	MacDisplayKit: exp1043: copy hevc rewrite payload only once
1044		crash	Lumen=b4fdd859ea898fe0b72aad283f6ceee698240345	Lumen: exp1044: keep hdr overlay base encode sdr
1045	104.17	discard	MacDisplayKit=a74fb733b53993a42aad8005f193151ac7871ed0	MacDisplayKit: exp1045: fast-path format-signaled hdr frames
1046	104.17	discard	Lumen=d07d7a88fc49b51f907d61e0d04fb2dce350c0d4,MacDisplayKit=980135033e8b66906b3c6fddeeb5750b2a0ece7f	Lumen: exp1046: omit overlay static hdr metadata | MacDisplayKit: exp1046: skip overlay static hdr augmentation
1047	104.17	discard	Lumen=d43ced436cb561d3a70ba5a0b75742e33a688801	Lumen: exp1047: reuse negotiated hdr signal in bridge
1048	104.38	discard	Lumen=ec9614cb3fe4799554f186adbbf076aa8a779054,MacDisplayKit=ddbc6cdb06f6f288d4bcc717b2495849b3c0924e	Lumen: exp1048: mark overlay hdr metadata as side-channel | MacDisplayKit: exp1048: raise overlay pq hevc realtime ceiling
1049	101.67	discard	Lumen=901818a95d4e21b2ff7ffafcbc9bbf3d5c7bf5b3	Lumen: exp1049: reopen partial hdr hevc input auto
1050	104.38	discard	Lumen=12662b83326bc4cf053d2b6ce7573c0b5de66966	Lumen: exp1050: drop overlay default hdr metadata
1051	104.17	discard	MacDisplayKit=29190fd2e97d79a84ee44b27107064025c29fa9f	MacDisplayKit: exp1051: trim prores pending slack to seven
1052	104.17	discard	MacDisplayKit=5378b6241d2435f0f34a869394379d95359b7ef9	MacDisplayKit: exp1052: skip complete hdr extension scans
1053	104.17	discard	MacDisplayKit=ca525965644b67f0fea8c49c0c7e2890f9632a62	MacDisplayKit: exp1053: async output bookkeeping
1054	104.17	discard	MacDisplayKit=11d4fc9037d304fd4a2f78eee23af7102660462a	MacDisplayKit: exp1054: raise q1 pq hevc pending budget
1055	104.17	discard	MacDisplayKit=566a7bba2d9617d1fad3a6a319872c67390ea56c	MacDisplayKit: exp1055: bypass hevc yuv cursor staging
1056	104.38	discard	MacDisplayKit=197d8d7e1f715b317ba61a21002445bda85dfee4	MacDisplayKit: exp1056: keep direct frames as replay source
1057	104.17	discard	MacDisplayKit=15cefdc22e9dad4d1251aecc3ea3c1b74ba00632	MacDisplayKit: exp1057: disable prores synthetic replay
1058	104.17	discard	MacDisplayKit=91a5268384b191a83863de72fb96ffd1b9f5f662	MacDisplayKit: exp1058: disable prores idle replay
1059	104.17	discard	Lumen=168198dbc820ef63bdc0df311fb56070f7ee5517	Lumen: exp1059: keep overlay pq in display p3
1060	95.62	discard	Lumen=92bebdfe6f14ff4eb3c8a43be63b4e541ccc6524	Lumen: exp1060: encode overlay hdr as hlg
1061	104.17	discard	MacDisplayKit=e49458018a86dac9c7dec8cae6897a3c84284920	MacDisplayKit: experiment: cap hevc direct wrapper cache at two surfaces
1062	104.17	discard	MacDisplayKit=97756c9c672cb88ff5a615708209c0c8abaff5c4	MacDisplayKit: experiment: materialize hevc hdr buffers before submit
1063	104.38	discard	MacDisplayKit=497004da0c6b6aab6cb86e669295d6c7e5a1bbcc	MacDisplayKit: experiment: disable hevc realtime vt hint
1064	94.29	discard	MacDisplayKit=152a6123aeef37dba4f4a9cb6ca88e9496e3de95	MacDisplayKit: experiment: defer direct source release on vt backlog
1065	104.17	discard	MacDisplayKit=2c7c6517e8cc6eb79e391f4197da105f116af1a1	MacDisplayKit: experiment: bypass cursor staging on hevc hdr direct path
1066	104.17	discard	MacDisplayKit=1e2a8d454d10752274f11888ff2abb567e65cb89	MacDisplayKit: experiment: limit hevc replay gate to startup
1067	104.17	discard	MacDisplayKit=0f3584dcf7402167d4d0bc0d1951484534da30cd	MacDisplayKit: experiment: trim replay cursor payload
1068	104.38	discard	MacDisplayKit=da4b122ca0f47fad977001bf37f81ae8e0a00451	MacDisplayKit: experiment: strip replay source surface refs
1069	104.38	discard	Lumen=1d76d9558fbab949687466b93d92faf0dbbc418d	Lumen: experiment: let overlay hevc capture format autotune
1070	25.0	discard	Lumen=c2cb01a552482384dc14b1104d9008d6fa31e975,MacDisplayKit=fe69e00fba8e3c6c65d2c8e836e50f8eb5e33300	Lumen: exp1070: split overlay hevc source autotune | MacDisplayKit: exp1070: separate skylight source pixel strategy
1071	75.42	discard	Lumen=60ebbddc6f735fe9d49a72df9290849aff59bc1b	Lumen: exp1071: keep overlay hevc base encode sdr
1072	95.42	discard	Lumen=27c517bb8be39c966b4f1781e5f7b77c122ec408,MacDisplayKit=98a458a45d2051f6433db4a64c357338a4240853	Lumen: exp1072: enable overlay hevc low-latency rc | MacDisplayKit: exp1072: thread low-latency rc override
1073	95.83	discard	Lumen=b117c0c22ed824ca5eaf943d4c793dfc2730f872,MacDisplayKit=7c61e31f7428b5fecb72bf50750f30e709bad339	Lumen: exp1073: retain max realtime hint for overlay llrc | MacDisplayKit: exp1073: keep realtime hint with llrc override
1074	95.42	discard	Lumen=9284d193b285c6153fdcec049119058207c6fc9f,MacDisplayKit=7294c4e6d40d6ec7751f8408d921085d9287f9e4	Lumen: exp1074: force overlay hevc llrc with zero vbv delay | MacDisplayKit: exp1074: force overlay hevc llrc with zero vbv delay
1075	104.17	discard	MacDisplayKit=b3b47e381753ee76873020cd28c1982e20f2cf66	MacDisplayKit: exp1075: skip redundant hdr attachment writes
1076	104.38	discard	MacDisplayKit=c8d1c14d67201eb20566336deeeea7c86ee6a9c7	MacDisplayKit: exp1076: split hdr signal checks from full validation
1077	104.38	discard	MacDisplayKit=3b1e7e359bed38d48f02396fe07158d2061ad7ca	MacDisplayKit: exp1077: raise hevc realtime ceiling to 228hz
1078	104.17	discard	MacDisplayKit=88c68e07e67c580d8e698c1844833de43cab11b2	MacDisplayKit: exp1078: lower hevc realtime ceiling to 224hz
1079	104.17	discard	MacDisplayKit=d94e9ff0b6d4f2a418024c247efbb6274592af24	MacDisplayKit: exp1079: retune hevc synthetic replay to 147hz
1080	104.38	discard	MacDisplayKit=99a5756bcced41977ba51f9c2456efabb0221c71	MacDisplayKit: exp1080: disable hevc direct wrapper cache
1081	104.17	discard	MacDisplayKit=463f2944f950008ca2a78120e475585c82ca470a	MacDisplayKit: exp1081: lower hevc realtime ceiling to 223hz
1082	104.17	discard	MacDisplayKit=25464f1215ab1da900968cfa68bfb0a9de99cb01	MacDisplayKit: exp1082: relax prores replay cadence to 110hz
1083	104.38	discard	MacDisplayKit=cb7624fda6b76ae2e079fd8eefafbc21ad0523a0	MacDisplayKit: exp1083: relax prores replay cadence to 100hz
1084	104.17	discard	MacDisplayKit=de93071d4c321ec8de25c3eb4baa87a8e4c277b6	MacDisplayKit: exp1084: raise prores replay cadence to 132hz
1085	104.38	discard	MacDisplayKit=e5b8085fd3cefba929067ac2ee37820e4938a484	MacDisplayKit: exp1085: relax prores replay cadence to 90hz
1086	104.17	discard	MacDisplayKit=6536ea7495928f4b272ed07527f1cf30472bd899	MacDisplayKit: exp1086: raise prores replay cadence to 126hz
1087	104.17	discard	MacDisplayKit=8a8b21a811280e0622beb5a9c6611b3ed7dcb657	MacDisplayKit: exp1087: skip direct overlay hdr buffer apply
1088	104.38	discard	MacDisplayKit=01681a1c6e4f4a65780e084bed357e28d8d29c0f	MacDisplayKit: exp1088: clear overlay x420 source primaries
1089	104.17	discard	MacDisplayKit=aa309aec58fc83c23d4ebbb7fad12072ada51b1f	MacDisplayKit: exp1089: request x420 overlay matrix
1090	104.38	discard	Lumen=bccab60e34670983729f612b62003a03976b4e00	Lumen: exp1090: disable overlay vt hdr insertion
1091	104.38	discard	Lumen=21a26bafcc7fa1acc24f394b4ca1b7634b45d4b3	Lumen: exp1091: relax overlay capability gate
1092	104.17	discard	Lumen=af85b7396b115a3dbd3f4d3fa573dc6b21fb0a17	Lumen: exp1092: keep overlay hdr cll only
1093	104.17	discard	MacDisplayKit=f4a2d94359686f92e9aeb746749011c4a90f15db	MacDisplayKit: exp1093: prioritize fresh mailbox retention
1094	104.38	discard	MacDisplayKit=d91955c8ca1eea2b98f96b14ea7326091ed92036	MacDisplayKit: exp1094: defer overlay hdr payload probes
1095	104.38	discard	Lumen=9d0ae17c15636be177b0e7bc0f6658fba8b0466e	Lumen: exp1095: cache ingress payload size
1096	104.17	discard	Lumen=f797a58fad62aca619e1acf9b02decc3772d2f66	Lumen: exp1096: prefer fresh ingress collapse
1097	25.0	discard	MacDisplayKit=218ed51d6320ef268e9276d7faf803416c0b013a	MacDisplayKit: exp1097: allow native skylight hdr format
1098	104.38	discard	MacDisplayKit=4bc5c17a938019bdb16c05737cbac58883ef88a5	MacDisplayKit: exp1098: pre-tag videotoolbox input buffers for hdr
1099	96.25	discard	MacDisplayKit=bb2f76787e509eae643773aa1be0e9ed22a5025f	MacDisplayKit: exp1099: slow synthetic hdr replay cadence
1100	104.38	discard	MacDisplayKit=69e857a795d33f3564ce744bbc7484e932309b55	MacDisplayKit: exp1100: prioritize fresh frames in source mailbox
1101	104.17	discard	MacDisplayKit=03d473949b4bc410f7e7da01019a1944768b067f	MacDisplayKit: exp1101: tighten hdr callback pending budget
