experiment	commit	metric	status	description
153	104.38	discard	MacDisplayKit=e0330b648155710cb410cac394ae00e03304585a	MacDisplayKit: exp153: skip hevc dirty-rect decode when diagnostics are off
154	104.17	discard	MacDisplayKit=14adccbbf483d3e3c7248e407273a8ec1d0c6125	MacDisplayKit: exp154: decode dirty rects only for fresh frames
155	104.17	discard	MacDisplayKit=4f23b1bcd53c49d171194bf47fde1360b86034ec	MacDisplayKit: exp155: build skylight frames outside replay lock
156	104.17	discard	MacDisplayKit=6e94cbb736c100677e544a2adb2864ca2bef76ad	MacDisplayKit: exp156: skip non-fresh dirty-rect decode
157	104.38	discard	MacDisplayKit=e23cf81a09b2215194113ccafcc84c669ed392a8	MacDisplayKit: exp157: submit original capture frame to encode queue
158	104.38	discard	MacDisplayKit=c6e68080818e193c9a2bb5d0c4dc5db52d1da492	MacDisplayKit: exp158: disable hot-path source diagnostics for prores
159	104.38	discard	MacDisplayKit=67e6fa91d173f1b5d7b807f05fd33024100f8384	MacDisplayKit: exp159: release staged vt slots without queue hop
160	104.17	discard	MacDisplayKit=7c7358f6c0f349c5cbc482d0266fd8fb783adbe9	MacDisplayKit: exp160: allow one pending frame before replay suppression
161	104.17	discard	MacDisplayKit=22a77cbbb6129bff7d99069f79b2c67c74ea3b8f	MacDisplayKit: exp161: cache hdr attachments per buffer
162	104.17	discard	MacDisplayKit=d67ee43125e7460571bb3e9cf6c32d1021558e4c	MacDisplayKit: exp162: use work-item autorelease on vt output queue
163	25.0	discard	MacDisplayKit=4a50165a8bb0f648a7408ab351db76552a826384	MacDisplayKit: exp163: pin hevc suggested lookahead to one
164	104.38	discard	MacDisplayKit=bd94198e76348df05bb7689f484741dcebe0fbbe	MacDisplayKit: exp164: tighten hevc replay timer leeway slightly
165	104.38	discard	MacDisplayKit=9e0f205588538c0e435ec69beda8277387d51597	MacDisplayKit: exp165: shift hevc replay startup to thirteen sixteenths
166	104.17	discard	MacDisplayKit=309e3b64c98c0297824c51ec6013876deb31c2a1	MacDisplayKit: exp166: shift hevc replay startup to fifteen sixteenths
167	104.38	discard	MacDisplayKit=a34a7048fee5afd93ad2a4a8da59a2697f2806a6	MacDisplayKit: exp167: use work-item autorelease on vt encode queue
168	104.17	discard	MacDisplayKit=714bc5eedc652b5b40f0b80b7a0d1f9a4ac22ac8	MacDisplayKit: exp168: serialize staged vt submit handoff
169	104.38	discard	MacDisplayKit=29253f4110cba624054f13048d88abf6fd5ebb4f	MacDisplayKit: exp169: make vt submitted-frame accounting async
170	104.17	discard	MacDisplayKit=e3190968ebab97df6f4b2049701b5975f68d05e6	MacDisplayKit: exp170: make vt processing accounting async
171	104.38	discard	MacDisplayKit=318238de2d3c7d28993cb2301c159355bd85029e	MacDisplayKit: exp171: raise mailbox continuation task priority
172	104.17	discard	MacDisplayKit=828b6e4aa6191328ad3d850aa934e9962b27d8b1	MacDisplayKit: exp172: lower mailbox drop bookkeeping priority
173	104.38	discard	MacDisplayKit=1a7c565d4053a3521d4196668a79c7f4c78f1334	MacDisplayKit: exp173: use unfair lock for pending tracker
174	104.17	discard	MacDisplayKit=9f74382a9569a77134a2aba68459c4c843d5e36e	MacDisplayKit: exp174: drop skylight replay lock on delivery queue
175		crash	MacDisplayKit=63b2eefd2d4c58d185ae38fa7f97eb90b066164d	MacDisplayKit: exp175: use unfair lock for skylight replay state
176	104.38	discard	MacDisplayKit=e2afa89270bfd0f3f0d28dea08df6e8f7be54605	MacDisplayKit: exp176: prewrap skylight surfaces for unfair replay lock
177	104.38	discard	MacDisplayKit=dd49047c47573800ddaa52064c4091a70cb09d95	MacDisplayKit: exp177: restore default hevc vbv initial delay
178	104.38	discard	MacDisplayKit=1061e2b2110c6128a216f1387fa5aac290302dc3	MacDisplayKit: exp178: enable hevc vbv buffer on 240hz path
179	104.17	discard	MacDisplayKit=a1c85836d7ff38d11beabdfd537549891408d4c7	MacDisplayKit: exp179: disable source timing tracker on 120hz callbacks
180	104.17	discard	MacDisplayKit=20d508ba3d42ae6d23ffb743a57030fa3e258e87	MacDisplayKit: exp180: pair hevc vbv buffer with default delay
181	104.38	discard	MacDisplayKit=572ef99431d2df7d989f8a98c649359084e10f64	MacDisplayKit: exp181: pair hevc realtime ceiling with target duration
182	104.38	discard	MacDisplayKit=7e513264b1bab5caf0e48eaa8d593e0e009ba463	MacDisplayKit: exp182: pair hevc target duration with relaxed burst
183	104.38	discard	MacDisplayKit=310a3b8014d56bb49f99279589d8dcc423082833	MacDisplayKit: exp183: disable hevc end reserve hint
184	104.17	discard	MacDisplayKit=b9143ebc1e454d507e982e4447d525cba7e3b41a	MacDisplayKit: exp184: widen hevc quarter burst to relaxed level
185	104.38	discard	MacDisplayKit=b5d3552d1a2c214654c1970a484b8ec034f1b34c	MacDisplayKit: exp185: suppress hevc source saturation events
186	104.17	discard	MacDisplayKit=b1214ddf3f3bc37b5e5f81a4d2cef526fa7e8b20	MacDisplayKit: exp186: pair hevc default frame delay with relaxed burst
187	104.38	discard	MacDisplayKit=1011b61734a2773f95d7ea54071c19db939f54d5	MacDisplayKit: exp187: collapse vt bookkeeping queue hops
188	104.17	discard	MacDisplayKit=394d5ea12ea29cd667eb5957d6967004525be6c7	MacDisplayKit: exp567: pair slot release with encode autorelease
189	104.38	discard	MacDisplayKit=11090811f837dccc2b49d8e5de4e85a59928e99c	MacDisplayKit: exp568: pair submit accounting with encode autorelease
190	104.38	discard	MacDisplayKit=db88d23b6078b0010b21dc0a9bd2047161595eaa	MacDisplayKit: exp569: lower hevc realtime ceiling to 180hz
191	104.17	discard	MacDisplayKit=61849b2555c9f4143d93e3cc8535f408442e3c36	MacDisplayKit: exp570: pair startup ceiling with slot release
192	104.17	discard	MacDisplayKit=9226486d1101b33c5901f5033c6eea9d469de37d	MacDisplayKit: exp571: pair startup ceiling with async submit accounting
193	104.38	discard	MacDisplayKit=5fd99e164eb279165529f7f652c40d38e7a879c6	MacDisplayKit: exp572: pair startup ceiling with encode autorelease
194	104.17	discard	MacDisplayKit=1100e657bfc0f823b39fb34bcfb2a414d982f97d	MacDisplayKit: exp573: pair startup ceiling with drop suppression
195	104.17	discard	MacDisplayKit=7cb4e933440ae49c1d8ad77c969f9e2f1f9be3c4	MacDisplayKit: exp574: pair drop suppression with encode autorelease
196	104.38	discard	MacDisplayKit=7d4ed40d75deb3e5aaa0b13acdb0c0300d15898f	MacDisplayKit: exp575: pair drop suppression with async submit accounting
197	101.13	discard	MacDisplayKit=d987643f6dddf8dcb1133fa94899b9f055de531b	MacDisplayKit: exp576: pair strict replay timer with unfair lock
198	103.96	discard	MacDisplayKit=2f7f30952113dbf40343bf6c753b16f27d854209	MacDisplayKit: exp577: pair strict timer with drop suppression
199	101.04	discard	MacDisplayKit=bd5ee30f7816d113b3c7fcd2e78288a46bc97433	MacDisplayKit: exp578: suppress startup hevc recovery replay
199	99.58	discard	MacDisplayKit=bd5ee30f7816d113b3c7fcd2e78288a46bc97433	MacDisplayKit: exp578: suppress startup hevc recovery replay
200	25.0	discard	MacDisplayKit=143e830a4acd8368a7d3a2251ab020d41cecead2	MacDisplayKit: exp579: narrow hevc bootstrap to baseline q2
200	25.0	discard	MacDisplayKit=143e830a4acd8368a7d3a2251ab020d41cecead2	MacDisplayKit: exp579: narrow hevc bootstrap to baseline q2
201	25.0	discard	MacDisplayKit=d466279ff01c7278bfc0c960f76d617668a4476b	MacDisplayKit: exp580: prime hevc control plane with displaystream probe
202	104.38	discard	MacDisplayKit=2bc0df53fbf6f1033b56c9083b43849b825387a9	MacDisplayKit: exp581: defer hevc proxy prime past startup
203	104.17	discard	MacDisplayKit=d24c3956c80f2be9db0c9b25d45f55ca3cfc79e0	MacDisplayKit: exp582: prime hevc proxy on first fresh frame
204	104.38	discard	MacDisplayKit=67c1fe0928dfab5b6e71239f63380269a99c59d8	MacDisplayKit: exp583: time the hevc proxy prime for 120hz
205	25.0	discard	MacDisplayKit=70a1c21dbb60ac34fd0f34c9baa0c94fd48b8282	MacDisplayKit: exp584: use stronger hevc proxy prime contract
206	104.17	discard	Lumen=82effe61f462e78986114cd66c53bf938949067a,MacDisplayKit=e092e14f91a270916ae245ddda71e1c00bb5add8	Lumen: exp206: bound core event messages | MacDisplayKit: exp206: retry stronger hevc proxy prime
207		discard	MacDisplayKit=06f6c0b6b946b097992317d5d6c55faf3929ea80	reverted out-of-scope change in MacDisplayKit: Sources/MacDisplayKitObjCShim/Internal/MDKObjCShim.mm, Sources/MacDisplayKitObjCShim/Public/MDKObjCShim.h
208	104.17	discard	MacDisplayKit=28dabba53d91ecbbd4236840cbf51f0e89f8e424	MacDisplayKit: exp208: skip hevc dirty rect decode
209	103.35	discard	MacDisplayKit=0c3f7baa3eb8a6f73d6c8cc3f2ab4eea3c08ca1c	MacDisplayKit: exp209: inline hevc source callback delivery
210	104.17	discard	MacDisplayKit=e0d39a55b683c0a0e73547720344c0b8d293364a	MacDisplayKit: exp210: split hevc replay queue
211	104.17	discard	MacDisplayKit=89ddd8024295b875179dc6e0ebf2e01749afff86	MacDisplayKit: exp211: drop replay mailbox under hevc pressure
212	104.17	discard	MacDisplayKit=b0c638037f63a9e0e8c08c8c5625d40eb4e10cbc	MacDisplayKit: exp212: set hevc source slack to seven
213	104.0	discard	Lumen=16e0862912141e3ca5a2987126a25c181183b136	Lumen: exp213: prefer x422 capture for overlay prores
214	104.17	discard	Lumen=c5ffdf2f17acf5132627a1dac4acc413e0871ebb	Lumen: exp214: keep overlay prores input auto
215	93.5	discard	Lumen=06a21ffa27441377ab629152425e12e45b0e357d	Lumen: exp215: pair overlay prores x422 with auto input
216	104.17	discard	MacDisplayKit=3c07a0e1d2c66f24a7f4a1d34d859fff10170204	MacDisplayKit: exp216: allow direct overlay prores passthrough
217	104.38	discard	MacDisplayKit=46a19875547e26ac4c694475b5a8bdab6e6cf559	MacDisplayKit: exp217: cache skylight capture surfaces
218	102.08	discard	MacDisplayKit=3c94dc3f0912cb733c6c7d06bd12575a7a45794d	MacDisplayKit: exp218: pair hevc vbr with vbv ceiling
219	104.17	discard	MacDisplayKit=571fd88578dac0a00aec37268110ce054ca91115	MacDisplayKit: exp219: decode dirty rects only for fresh frames
220	104.17	discard	MacDisplayKit=9a075ab2d88ce42ecfc7886e34644c5fc3513a63	MacDisplayKit: exp220: enable hevc startup reserve hint
221	104.38	discard	MacDisplayKit=43a35c25e2ad98e49495646c3886fc89b147629d	MacDisplayKit: exp221: drop hevc source frame diagnostics
222		crash	Lumen=14742f39b845c9084c577a3c4f19483039164f03	Lumen: exp222: reopen hevc overlay input auto
223	104.17	discard	MacDisplayKit=ea94298d3aea3478bcc5ceee5dcb15ba6a125dd3	MacDisplayKit: exp223: skip redundant hevc hdr payload copies
224	104.17	discard	MacDisplayKit=fbde23d32ccd12f3cf6562bd3da4d62e247c9079	MacDisplayKit: exp224: fast-path encoded hdr signaling
225	104.17	discard	MacDisplayKit=5e0ccff3566c7bfb4884ac196c8726599bbc77ff	MacDisplayKit: exp225: relax hevc replay suppression
226	104.17	discard	MacDisplayKit=0fd2199e5c429180ee75ed94674812d6fa147953	MacDisplayKit: exp226: cache hevc hdr format descriptions
227	104.17	discard	MacDisplayKit=34d1b8329d0eaf3c8b96a66b692e516009ed53f6	MacDisplayKit: exp227: default hevc power efficiency hint
228	104.38	discard	MacDisplayKit=0d60bfce8a088fcd100ceb21e929acbafa71a719	MacDisplayKit: exp228: gate hevc startup replay on vt parallelism
229	104.17	discard	MacDisplayKit=ab0cb00728d0ddf234e8d013b6ec16e430521dc1	MacDisplayKit: exp229: soften hevc realtime ceiling to 216hz
230	104.38	discard	MacDisplayKit=1c45c74f4988027d399074cead2de8c245565843	MacDisplayKit: exp230: relax vt startup replay warmup
231	104.17	discard	MacDisplayKit=74e39941cab3022277ce325cfe868dbdbc8f19a3	MacDisplayKit: exp231: tune hevc synthetic replay to 145hz
232	104.17	discard	MacDisplayKit=1d77409927138cdc5e81252bb73306bae56cd550	MacDisplayKit: exp232: tune hevc replay leeway to sixth
233	104.17	discard	MacDisplayKit=a2c2851a128bc36daa738f69fa2c1624b1c8fb50	MacDisplayKit: exp233: cache hdr validation per frame
234	104.38	discard	MacDisplayKit=34dbfced89959e99d36877fca47d0a0f96090ee3	MacDisplayKit: exp234: skip hevc source drop metadata
235	104.17	discard	MacDisplayKit=772e5e6ce5c3a8a8ca2bf2c3645c4549d07c7d19	MacDisplayKit: exp235: pair hevc source trims with surface cache
236	104.17	discard	MacDisplayKit=39e8a4b7142e7f3e0c73f41643d013ee9349f228	MacDisplayKit: exp236: pair startup replay warmup with surface cache
237	104.38	discard	MacDisplayKit=6f0b394a3996a7a95b2b23ac2041b8bf1e01fd3b	MacDisplayKit: exp237: pair hevc startup replay gate with source trim
238	104.38	discard	MacDisplayKit=fcaf9e3b8ed2a8f5a7ad3ee6d396a443b4dcd9a4	MacDisplayKit: exp238: pair hevc replay gate with source trim
239	25.0	discard	MacDisplayKit=d90742e083559073073a64eccd5db5b79f1d85cb	MacDisplayKit: exp239: prime hevc proxy with receive-only minimal
240	25.0	discard	MacDisplayKit=d09adf08819b5984630238a38072d0ee7c43cf30	MacDisplayKit: exp240: prime hevc proxy with rectless profile
241	25.0	discard	MacDisplayKit=46aa8113d0e78eb0a4e9f6c45a745fd460209a46	MacDisplayKit: exp241: pair timed proxy prime with source trim
242	25.0	discard	MacDisplayKit=645dfa43561679975e7a3411e52a4573c5605c06	MacDisplayKit: exp242: pair timed proxy prime with startup gate
243	100.83	discard	MacDisplayKit=2e392865fa75bb96d6850a8ae83460508dad7486	MacDisplayKit: exp243: pair skylight cache with source trim
244	101.67	discard	MacDisplayKit=30071ffe0e6e1a12f8812563ce5f96e7271a9a51	MacDisplayKit: exp244: pair prores source trim with hevc startup gate
245	102.08	discard	MacDisplayKit=02927d22017c0f0d12dcf5dc6009669d9883276e	MacDisplayKit: exp245: pair skylight cache with prores source trim
246	101.25	discard	MacDisplayKit=75dce786b49834ca04b995652d4b65808af3c981	MacDisplayKit: exp246: pair source trim policies across codecs
247	101.46	discard	MacDisplayKit=8f4925df02150196286149b8be800ec1bca717c4	MacDisplayKit: exp247: use unfair lock for replay state
248	101.46	discard	MacDisplayKit=53de0b213fa9ebb74a16f2b0f758adc78ff2022b	MacDisplayKit: exp248: pair hevc drop trim with surface cache
249	100.62	discard	MacDisplayKit=200feceb08a08d175cda208ee7120efe59df8fa6	MacDisplayKit: exp249: pair pending lock with startup gate
250	101.88	discard	MacDisplayKit=333e7f87c94ab7b9445e3f0c69b32834af8fab81	MacDisplayKit: exp250: pair pending lock with surface cache
251	101.67	discard	MacDisplayKit=005a773add75b19eedb2cf488ab4040ab6c8c327	MacDisplayKit: exp251: pair pending lock with prores source trim
252	101.04	discard	MacDisplayKit=277476a3098a5e9a59a1c8f8edfb9b77bfbe8da3	MacDisplayKit: exp252: pair default frame delay with startup gate
253	100.21	discard	MacDisplayKit=100388b5697050a35935ab5b12b54f2ae38a5da9	MacDisplayKit: exp253: pair default frame delay with submit trim
254	101.04	discard	MacDisplayKit=2e1af2ba7960925596b2e28d2c9b01b1af635e26	MacDisplayKit: exp255: pair strict replay timer with startup gate
255	101.88	discard	MacDisplayKit=61d100a7fbd8222c6c881c369e4ba5a9d1cca3a7	MacDisplayKit: exp255: release staged vt slots immediately
256	101.67	discard	MacDisplayKit=9f8ab0fa900d2357faa0bdabedb5d0eb589d6083	MacDisplayKit: exp256: pair source trim with direct handoff
257	101.25	discard	MacDisplayKit=434d0e2593ef7bfbbab78fcf41ff79679651cfea	MacDisplayKit: exp257: pair source trim with encode autorelease
258	101.04	discard	MacDisplayKit=e06afc8eabba2a1f7422b9b6580ae57d70fb0768	MacDisplayKit: exp258: pair direct handoff with encode autorelease
259	101.25	discard	MacDisplayKit=6b6da423ce4186c9ad3260543e79791b3e157c7c	MacDisplayKit: exp259: pair strict timer with direct handoff
260	101.46	discard	MacDisplayKit=9114f5b0fdf948afecb35eae4340912bec79224c	MacDisplayKit: exp260: pair mailbox priority with direct handoff
261	101.04	discard	MacDisplayKit=9cb47f6c8d719fab433c4bf977f9264c90e4e147	MacDisplayKit: exp261: pair mailbox priority with encode autorelease
262	101.04	discard	MacDisplayKit=e56e3113bfa8378649b22f15e891552a5f8de939	MacDisplayKit: exp262: pair strict timer with mailbox priority
263	101.88	discard	MacDisplayKit=e8c9a99e3de9e35f4d7d26ae335dfcaeae41d6fd	MacDisplayKit: exp263: pair mailbox priority with slot release
264	102.71	discard	MacDisplayKit=927cabfbe1d17a2b1841bf571622784d237779d9	MacDisplayKit: exp264: pair strict timer with encode autorelease
265	102.29	discard	MacDisplayKit=edb21020cdcb43aa6c19f56b193ab689ce408b22	MacDisplayKit: exp265: pair strict timer with submit accounting
266	102.08	discard	MacDisplayKit=6bb8b6d6485d30c0188a08f3d6c21f4814fa165e	MacDisplayKit: exp266: pair startup ceiling with mailbox priority
267	101.88	discard	MacDisplayKit=d77903763205b33b1bf15795471d338748cc6d15	MacDisplayKit: exp267: pair submit accounting with mailbox priority
268	101.67	discard	MacDisplayKit=496090ff4ff7ace13e1f7010eb210a2038d9799d	MacDisplayKit: exp268: pair startup replay gate with submit accounting
269	101.88	discard	MacDisplayKit=a21e357150dd71bf2719e72eaece5414fb96e4bd	MacDisplayKit: exp269: pair relaxed startup warmup with source trim
270	102.08	discard	MacDisplayKit=bf71bc24e5fd403b4dd5430e5febf304dcb001ed	MacDisplayKit: exp270: pair relaxed warmup with drop metadata trim
271	102.08	discard	MacDisplayKit=bab273c453936218a1a79dbc6e4963fd19c66216	MacDisplayKit: exp271: pair submit accounting with drop metadata trim
272	101.67	discard	MacDisplayKit=a057e06610ed240c4179edcf3324a5aa8bfc9e19	MacDisplayKit: exp272: pair relaxed warmup with submit accounting
273	101.46	discard	MacDisplayKit=6d78122e38c922d4511a8229bb3d6cd09e7edbf4	MacDisplayKit: exp273: cache skylight surfaces on hint baseline
274	25.0	discard	MacDisplayKit=4b5171714ea6cef8c4be0ba094b594bbd0350349	MacDisplayKit: exp274: suggest hevc lookahead of two
275	100.83	discard	MacDisplayKit=5f58cebdd8c9feb0caa9a646c0e119bb9a58bd37	MacDisplayKit: exp275: pair target cadence with unfair lock
276	101.04	discard	MacDisplayKit=ffcef0c2becd23c7a3b687373164fa5d2f24ec06	MacDisplayKit: exp276: pair strict replay timer with source trim
277	101.67	discard	MacDisplayKit=dd80385eb4a347e823561cd2c776209da42400a5	MacDisplayKit: exp277: pair unfair pending with slot release
278	101.88	discard	MacDisplayKit=5bb3ccc27e9cbc723a8105dcf6f92a1331c002ee	MacDisplayKit: exp278: pair direct frame handoff with drop trim
279	101.25	discard	MacDisplayKit=78011055a347cb0eb0e3fde36d8968e75b3262c3	MacDisplayKit: exp279: pair startup reserve with source trim
280	101.67	discard	MacDisplayKit=1302a619cd157d224f43a7a4dc9d4239939287ff	MacDisplayKit: exp280: pair unfair pending with source trim
281	100.83	discard	MacDisplayKit=0dda9a36ccc641024776faa379721ba20d552ca3	MacDisplayKit: exp281: pair startup reserve with warmup
282	102.5	discard	MacDisplayKit=2e8df34e53d1e2ead34306a6b26dd9e2e96cb3c2	MacDisplayKit: exp282: disable prores hot-path source diagnostics
283	101.88	discard	MacDisplayKit=d8ffb972e4d24da27852d5d97d445f7d2433c485	MacDisplayKit: exp283: use unfair lock for pending tracker
284	102.08	discard	MacDisplayKit=f9e0f8786667a8453d592388fd63a0beb5a0d484	MacDisplayKit: exp284: trim prores callback pending slack
285	102.71	discard	MacDisplayKit=08c584cdb898dae8136d2b9041c6ab7a7cd115a7	MacDisplayKit: exp285: relax vt startup replay warmup
286	102.08	discard	MacDisplayKit=7d507d58b06112025d034984a9524051b96c624e	MacDisplayKit: exp286: pair prores trim with warmup
287	101.25	discard	MacDisplayKit=3a0c2c055e8f9a84902e3bd9b74b695aafd94238	MacDisplayKit: exp287: gate hevc startup replay on vt parallelism
288	102.08	discard	MacDisplayKit=b7aeaea21f0e83bccca36c8cbee257db99c13c00	MacDisplayKit: exp288: trim replay dirty metadata
289	101.04	discard	MacDisplayKit=2f40637d373623a00c6f9992dd15bb02a44282a0	MacDisplayKit: exp289: pair surface prewrap with direct handoff
290	102.29	discard	MacDisplayKit=bde25efc8529109b77e273aa65009713f5dddc59	MacDisplayKit: exp290: pair surface cache with startup replay gate
291	101.04	discard	MacDisplayKit=7abcb379d28f22cdf849eba3f648249b0492cfdc	MacDisplayKit: exp291: pair surface cache with vt hop collapse
292	101.67	discard	MacDisplayKit=0f31c3dca0eadc225cd4e323e2d55c543b9f30b6	MacDisplayKit: exp292: pair surface cache with slot release
293	101.25	discard	MacDisplayKit=e78c979dc2655a002a0c0b52457b3fcad31a5b62	MacDisplayKit: exp293: align hot-path source diagnostics
294	101.67	discard	MacDisplayKit=88af7ae8adab32d5b9accea5eda288e135384182	MacDisplayKit: exp294: pair deferred proxy prime with lower ceiling
295	102.08	discard	MacDisplayKit=9169d0bcf965c44ff88e2c5340415e7c75a3e460	MacDisplayKit: exp295: pair timed prime with lower ceiling
296	101.67	discard	MacDisplayKit=193a7bb5e1073d6d15b910198a5b02885af3ca79	MacDisplayKit: exp296: pair tail reserve with drop suppression
297	102.92	discard	MacDisplayKit=50f1c7f071914efacacefe4077904e3b801e246a	MacDisplayKit: exp297: pair startup gate with encode autorelease
298	101.46	discard	MacDisplayKit=36cff53e1701f01746ea3a8bb26a36516cd5f667	MacDisplayKit: exp298: pair lower ceiling with encode autorelease
299	101.04	discard	MacDisplayKit=548ccf8e5fa42e40841a058951d4fa7c57decd87	MacDisplayKit: exp299: pair source trim with drop suppression
300	101.88	discard	MacDisplayKit=e5a2288044f3ded5ef2273e1686ce65dce58f9ac	MacDisplayKit: exp300: pair hdr transport caches
301	102.08	discard	MacDisplayKit=514284f715b8b57fe5a687f055d228dba603c022	MacDisplayKit: exp301: pair end reserve with encode autorelease
302	101.25	discard	MacDisplayKit=4159e071b136b83dafcfe70157eca5e13e53036b	MacDisplayKit: exp302: pair lower ceiling with end reserve
303	102.5	discard	MacDisplayKit=2ad575834455627d2b22a8e682fcbf2aeb3cae13	MacDisplayKit: exp303: pair surface cache with drop suppression
304	101.25	discard	MacDisplayKit=c9617cbd0ac6bd2b55dbc8b8867477bff7cd3a02	MacDisplayKit: exp304: pair unfair replay lock with vt hop collapse
305	101.04	discard	MacDisplayKit=29cc06679245d9b5baa7901818dc6a21cf35e0ee	MacDisplayKit: exp305: pair unfair replay lock with async submit accounting
306	101.25	discard	MacDisplayKit=2cda5c9e98328209fd17e7e88fdade7809544d30	MacDisplayKit: exp306: defer hevc proxy prime past startup
307	101.04	discard	MacDisplayKit=bc752be74b37b6cf97d3aee4d653a0d940a2d9d4	MacDisplayKit: exp307: skip hevc dirty-rect decode when diagnostics are off
308	100.83	discard	MacDisplayKit=6becf737ab0cc4a2bf6bf8d155d883d45ef55fcf	MacDisplayKit: exp308: gate hevc startup replay on vt parallelism
309	101.04	discard	MacDisplayKit=bd6da13d250077098297be63ee72b274d2171491	MacDisplayKit: exp309: drop hevc source frame diagnostics
310	101.04	discard	MacDisplayKit=000655f203b153040436447437185e09c5d08b7a	MacDisplayKit: exp310: use work-item autorelease on vt encode queue
