experiment	commit	metric	status	description
426	797737ce+1453ec1	discard	95.21	separating latest-wins coalescing from real dropped-frame failures eliminated the 425 stability penalty entirely, but the output-driven HEVC drain still landed at 49 frames with 390.162 ms startup and 42.847 ms average callback latency, so the remaining problem is startup/progression tuning inside the new credit model rather than event semantics
427	d1bf63a3+f2ea2ea	discard	95.21	raising output-driven HEVC warmup credits from 2 to 3 cut HEVC startup to 335.808 ms but left HEVC stuck at 49 frames and collapsed ProRes Proxy progression to 7 frames, so extra warmup depth destabilizes the shared runtime instead of improving the new drain model
428	779a68b9+ee20e50	discard	95.42	tightening the HEVC output-driven pending limit from 6 to 3 recovered HEVC to 50 frames without any stability penalty, but startup stayed at 356.676 ms and ProRes Proxy only reached 25 frames, so the new drain model still trails the 95.83 keep despite better backlog control
429	584b1a24+37e3fd6	discard	95.42	lowering the output-driven HEVC source pending limit from 3 to 2 improved startup to 311.729 ms and kept drop events at zero, but HEVC progression stayed capped at 50 frames and total score remained 95.42, so source-backlog tightening alone is no longer the limiting lever
430	da2289bf+c1cd3d1	discard	95.21	classifying current best mailbox replacements as coalesced events did not preserve the 404 progression path; HEVC fell to 49 frames and ProRes Proxy to 23 frames, so the remaining bottleneck is stale work inside the decoupled drain model rather than drop-event accounting on the old path
431	26d1bb21+3be98b7	discard	95.42	replacing the ordered-drain backlog with a single latest queued frame did not improve the official score; HEVC stayed at 50 frames with 42.430 ms average callback latency, so stale queued frames inside the coordinator are not the dominant limiter in the output-driven model
432	e4601f71+b40925e	discard	95.42	granting an extra drain credit immediately after successful HEVC submit when VT pending<=1 slightly improved startup but raised HEVC callback latency to 62.835 ms and still left progression at 50 frames, so steady-state post-submit credit grants overdrive the pipeline without lifting the official score
433	fa8ac29a+2477fcb	discard	90.21	limiting post-submit drain credits to bootstrap-only still poisoned the shared runtime: HEVC stayed at 50 frames but callback latency rose to 62.504 ms and ProRes Proxy fell to 25 frames with a 90.21 total score, so submit-return credit grants are the wrong control surface even when scoped to startup
434	430d31a	discard	83.42	actorizing the SkyLight source coordinator removed the serial delivery queue, but HEVC immediately picked up 6 drop events and collapsed to 83.42 despite the raw target-sized q2 source still measuring 115.40 fps locally, so source callback/replay actorization without a new ordering gate breaks the current keep path
435	5f5676b	discard	95.42	splitting the SkyLight source bookkeeping queue from the processor submit queue removed callback-path coupling without destabilizing the runtime, but HEVC stayed pinned at 50 frames with 335.476 ms startup and 101.433 ms average callback latency, so queue conflation is not the dominant remaining limiter
436\ta99dd2b\tdiscard\t95.42\tdecoupling encode-side bookkeeping from outputQueue.sync removed a plausible cross-queue diagnostic stall, but HEVC stayed pinned at 50 frames with 345.662 ms startup and 102.079 ms average callback latency while ProRes Proxy stayed at 25 frames, so output-queue bookkeeping is not the dominant limiter
437\tab5b230\tdiscard\t95.21\twidening the HEVC low-latency VBV buffer hint from full-HDR PQ only to all high-refresh HEVC paths made the selective-HDR-overlay runtime more conservative instead of faster: HEVC fell to 49 frames with 335.721 ms startup and 102.167 ms average callback latency, so the missing lever is not simply broader VBV buffering on the SDR-base overlay transport
438\t4bd2e8c\tdiscard\t25.00\tforcing detached staging for every high-refresh HEVC submit broke the current raw-SkyLight keep path outright: the official HEVC runtime probe crashed with String.init(cString:) null-termination failure before scoring, so unconditional detached same-format HEVC staging is not a valid structural upgrade on top of the 404 mailbox path
439\tc5b93f7\tdiscard\t95.42\twidening VT-pending-based immediate recovery replay suppression from PQ HDR HEVC to all high-refresh HEVC preserved stability and recovered HEVC to 50 frames, but startup regressed to 374.459 ms and ProRes Proxy fell to 21 frames, so the selective-HDR-overlay keep path still needs those synthetic recovery replays to land more aggressively than a blanket pending-frame suppressor allows
440	e1c26dac+07168cc	discard	build-fail	hybrid fresh-HEVC source-release deferral on callback backlog did not reach runtime measurement because CaptureVideoToolboxProcessing hit a Swift compiler failure around the deferred submission token path and Sendable capture, so this implementation form is closed before scoring
441	e1c26dac+be3183d	discard	95.21	gating fresh PQ HEVC source release on output backlog >=2 preserved stability but regressed the keep path to 49 HEVC frames at 336.037 ms startup and 103.064 ms average callback latency, so conditional callback-held source permits still reintroduce source choke before they reclaim meaningful encoder freshness
442	e1c26dac+59ffdb2	discard	95.21	adding VT MaximumRealTimeFrameRate on top of the existing 240 Hz ExpectedFrameRate/ExpectedDuration hint only trimmed startup to 308.587 ms while HEVC progression stayed pinned at 49 frames and ProRes Proxy slipped to 25 frames, so the remaining limiter is not missing maximum-submit-rate session metadata
443	886669e5+b4ec55c	discard	25.00	requesting VT HDRMetadataInsertionMode=RequestSDRRangePreservation for the sdr-base-hdr-overlay PQ/BT.2020 path preserved HEVC HDR signalling but left HEVC at 49 frames and caused the ProRes Proxy runtime probe to fail outright, so selective-HDR metadata insertion mode changes are not a safe performance lever on the current dual-codec path
444	bb1220d	discard	95.42	releasing the high-refresh direct PQ HEVC source permit immediately after IOSurface-to-CVPixelBuffer wrapping let the source path run ahead of submit, but official HEVC stayed capped at 50 frames while startup regressed to 407.056 ms and ProRes Proxy fell to 22 frames, so early direct-path permit release just overfeeds the existing submit contract without improving progression
445	195c947	discard	95.21	caching reused SkyLight IOSurface wrappers inside the replay state removed per-fresh-frame wrapper churn, but official HEVC regressed to 49 frames at 323.147 ms startup and ProRes Proxy fell to 20 frames, so wrapper allocation churn is not the dominant front-edge cost in the current production path
446	8b24ae9f+6785a42	discard	95.42	actor-based startup-burst output-driven HEVC drain with initial credits equal to the source pending depth still regressed to the same 50-frame plateau with 384.357 ms startup and 101.428 ms average callback latency, which means the extra actor enqueue handoff itself is enough to lose the 404 startup edge even before steady-state backpressure can help
447	8538c8f	discard	25.00	making high-refresh PQ HEVC submission fully asynchronous removed callback-thread blocking but immediately blew up source-side saturation with 53 HEVC drop events, collapsing the official score to 25.00, so callback release without an equally cheap bounded drain contract just trades submit blocking for mailbox churn
448	4276cf9	discard	95.21	queue-owned credit-driven latest-wins handoff removed the actor overhead and kept HEVC stable with zero drops while cutting callback latency to 42.78 ms, but progression stayed pinned at 49 frames with 337.531 ms startup, so the bounded queue contract is promising yet still too conservative at two credits to beat the 404 baseline
449	c087bdf	discard	95.00	widening the queue-owned HEVC drain from two credits to three kept stability intact but pushed progression down to 48 frames at 309.397 ms startup, so extra VT in-flight credit just adds stale work without buying any additional progression on the current contract
450	d3569fd	discard	25.00	forcing high-refresh HDR HEVC onto the GPU staged input path crashed the HEVC runtime probe with String.init(cString:) null-termination failure before scoring, which means the detached 10-bit staging contract is not even production-stable yet and cannot be used as the next path to 120 fps
451	846f6f1c	discard	25.00	making sdr-base-hdr-overlay use an SDR-base 8-bit HEVC path with logical overlay frame-state synthesis caused the official HEVC runtime probe to deliver zero frames and dropped the score to 25.00, so the current bridge/VT contract still depends on the full-frame 10-bit path for startup viability even though the overlay semantics are conceptually cleaner
452	7d8fa492	discard	25.00	keeping the Main10 input path but switching sdr-base-hdr-overlay bitstream signaling to SDR while synthesizing overlay HDR frame-state made the official runtime probe fail before HEVC progression could start, so the current runtime probe/startup contract is still coupled to the existing PQ overlay signaling path and this semantic split is not production-safe yet
453	fa5f5cb	keep	71.55	preferring raw SkyLight over private direct IOSurface for 120 Hz ProRes Proxy restored the runtime probe from a warmup failure to 119 callback frames with 125.060 ms startup and 9.354 ms average callback latency, lifting the official score to 71.55 while leaving HEVC stable at 51 frames
454	c2066c4	keep	80.08	raising the high-refresh raw SkyLight pending slack for ProRes Proxy to eight frames reduced runtime-probe drop pressure from 17 to 13 events while preserving near-target cadence, improving the official score to 80.08 with HEVC also ticking up to 52 frames
455	2217b8f7+c2066c4	keep	95.62	moving 120 Hz ProRes Proxy overlay sessions from q1 to q3 on top of the kept raw SkyLight backend and wider pending slack cut drop pressure to seven events with zero dropped frames, raising ProRes to 82.51 and the official score to 95.62 while HEVC remained the limiting path at 51 frames
456	1c5d8f6d	discard	test-failed	forcing 120 Hz HEVC overlay sessions onto q3 immediately broke the targeted bootstrap guardrails by changing the expected auto queue profile from q1 to q3 and raising the recommended forwarding frame capacity from 2 to 3, so explicit deeper HEVC source queueing is not compatible with the current official contract
457	c85588d	discard	95.62	adding one extra high-refresh HEVC raw SkyLight source slot improved ProRes stability as a side effect but left HEVC pinned at 51 frames and therefore could not lift the overall score beyond 95.62, so extra HEVC source slack alone is not the lever that breaks the current progression ceiling
458	60067d7	discard	95.62	dropping high-refresh HEVC MaxFrameDelayCount from 1 to 0 did not move the 51-frame HEVC ceiling and therefore could not lift the overall score beyond 95.62, so VT frame-delay buffering is not the missing lever on the current path
459	b849c3c2	discard	test-failed	promoting only 120 Hz SDR-base HDR overlay HEVC sessions to q3 is structurally plausible, but the experiment as committed also rewrote the generic auto-capacity expectation and failed the targeted bootstrap contract before runtime measurement, so this exact contract-change bundle cannot be kept
460	22d89823	discard	95.62	promoting only 120 Hz partial HDR overlay HEVC sessions from q1 to q3 preserved the official score at 95.62 because HEVC remained pinned at 51 frames while the gain landed on ProRes instead, so deeper overlay queueing in Lumen is not the limiting lever
461	2217b8f7+f3ab008	discard	91.50	stamping an explicit 1/120 duration onto high-refresh HEVC submissions did not move the 51-frame HEVC ceiling and the measured run regressed ProRes stability badly, so per-frame encode duration is not a safe or effective lever on this path
462	2217b8f7+8c67a8a	discard	25.42	breaking the capture callback free with a naive encodeQueue async handoff caused HEVC drop events to spike to 35 and collapsed the official score to 25.42, which shows the root issue is not sync alone but the lack of a bounded actor-like scheduler that preserves freshness and backpressure without blocking
463	2217b8f7+310cce3	discard	test-failed	an actor-based latest-only scheduler is the right structural direction after the async drop storm, but this implementation captured a recursive closure across Task boundaries and failed Swift 6 concurrency checks before measurement
464	2217b8f7+0427584	discard	25.00	an actor-backed latest-only processing pump compiled and ran, but decoupling high-refresh callback-only processing from synchronous backpressure still triggered 68 HEVC drop events and collapsed the score to 25.00, so this workload needs source-to-encoder coupling stronger than a single-flight freshest-only actor
465	2217b8f7+5cb9ce8	discard	95.21	disabling temporal compression for the 120 Hz HDR HEVC path improved startup but dropped HEVC progression from 51 to 49 frames and could not beat the kept 95.62 score, so the persistent HEVC ceiling is not coming from temporal frame dependency depth alone
466	2217b8f7+86f5523	discard	95.42	tightening the high-refresh HDR HEVC VBV buffer from 1/30s to 1/60s improved ProRes stability but pushed HEVC back to 50 frames and still failed to beat the kept 95.62 score, so the HEVC ceiling is not fixed by a smaller encoder VBV buffer alone
467	2217b8f7+2b61e70	discard	95.62	dropping high-refresh HEVC reference buffers to zero left the 51-frame HEVC ceiling unchanged and only shifted ProRes stability, so encoder reference depth is not the missing lever behind the current progression wall
468	2217b8f7+60b8194	discard	95.62	removing VideoToolbox data-rate limits from the high-refresh HEVC path left the 51-frame HEVC ceiling unchanged and only shifted ProRes stability, so HEVC rate smoothing is not the missing lever
469	2217b8f7+0ea0335	discard	90.46	retuning the HEVC high-refresh raw SkyLight bootstrap to the documented 240hz-q3 shorthand left HEVC stuck at 51 frames and badly destabilized ProRes Proxy, so widening the source bootstrap candidate itself is not the right production fix
470	2217b8f7+f7d44fe	discard	test-failed	applying the macOS 26 VideoToolbox conferencing preset is still worth testing, but this implementation failed Swift CoreFoundation bridging checks before runtime measurement so the result is unusable
471	2217b8f7+f21c380	discard	95.21	applying the macOS 26 VideoToolbox VideoConferencing preset improved startup but pushed HEVC down to 49 frames and failed to beat the kept score, so that low-latency preset is not the right hardware mode for this 4K120 HDR HEVC workload
472	2217b8f7+e7ae0d3	discard	95.62	applying the macOS 26 VideoToolbox HighSpeed preset left the HEVC ceiling unchanged at 51 frames, so preset-level throughput mode selection is not the missing lever either
473	2217b8f7+50ce030	keep	95.83	capping worst-case HEVC frame QP at 40 finally lifted the limiting 120 Hz HDR HEVC path from 51 to 52 frames without destabilizing ProRes Proxy, raising the official score to 95.83 and confirming that encode complexity is the first live lever past the current wall
474	2217b8f7+43d5251	discard	95.62	raising the high-refresh HDR HEVC MaxAllowedFrameQP cap from 40 to 44 lost the newly gained HEVC frame and fell back to the old 95.62 plateau, so the live improvement window is tighter than that and QP 40 remains the better cap so far
475	2217b8f7+fa1b837	discard	95.62	adding MinAllowedFrameQP=20 on top of the new MaxAllowedFrameQP=40 cap erased the HEVC gain and fell back to the old plateau, so the current improvement comes from the upper QP ceiling alone rather than a raised QP floor
476	2217b8f7+7258f6b	discard	95.83	keeping the new HEVC QP40 cap while removing high-refresh HEVC data-rate limits preserved the gain but did not improve the official score beyond 95.83, so the hard rate window is not the next lever after QP40
477	2217b8f7+136646f	discard	95.21	raising the high-refresh HDR HEVC MaxAllowedFrameQP cap from 40 to 42 collapsed both HEVC and ProRes progression, so the newly opened improvement window is sharply centered at 40 rather than somewhere above it
478	2217b8f7+440c22f	discard	95.00	disabling SpatialAdaptiveQPLevel on top of the new HEVC QP40 cap sharply regressed both codecs, so the current encoder gain depends on keeping VideoToolbox spatial QP adaptation enabled even under low-latency rate control
479	2217b8f7+b01b7a6	discard	95.62	forcing BaseFrameQP=28 on supported high-refresh HDR HEVC sessions did not improve the official score beyond 95.62, so turning off standard rate control entirely is not the next step past the QP40 keep
480	2217b8f7+7937e74	discard	95.62	forcing BaseLayerFrameRateFraction=1.0 on top of the HEVC QP40 keep left the score at 95.62 while badly inflating HEVC startup latency, so collapsing the low-latency temporal layering is not the next lever
0	95.62	baseline	Lumen=29590e52d582b144864a2f4829eade9bbcbc85d2,MacDisplayKit=4f8f2414c1930e24ae6cea8cc1052663b7617b1e	unmodified code
481	29590e52+cc17ca0	discard	25.00	forcing explicit VideoToolbox hardware encoder identifiers caused the HEVC runtime probe to crash with a String.init(cString:) fatal while ProRes remained healthy, so explicit encoder-id pinning is unsafe on the current live path and must stay discarded
482	29590e52+829c4fb	discard	95.62	requiring hardware-accelerated VideoToolbox encoders during session creation left the HEVC ceiling unchanged at 51 frames while slightly softening ProRes Proxy, so generic hardware-preferred session negotiation was already sufficient and this backend-selection tightening is not a live lever
483	29590e52+a72b26b	discard	95.62	clamping the high-refresh callback-only HEVC SkyLight pending window from 6 to 2 did not move the official 51-frame HEVC ceiling and direct diagnostics showed sourceApproxFrameRate falling from about 40.93 to 35.88, so the current runtime-probe workload needs more source slack rather than a tighter callback mailbox
484	29590e52+0ed7b4c	discard	95.21	raising the high-refresh callback-only HEVC SkyLight pending window from 6 to 8 regressed the official score and direct diagnostics still left sourceApproxFrameRate only about 36.69, so adding more source slack just deepens stale backlog without recovering the real source cadence ceiling
485	29590e52+6b0b0e4	discard	95.62	restoring 240 Hz synthetic idle replay for high-refresh callback HEVC failed to improve the official score and direct diagnostics pushed sourceApproxFrameRate down from about 40.93 to 35.26, so the current source ceiling is not missing synthetic replay cadence
486	29590e52+1228d92	discard	95.62	switching the encoded high-refresh SkyLight bootstrap from min-frame-240hz-q2 to baseline-q2 matched the official score but direct diagnostics cut sourceApproxFrameRate down to about 35.36, so the documented baseline-q2 default is not the better live source bootstrap for this runtime-probe workload
487	29590e52+366c8aa	discard	95.62	prefering baseline-q1 for the encoded high-refresh SkyLight bootstrap again matched the official score but direct diagnostics still cut sourceApproxFrameRate to about 35.34, so the current runtime-probe workload does not benefit from lower queue-depth bootstrap candidates either
488	29590e52+1cda65a	keep	95.83	restoring the HEVC low-latency bitrate ceiling to the previously measured 192 Mbps envelope lifted HEVC progression from 51 to 52 frames without touching QP or explicit quality controls, confirming that the Downloads checkout had drifted away from the last known good rate-control cap
489	29590e52+dc7ad39	discard	31.62	making off-queue VideoToolbox submission asynchronous decoupled the callback lane from encodeQueue waits, but HEVC immediately accumulated 32 drop events and collapsed the stability component, so raw async submit without a tighter admission contract just converts blocking into visible freshness loss
490	29590e52+0f6e19f	discard	build-fail	actorizing the SkyLight replay runtime and moving raw callback delivery into tasks hit Swift 6 sendability barriers because IOSurface-backed callback inputs cannot be handed directly across task boundaries, so this source-runtime direction needs a sendable pre-wrap step before it can be measured
491	29590e52+367b836	discard	31.83	actorizing the SkyLight replay runtime with sendable pre-wrapped surfaces still produced 32 HEVC drop events, so the serial delivery queue was not the root cause; the real instability appears when the callback lane is decoupled from a downstream admission contract
492	29590e52+a13356c	discard	25.00	forcing detached GPU staging for high-refresh HDR HEVC caused the same fatal String.init(cString:) HEVC runtime-probe crash seen in other invalid backend-selection experiments, so the current live HEVC path cannot safely abandon direct submit this way
1	95.0	discard	MacDisplayKit=5a38f7f490649f72f70556db037ef2199ebfe2af	MacDisplayKit: docs: refresh downstream hdr120 investigation state
493	4a9252c3+fd15361	discard	95.42	reclassifying mailbox replacements as coalesced frames removed the async-submit stability penalty completely, but HEVC still fell to 50 frames while ProRes shifted to 96 frames, so corrected event semantics prove the drop accounting was noisy without rescuing the underlying HEVC progression loss from off-queue submit
494	29590e52+c09c091	discard	95.21	prefering baseline-q3 for the encoded high-refresh SkyLight bootstrap regressed the official score and dropped HEVC progression from 52 to 49 frames even though current raw target-sized sampling favored q3, confirming that the production bottleneck sits downstream of raw candidate choice at the raw-to-encoded admission boundary
