experiment	commit	metric	status	description
1428	101.25	discard	Lumen=4dcfce56d64502d1423f85ba75bc424cd7440dd6	Lumen: experiment: report codec frame gaps
1429	101.88	discard	Lumen=9ce9531c2a325a83a8ccf9ad7294f431edff4598	Lumen: experiment: bridge private display set for capture
1430	102.08	discard	MacDisplayKit=bcd180c2fae82386566d27b7314df82f6b6d5dbe	MacDisplayKit: experiment: gate skylight dirty rect decode
1431	101.67	discard	MacDisplayKit=52869afa0844c1b3b9a4218869ddf1051cdd4cdb	MacDisplayKit: experiment: drop stale skylight fresh frames
1432	25.0	discard	Lumen=6371fae07e0eeed4cab63bf916b4824904eae624	Lumen: experiment: preserve auto queue for mdk source
1433	102.08	discard	Lumen=c44476915005af309b09882d2938bc5131f7550a	Lumen: experiment: terminate core event messages
1434	25.0	discard	MacDisplayKit=792a54194678d2248582fcb865e00efcd80fd1f3	MacDisplayKit: experiment: route hevc hdr through private proxy
1435	101.61	discard	MacDisplayKit=79052720b3d4cded72442128c6b501a19a8980a7	MacDisplayKit: experiment: inline skylight source delivery
1436	89.6	discard	MacDisplayKit=b0c794b80605806f6530e7f8c58e395b333307f5	MacDisplayKit: experiment: route hevc hdr to direct iosurface source
1437	102.29	discard	MacDisplayKit=ac50f115fd9780beb7927d008984e8476235629b	MacDisplayKit: experiment: resolve hevc hdr metadata once
1438	101.67	discard	MacDisplayKit=f16229e6939e68b05ac63ba8dce8eaa30aaac7c1	MacDisplayKit: experiment: resolve encoded source backend once
1439	102.08	discard	Lumen=0c3685f2ae752191b6acd3e088b0ce5e249078d6	Lumen: experiment: arm producer after capture start
1440	101.46	discard	MacDisplayKit=285f80561ee75712bf9ac812abc0c7493a0532f6	MacDisplayKit: experiment: document private path pivot
1441	102.32	discard	MacDisplayKit=42832308c41042c736e3758e246981a707d940cc	MacDisplayKit: experiment: prefer iosurface proxy planner path
1442	101.46	discard	MacDisplayKit=37f6c813bb1f464de09356915833794de4402f0e	MacDisplayKit: experiment: gate direct iosurface on direct symbols
1443	101.88	discard	MacDisplayKit=9354761ed7d7397c227f062507ac94d7141f7c8d	MacDisplayKit: experiment: skip skylight hot metadata decode
1444	101.88	discard	MacDisplayKit=fc97d9a48dedda22ee0843656f46f5100e699d2b	MacDisplayKit: experiment: tighten private hdr capability hints
1445	102.29	discard	MacDisplayKit=fc103f6935609e783b4e63b3335969bf10b13ddc	MacDisplayKit: experiment: fast path format hdr signal
1446	102.29	discard	Lumen=3f84a88f114f8604733c14ee8036ad9681924cc0	Lumen: experiment: mirror ingress last frame after collapse
1447	101.25	discard	Lumen=66dfa3e47dddb20f1f619a9c29dc607b4eb21dd6	Lumen: experiment: bound bridge callback autorelease churn
1448	102.08	discard	MacDisplayKit=941ced6dd21843b7aa9436e22fb22fc56c3c2b27	MacDisplayKit: experiment: strip retained source timing metadata
1449	102.81	discard	MacDisplayKit=cb724b5f92d3d5a8a1bd0a2af9172d58e6206510	MacDisplayKit: experiment: skip callback drain group tracking
1450	102.29	discard	Lumen=e46db98eca1c5b2c9bc9003236ed94ae74f1d9b9	Lumen: experiment: exp1450 skip event stats snapshot
1451	101.46	discard	Lumen=de90f99facf1905f8cae08ad8bde4fb34a7e05fd	Lumen: experiment: exp1451 skip hevc frame status task
1452	101.25	discard	MacDisplayKit=0b8982d059df262b7aea057117b96018912e4533	MacDisplayKit: experiment: exp1452 hold processor in source callback
1453	102.29	discard	MacDisplayKit=2c3493f9388b216ec37911689dec8c2f48dc2a11	MacDisplayKit: experiment: exp1453 use skylight timestamps for replay state
1454	101.88	discard	Lumen=ac45f620915be0e4b24eb65fac937ab57177ec1e	Lumen: experiment: exp1454 queue frame before snapshot copy
1455	102.52	discard	MacDisplayKit=5e4d8be761f89535721be7b6fc8ae86f5db2edf4	MacDisplayKit: experiment: exp1455 trust private source dimensions
1456	102.38	discard	MacDisplayKit=a6010b0bf8320bd07fb911dda336aa71c67833c9	MacDisplayKit: experiment: exp1456 trust private surface size
1457	102.29	discard	MacDisplayKit=ada118ed3e13e5a3bbc7806ed2dc65c645f4bd9c	MacDisplayKit: experiment: exp1457 trust private bgra format
1458	101.67	discard	MacDisplayKit=37d07ae34a73cceeba7b159659f3260b5e3bfba9	MacDisplayKit: experiment: exp1458 trim raw private startup notes
1459	101.67	discard	MacDisplayKit=2a7f4e9692cfc82e692edacea8b9a7bb39e6231b	MacDisplayKit: experiment: exp1459 sync latest frame mailbox
1460	101.67	discard	MacDisplayKit=fae3079e8b5f5f446f696345662982661b82b700	MacDisplayKit: experiment: exp1460 defer source drop telemetry
1461	102.29	discard	MacDisplayKit=b6ee240898786f0a0814eb9c884c4efd87969ee0	MacDisplayKit: experiment: exp1461 specialize callback output handler
1462	102.69	discard	Lumen=5d0f1f82c8e3ec227769c3b473967c49d4ab90d2	Lumen: experiment: exp1462 direct core frame drain
1463	101.88	discard	MacDisplayKit=66ddd42fa2fa952c9801d84b5a6144604c01defb	MacDisplayKit: experiment: exp1463 scope skylight autorelease
1464	101.88	discard	MacDisplayKit=7e2d0e07e69511cf5bdd1fc7dbc0913e47c78345	MacDisplayKit: experiment: exp1464 skip empty event fanout
1465	101.88	discard	Lumen=a0c4e1e94473e8f7cfa4b0f067854654069d9681	Lumen: experiment: exp1465 share bridge frame metadata
1466	101.88	discard	MacDisplayKit=e90d9681f6ff43a155517be125ae6f7f53e24717	MacDisplayKit: experiment: exp1466 gate hevc hdr callback augmentation
1467	102.29	discard	Lumen=44a123282963146f6ccfcfa85bcb1ed5d88297d9	Lumen: experiment: exp1467 skip prores bridge frame diagnostics
1468	101.62	discard	Lumen=9cb637afe469a78153ef9f0c27caea731f010b5a	Lumen: experiment: exp1468 fast-path bridge frame diagnostics gate
1469	102.71	discard	MacDisplayKit=39b5a0793c2922e030dc536313461fc661f16d94	MacDisplayKit: experiment: exp1469 synthesize noerr callback histogram
1470	101.67	discard	MacDisplayKit=7c57e6771d72f2297fc59b099beb1315c9eaffef	MacDisplayKit: experiment: exp1470 optional vt pending release closure
1471	102.71	discard	Lumen=2a5965a471f3ba465f7de7223ae7689c171c6a99	Lumen: experiment: exp1471 move bridge latest frame off actor
1472	102.5	discard	Lumen=59f75f89dd2bfad2b64c20413b4a331c564889d1	Lumen: experiment: exp1472 remove bridge frame actor hop
1473	103.17	discard	Lumen=e797dadda0cc0e0bb9bc7aa1665266241ba61208	Lumen: experiment: exp1473 inline core frame consume
1474	102.08	discard	Lumen=087c50252bccc0a6bd8249482938c76e6dafd5e7	Lumen: experiment: exp1474 specialize frame latency fast path
1475	101.46	discard	Lumen=62f2eaa8d3a0d9af61f266bed41784beb83f559b	Lumen: experiment: exp1475 bypass codec wrapper in frame forwarder
1476	102.29	discard	MacDisplayKit=f46b90c0218e1a6b770da4ba36b0a808027c082f	MacDisplayKit: experiment: exp1476 move submitted frame count off output queue
1477	102.26	discard	MacDisplayKit=ef871032889010f39ac53e2083733f8754cc48a6	MacDisplayKit: experiment: exp1477 precompute hdr image buffer attachments
1478	102.5	discard	MacDisplayKit=a898fc087efb46c736657f2d5cc6d890953c1be7	MacDisplayKit: experiment: exp1478 fast-path repeated wrapped pixel buffers
1479	102.08	discard	MacDisplayKit=56320fbcb182218eeccdbcc053ff03f9d5cd0cd8	MacDisplayKit: experiment: exp1479 move hdr attachment apply off submit path
1480	101.31	discard	MacDisplayKit=9a25a249cc69847ff61fec7309e67d84c96675ac	MacDisplayKit: experiment: exp1480 skip callback frame packaging on failure
1481	101.88	discard	MacDisplayKit=cca9bbb4795caab9a69db39485009ea732658ac7	MacDisplayKit: experiment: exp1481 branch presentation timestamp fast path
1482	101.43	discard	MacDisplayKit=7edee0eba395c42172aba415e8a752f7b2907dce	MacDisplayKit: experiment: exp1482 fast-path repeated source textures
1483	104.17	discard	MacDisplayKit=80104e7fd694c648aab450b3912a05233f1e7e2c	MacDisplayKit: experiment: exp1483 cache source textures by surface signature
1484	104.17	discard	MacDisplayKit=cdeb5835fb57daf559e2a68486d3380e15799149	MacDisplayKit: experiment: exp1484 specialize single-plane cursor texture path
1485	101.88	discard	MacDisplayKit=bc91b26407e26b46a13f20e8e98c4aad8e617c24	MacDisplayKit: experiment: exp1485 specialize single-plane source texture path
1486	101.67	discard	MacDisplayKit=4b00f0ff23412c8c4c50a0702fc32444e5614708	MacDisplayKit: experiment: exp1486 precompute high-refresh pq hevc flag
1487	102.22	discard	MacDisplayKit=11282acbb85aefbd07a60a16cafb5288edbfd3db	MacDisplayKit: experiment: exp1487 cache surface plane descriptors
1488	101.88	discard	MacDisplayKit=5d4f8de663b110cd104e68b24991ffac93b7c613	MacDisplayKit: experiment: exp1488 reuse skylight capture surface on repeated iosurface
1489	101.46	discard	MacDisplayKit=9c30256d7e3331ec5341953cf417287528c6f8bc	MacDisplayKit: experiment: exp1489 decode skylight dirty rects only on fresh frames
1490	102.08	discard	MacDisplayKit=901b68ea7d28d8260b27f5980c1db27181eb9ecf	MacDisplayKit: experiment: exp1490 move skylight drop-count conversion into fresh path
1491	101.67	discard	MacDisplayKit=883a3d27f609b33ca37f81e127f28f0262f74b51	MacDisplayKit: experiment: exp1491 inline skylight frame-action branching
1492	101.61	discard	MacDisplayKit=cbf136f1e9357198cc110f3e78b72977833e6d81	MacDisplayKit: experiment: exp1492 inline skylight timer replay gating
1493	101.88	discard	MacDisplayKit=497453030703b4a24a59d7e60596933e5958d7ee	MacDisplayKit: experiment: exp1493 drop unsupported skylight statuses before queue hop
1494	102.08	discard	MacDisplayKit=ffa1d9404acfd62a0885ed57dd77cf6c18e30fc6	MacDisplayKit: experiment: exp1494 reuse callback display time for emission bookkeeping
1495	101.46	discard	MacDisplayKit=fd3c3f0a667365af4f3c8bb4d75dff4c8030d9a7	MacDisplayKit: experiment: exp1495 replace source-note prefix scans with latches
1496	101.89	discard	MacDisplayKit=06dd0e81421000aefe91f916fd8f60d536e8baf0	MacDisplayKit: experiment: exp1496 reuse staged output dimensions
1497	102.08	discard	MacDisplayKit=8619cf18ddbacc2b8d374abd88512c79e3fdf29f	MacDisplayKit: experiment: exp1497 inline process fast path without submit closure
1498	101.25	discard	MacDisplayKit=eb9b08581ad5ad8e664503bdbcc4317d1f570b7c	MacDisplayKit: experiment: exp1498 skip retained frame copy on encode queue
1499	101.88	discard	MacDisplayKit=7131c3443700b72419aae091e4af75e049f2fdae	MacDisplayKit: experiment: exp1499 skip detached-surface check without metal queue
1500	101.88	discard	MacDisplayKit=cb3e6175822c55bfa3a7364af89269052e99b50b	MacDisplayKit: experiment: exp1500 latch color conversion note
1501	101.88	discard	MacDisplayKit=6f2a461d286ef0d2cbadd51921fea2db4906ab83	MacDisplayKit: experiment: exp1501 pass conversion flag into staged path
1502	101.67	discard	MacDisplayKit=3b8760ae97911828023fa11aa290b99ef94874ca	MacDisplayKit: experiment: exp1502 defer overlay check until metal staging
1503	101.88	discard	MacDisplayKit=cd849f60d1dc1b366911bc1146086f4d446a7b10	MacDisplayKit: experiment: exp1503 pass scaling flag into staged path
1504	101.46	discard	MacDisplayKit=21c5b00ddfe9743df944cec25713b367f750da6c	MacDisplayKit: experiment: exp1504 reuse static noop release callback
1505	101.46	discard	MacDisplayKit=ba0a7ec4d064de518d3b75cef4053758369870cb	MacDisplayKit: experiment: exp1505 reuse static noop pending release callback
1506	101.46	discard	MacDisplayKit=882962a6fcc567263b7cdf3a086ba51e128f5637	MacDisplayKit: experiment: exp1506 reuse static noop pending release callback
1507	102.08	discard	MacDisplayKit=370f2740d88825a721290ecb03753b0f0420f466	MacDisplayKit: experiment: exp1507 reuse static noop pending release callback
1508	102.71	discard	MacDisplayKit=0276c81fc0e6cb1bb8792b444aea3e22364b152a	MacDisplayKit: experiment: exp1508 latch source pixel format note
1509	101.88	discard	MacDisplayKit=ffade7f5c16760878e41aae14b42db8e83bc3dba	MacDisplayKit: experiment: exp1509 latch source color primaries note
1510	101.67	discard	MacDisplayKit=ff3c3feb644d871d8d112e52cfc5513731faf138	MacDisplayKit: experiment: exp1510 latch signal color primaries note
1511	101.88	discard	MacDisplayKit=dac9ce4cf759b97194a0430dca6bf01a95b85c5b	MacDisplayKit: experiment: exp1511 hoist surface unwrap into encode
1512	103.8	discard	MacDisplayKit=26f60cc34da6a9d5369d602afe589b5e04227812	MacDisplayKit: experiment: exp1512 cache preferred input pixel format
1513	102.29	discard	MacDisplayKit=fbfe6745db6ebbcacc2fd6b9d19df4379bd0ed40	MacDisplayKit: experiment: exp1513 cache output dimensions
1514	101.67	discard	MacDisplayKit=7832833f2d2f7b22af80e2d3a587c23053049199	MacDisplayKit: experiment: exp1514 cache detached submission requirement
1515	103.41	discard	MacDisplayKit=05cd8530e7dc3dd9daaae120dacd51abe1d0a468	MacDisplayKit: experiment: exp1515 cache encode plan selection
1516	101.88	discard	Lumen=a19e2f1a5eb0541be9ee53989aaccdc6fd9633a5	Lumen: experiment: exp1516 specialize mdk frame ingress
1517	101.67	discard	Lumen=bb3c6254ca59e2dd186bfcefe38bbdc1cad34364	Lumen: experiment: exp1517 split optional latency ingress path
1518	101.67	discard	MacDisplayKit=f1de1afa54e816635cbc4909e02ad24573d2d2b7	MacDisplayKit: experiment: exp1518 use monotonic callback latency timestamps
1519	102.71	discard	MacDisplayKit=b3f367028dcac2ab1a4ba8a2fa8308b4715a765e	MacDisplayKit: experiment: exp1519 split callback optional marshalling
1520	101.67	discard	MacDisplayKit=6e60507ef7658fb400e313180cfd00820a606ca8	MacDisplayKit: experiment: exp1520 move processing counters off output queue
1521	101.67	discard	MacDisplayKit=11160b6324db111cfc255c3d4e9c356a528ed46f	MacDisplayKit: experiment: exp1521 set-stage-slot membership guard
1522	101.88	discard	MacDisplayKit=36b4acb947d03bcb7c19024a3c81b0e1c024c16d	MacDisplayKit: experiment: exp1522 reuse staged slot sendable buffer
1523	102.29	discard	MacDisplayKit=d7a64169583e4dee0d361e549bfa7851fcfe87d4	MacDisplayKit: experiment: exp1523 store replay pixel buffer directly
1524	102.08	discard	MacDisplayKit=a12e25ad71bc66fca08759296337b7e7ef88c9fd	MacDisplayKit: experiment: exp1524 integer latency histogram buckets
1525	101.88	discard	MacDisplayKit=5a3d2aa803e7111993d060cabb50d64e3de9fd26	MacDisplayKit: experiment: exp1525 status histogram uses raw osstatus
1526	102.08	discard	MacDisplayKit=66d595bd49cd657ddeaa49b1c551021a2ab31130	MacDisplayKit: experiment: exp1526 reuse dirty coverage ratio
1527	102.85	discard	MacDisplayKit=1c4c5e77c6ea0cd467974896357fef3a7093ff46	MacDisplayKit: experiment: exp1527 fast-path empty dirty rect stats
1528	101.67	discard	MacDisplayKit=fe5c246da011b7d3183e74ed75e376fcee9257c0	MacDisplayKit: experiment: exp1528 fast-path single dirty rect stats
1529	102.5	discard	MacDisplayKit=8356fd129edf23e401beef3deb590c001c2d48ad	MacDisplayKit: experiment: exp1529 skip clipping for in-bounds single dirty rect
1530	101.25	discard	MacDisplayKit=39b0b340bafad68d4c5e40a6cedde0887c8a8fa1	MacDisplayKit: experiment: exp1530 use scalar dirty rect clamping
1531	102.08	discard	MacDisplayKit=a2a4c41f7e3680ad5792bd303c06c8580b4dbe6a	MacDisplayKit: experiment: exp1531 flatten cursor composite bookkeeping branch
1532	102.5	discard	MacDisplayKit=eba77a7e3bccb3c5df23d490da90945e6ce9ba0a	MacDisplayKit: experiment: exp1532 inline private cursor overlay path
1533	101.46	discard	MacDisplayKit=a23158b2a9b300a7c5684c3711cf10d885b50049	MacDisplayKit: experiment: exp1533 cache source cadence timebase scale
1534	104.17	discard	MacDisplayKit=3154ba6bead6fd7b5af43338245a9ed7c56884d6	MacDisplayKit: experiment: exp1534 precompute callback diagnostic strings
1535	102.08	discard	MacDisplayKit=411ad44b4e95ca895e46fec0d5a521417f19af01	MacDisplayKit: experiment: exp1535 split callback token extraction
1536	102.5	discard	MacDisplayKit=c0e65d1a1847ad72aac620e577287b2acacd4494	MacDisplayKit: experiment: exp1536 cache source timing duration scale
1537	101.88	discard	MacDisplayKit=1a03375df421639e2a698f16d736ac3d8e5f10be	MacDisplayKit: experiment: exp1537 branch pending release decrement
1538	102.08	discard	MacDisplayKit=0f941bd20248834b25bf6dc24a2124d6ae841247	MacDisplayKit: experiment: exp1538 specialize source callback diagnostics path
1539	102.95	discard	MacDisplayKit=9560e4329a2b802f2e1c90835ce8099b2e47ef0f	MacDisplayKit: experiment: exp1539 inline pending acquire unlock
1540	102.29	discard	MacDisplayKit=dd1035d5f5eb26757912bb0bf25f8fffd46fc9dc	MacDisplayKit: experiment: exp1540 narrow wrapped pixel buffer key
1541	101.88	discard	Lumen=1b588d26333fe6ea6091d846703f2a9d0c17ed7d	Lumen: experiment: exp1541 hoist ingress event optionals
1542	102.29	discard	Lumen=a425127c909636244611c0917d4cc63cd44dc9bd	Lumen: experiment: exp1542 hoist frame diagnostic stats
1543	102.5	discard	Lumen=fbdaef4b853af1da17c02f8d73f590fa726ed2af	Lumen: experiment: exp1543 hoist drained event optionals
1544	101.67	discard	Lumen=34178f6a96f6a6e8c674ed300670fd05e2b95457	Lumen: experiment: exp1544 hoist drained frame optionals
1545	102.92	discard	Lumen=a95f563c9a6d1983a711fe190eb59c144ba9e487	Lumen: experiment: exp1545 hoist active capture config snapshot
1546	102.08	discard	Lumen=927d8b1386f24a528383985360dd40b090680b1b	Lumen: experiment: exp1546 hoist ingress latency optionals
1547	101.67	discard	Lumen=60d6941af96bf79e27d48852406583d8b05591bc	Lumen: experiment: exp1547 expand diagnostic delta optionals
1548	101.67	discard	Lumen=d58e048f0324ba015ab85a50c7e544f9c7d8e722	Lumen: experiment: exp1548 hoist drained frame conversions
1549	102.5	discard	Lumen=744c74aad3898fc75969e2251bc8afdc4d2ce375	Lumen: experiment: exp1549 hoist ingress event kind
1550	102.29	discard	Lumen=01018768d2fe953ca2c4e542be0c9556281d0c7b	Lumen: experiment: exp1550 branch drained event message decode
1551	103.4	discard	Lumen=90ba28c639e71125caea1b40f690762faaca3be8	Lumen: experiment: exp1551 hoist drained frame source ids
1552	101.88	discard	Lumen=dd464fb0eeb6ff21e13997b2c90bad01c388e9ff	Lumen: experiment: exp1552 hoist drained frame flags
1553	101.67	discard	Lumen=48920de8690f9039a4df5e85a9b7a1172ea62811	Lumen: experiment: exp1553 hoist frame source ids
1554	101.67	discard	Lumen=a366f5ce85c82db7daaa7bb088fcdf3b857c2f0d	Lumen: experiment: exp1554 hoist frame hdr flags
1555	102.5	discard	Lumen=44560191c73bf4cabbc8170a2d5ef43c78a89ebd	Lumen: experiment: exp1555 hoist drained frame marshalling
1556	103.51	discard	Lumen=2596b47cb9640c4fdc1bd2e7d6e9436d5802f92e	Lumen: experiment: exp1556 branch core drain box creation
1557	101.88	discard	Lumen=ea0a5def14523e32044a61039eded43ace2ac9d2	Lumen: experiment: exp1557 branch core drain event box creation
1558	101.88	discard	Lumen=afff1139b60f5bb1b861471851d92e6b86f596e1	Lumen: experiment: exp1558 branch audio drain frame box creation
1559	102.29	discard	Lumen=d1604f24c6bbe6619e30123c666de2144409c8c1	Lumen: experiment: exp1559 branch audio drain event box creation
1560	102.08	discard	Lumen=82f00e3f2a7f50480e663f4da9a6758a3a2b9b5c	Lumen: experiment: exp1560 hoist audio event optionals
1561	102.08	discard	Lumen=ae421654438a2088e4ba329cf8360d92784e7a8d	Lumen: experiment: exp1561 hoist audio frame conversions
1562	101.88	discard	Lumen=f901bc54a296a0ca2ec474d59ff9d1a5d4048ce9	Lumen: experiment: exp1562 hoist audio drained event optionals
1563	102.29	discard	Lumen=7b11dd7a7b3002fd89a0a49eb61e0228980e770c	Lumen: experiment: exp1563 hoist audio drained frame conversions
1564	102.08	discard	Lumen=d1e034903adb851e2680d94d1ed54c52a235ee05	Lumen: experiment: exp1564 hoist audio frame ids
1565	101.88	discard	Lumen=68a0e901bf45098ddee59d903816d70de9f3f618	Lumen: experiment: exp1565 hoist audio snapshot flags
1566	101.88	discard	Lumen=d462b91a7cc74f10f8fad7527e0371ad755c150b	Lumen: experiment: exp1566 branch audio event message decode
1567	102.08	discard	Lumen=abae97c55b07de9d63f3e8b64167969168ba29ce	Lumen: experiment: exp1567 hoist audio drained frame ids
1568	102.71	discard	Lumen=631097faf115ed70b5377703d9a755dc068595c7	Lumen: experiment: exp1568 hoist audio frame pcm buffer
1569	101.88	discard	Lumen=eeb32c8ddf0fcbbffa224d6fef22bcc9c236196c	Lumen: experiment: exp1569 hoist audio pcm buffer pointer
1570	102.5	discard	Lumen=05749c9b146b2a929e27ea9eb0f203cd0732e21d	Lumen: experiment: exp1570 hoist audio drained frame buffer
1571	102.66	discard	Lumen=f7007194e302ffa73804dfe42f7079ed41c23f35	Lumen: experiment: exp1571 hoist audio event buffer
1572	102.13	discard	Lumen=f9084391d723525db1a0cf88cfda820488ea1f7c	Lumen: experiment: exp1572 hoist audio event kind
1573	101.88	discard	Lumen=bf5090c4d3862b79f715f1ec34a40c0b90bff470	Lumen: experiment: exp1573 hoist audio pcm byte count
1574	101.46	discard	Lumen=c72670dbaa8c578f650ab75e1b3e96f08f65c0ab	Lumen: experiment: exp1574 hoist audio snapshot event kind
1575	103.39	discard	Lumen=b93c600639e50e8595806d57ab6398267993ab2d	Lumen: experiment: exp1575 hoist audio snapshot last seq
1576	102.71	discard	Lumen=e69c0fbdbf0c836cacc09ec43fff041c93e58717	Lumen: experiment: exp1576 hoist audio snapshot host time
1577	102.5	discard	Lumen=afadbc0ef8ad51a28e7f8ff0c1881e324a757822	Lumen: experiment: exp1577 hoist audio snapshot sample rate
1578	101.88	discard	Lumen=f97d6d2eb9f73e17e4dc7dccca12f44c4d1f8230	Lumen: experiment: exp1578 hoist audio snapshot channel count
1579	102.08	discard	Lumen=571606376a6cacf0abd534bac2eaf00bbdf1a0f4	Lumen: experiment: exp1579 hoist audio snapshot frame count
1580	101.88	discard	Lumen=9bf49c225d2cffa844edb49b6148b5955ed3c367	Lumen: experiment: exp1580 hoist audio snapshot pcm byte count
1581	101.49	discard	Lumen=80be2645e3cb08c9218bf164f979884e1ea406c5	Lumen: experiment: exp1581 hoist audio snapshot event kind
1582	101.67	discard	Lumen=0fe2b96a3eba4465965c44738f62860464c9f9ff	Lumen: experiment: exp1582 hoist audio snapshot sequence number
1583	102.29	discard	Lumen=2182350c9c007a105c1674271f1e0d82616f8b47	Lumen: experiment: exp1583 hoist audio snapshot host time
1584	102.53	discard	Lumen=354b9b07b237ba55e725b0a9b8e1fa063248bce9	Lumen: experiment: exp1584 hoist audio snapshot sample rate
1585	101.46	discard	Lumen=4ac44391d8df661a652116fb829942a8045eb89a	Lumen: experiment: exp1585 hoist audio snapshot channel count
1586	102.77	discard	Lumen=8f9927ad6e5d1beacf3080189750eed4f085f600	Lumen: experiment: exp1586 hoist audio snapshot frame count
1587	101.46	discard	Lumen=d20a191f80aa7d06ea2936edd5c85577ea67e6f3	Lumen: experiment: exp1587 hoist audio snapshot frame gate
