experiment	commit	metric	status	description
224	ad32c30	80.14	discard	move submitted-frame bookkeeping off the synchronous outputQueue round-trip so the encode hot path only enqueues the diagnostic counter update; this blew up HEVC startup and collapsed the combined score
225	d17a8d0	90.62	keep	revive the old high-refresh HDR HEVC staging-backlog cap by limiting only that codec/mode to four inflight staging slots while leaving ProRes wide open; this finally improved both HEVC and ProRes on the corrected baseline
226	02fb54d	89.79	discard	raise the new high-refresh HDR HEVC staging-backlog cap from four slots to five; the extra slot gave back both HEVC and ProRes progress and proved four is the tighter sweet spot
227	9e01ffb	90.00	discard	pair the new four-slot HEVC staging cap with the older 217 callback pending budget; the staging cap and wider 218 callback budget turned out to be complementary, not redundant
228	2e0b959	90.00	discard	tighten the new HEVC-only staging cap from four slots to three; the extra pressure shaved startup a bit but still gave back the combined score versus the four-slot keep
229	9f09659	88.83	discard	reopen the wider 219-style callback budget on top of the four-slot HEVC staging cap; the callback-budget axis still regressed badly even after the staging fix
230	203180b	90.42	discard	decouple the source texture cache limit from the tighter HEVC staging cap by allowing up to eight cached surfaces; this preserved HEVC but produced no gain over the new best
231	55f2c48	90.00	discard	evict source textures incrementally instead of flushing the whole cache under the new HEVC staging cap; this protected HEVC startup a little but dragged ProRes down to the floor and lost the combined score
232	e0d0ccd	90.42	discard	let fresh high-refresh HDR HEVC staged frames release source pending budget as soon as the Metal command buffer is committed; the extra ingress headroom preserved HEVC but did not beat the four-slot staging-cap baseline
233	7ceac04	90.42	discard	release fresh high-refresh HDR HEVC staged source budget when the Metal command buffer is scheduled on the GPU instead of on completion; this still preserved HEVC but matched the prior no-gain ceiling
234	39eda78	90.00	discard	replace the staged source texture full-flush with a tiny LRU under the four-slot HEVC cap; preserving hot surfaces still cut both HEVC and ProRes progression versus the flush baseline
235	e97f8cc	90.21	discard	drop stale staged fresh HDR HEVC work once a newer source frame exists before VT submit; this improved ProRes startup a bit but still lost too much HEVC progression versus the four-slot baseline
236	89eb2c7	89.58	discard	drop stale staged fresh HDR HEVC work only when all staged slots are saturated; the pressure-gated filter still cratered ProRes and failed to improve HEVC enough versus the four-slot baseline
237	865315c	89.38	discard	reuse the last fresh HEVC staging buffer for idle/timer continuity replays instead of restaging unchanged surfaces; continuity replay still tanked ProRes and failed to move HEVC beyond the four-slot baseline
238	62635c5	89.79	discard	tighten high-refresh HDR HEVC staging only for cursor-overlay frames to three slots while keeping the global four-slot baseline for non-overlay work; overlay-specific pressure control still regressed both codecs
239	a5d662c	90.00	discard	reduce the high-refresh HDR HEVC staging pool minimum by one under the four-slot cap so detached staging preallocates less residency; this preserved the baseline HEVC score but still shaved ProRes progression and missed the combined best
240	da9ed4d	90.00	discard	reduce the high-refresh HDR HEVC staging pool minimum by two under the four-slot cap; the leaner detached pool still held the HEVC floor but cut ProRes startup and failed to beat the best
241	bd86583	90.00	discard	isolate cursor overlay textures into a dedicated tiny cache so overlay churn cannot flush staged source surfaces; this preserved the HEVC floor but still shaved ProRes progression and missed the combined best
242	0afa403	89.58	discard	give only the high-refresh HDR HEVC staged path a two-entry source texture cache cushion beyond the four-slot cap; the extra residency still cratered ProRes startup and missed the combined best
243	e58fdc2	90.21	discard	switch overlay-bearing high-refresh HDR HEVC staging to BGRA encoder input so the detached compositor can do a coherent BGRA copy-plus-overlay; HEVC progression ticked up slightly but the combined score still missed the four-slot baseline
244	795b605	89.58	discard	switch overlay-bearing high-refresh HDR HEVC capture surfaces themselves to BGRA so the detached compositor sees a coherent BGRA source path; startup improved a bit but both codecs lost progression and the combined score regressed
245	20ba5c1	89.38	discard	timestamp staged submissions only when they are actually ready for VideoToolbox instead of when Metal work is queued; the submit-time cadence simplification still dragged ProRes down and missed the four-slot baseline
246	aee853b	89.79	discard	defer immediate recovery replays while fresh staged HDR HEVC work is still inflight so stale replays stop competing with real fresh frames; HEVC progression rose slightly but startup and ProRes both regressed versus the baseline
247	0d9623f	89.58	discard	route the active high-refresh HDR BGRA private capture path through SLSHWCaptureDisplayIntoIOSurfaceProxying instead of direct IOSurface capture; this true backend switch regressed both codec progressions and missed the four-slot baseline
248	e9e66ea	90.00	discard	prefer the raw SkyLight display stream backend even for the active 120 Hz HDR BGRA overlay workload instead of the timer-driven private IOSurface backend; this backend-topology swap kept ProRes startup but still lost progression and missed the four-slot baseline
249	7c32f0b0	89.79	discard	only force the BGRA overlay capture backend when cursor composition is actually enabled; decoupling HDR overlay transport from cursor composition regressed both codecs and missed the four-slot baseline
250	68e658f	89.79	discard	double the timer-driven private HDR BGRA HEVC source cadence so the latest-wins encode path sees fresher frames; the source oversampling still regressed the combined score and missed the four-slot baseline
251	6121eb9	89.58	discard	trim the private HDR BGRA HEVC source IOSurface ring from the deep default down to five surfaces so source backlog better matches the four-slot staged path; this still regressed the combined score and missed the baseline
252	f92056c	89.38	discard	suppress immediate recovery replay if a staged fresh submission landed within one frame interval; the narrow replay gate improved HEVC slightly but cratered ProRes and missed the four-slot baseline
253	9ab3dc9	89.58	discard	move detached staging slot bookkeeping onto a dedicated queue so callback-driven slot release is visible immediately; the structural slot scheduler change still cratered ProRes and missed the four-slot baseline
254	db3f549	89.58	discard	release detached staging slots and pending source budget before HDR sample augmentation in the VT output callback; earlier callback-side resource release still regressed both codecs versus the four-slot baseline
255	46c80b8	90.00	discard	gate immediate recovery replay on the VT recommended parallelization backlog for high-refresh HDR HEVC so synthetic recovery cannot pile onto detached fresh work; backlog-aware replay suppression still missed the four-slot baseline
256	4476f85	89.79	discard	serialize all VT submissions onto the dedicated submissionQueue so fresh, staged, and replay work share one encoder-submit order; centralized submit ordering still regressed both codecs versus the four-slot baseline
257	5c0b381	90.42	discard	route detached staged HEVC submits back through encodeQueue so fresh and replay work share one VT submission order; staged-submit ordering still missed the four-slot baseline
258	3ac2950	89.58	discard	make immediate recovery replays explicitly own the keyframe request and only fall back to forcing the next fresh frame when replay cannot be emitted; deterministic recovery-keyframe ownership still regressed the four-slot baseline
259	e7e8c8a	89.79	discard	processor-local freshest deferred staged-frame mailbox at staging-slot boundary for fresh overlay-bearing HEVC
260	c0b7984	89.79	discard	replay idle/timer frames stop counting against source pending saturation budget; only fresh frames consume pending budget
261	87cf63f	89.58	discard	decouple detached HEVC staging pool minimum residency from four-slot inflight cap
262	006628f	90.00	discard	suppress idle/timer replay at source boundary while fresh overlay-bearing HEVC work is pending
263	bd39280	90.21	discard	split detached HEVC front-end pressure from four-slot callback-tail residency with a two-frame front-end gate
264	a2ec123	90.21	discard	retest 240hz q1 SkyLight bootstrap on top of corrected local detached four-slot HEVC best
265	7b0e5d4	90.00	discard	decouple encoded-frame delivery from callback stats serialization with dedicated delivery queue
266	32e1510	89.58	discard	avoid reapplying static HDR attachments on reused encode buffers by caching an HDR-configuration signature on reused CVImageBuffers; input-side attachment memoization did not beat the detached four-slot baseline
266	32e1510	89.58	discard	avoid reapplying static HDR attachments on reused encode buffers by caching an HDR-configuration signature on reused CVImageBuffers; input-side attachment memoization did not beat the detached four-slot baseline
267	c1b3db0	90.00	discard	bound worst-case HEVC frame QP to 40 only for high-refresh HDR detached mode; allowing more quantization headroom still did not beat the four-slot baseline
268	53c78e7	89.58	discard	explicitly set MoreFramesBeforeStart/MoreFramesAfterEnd=false for detached high-refresh HDR HEVC to remove any startup lookahead reserve; no-lookahead session semantics still did not beat the four-slot baseline
269	15b09ed	90.21	discard	switch detached high-refresh HDR HEVC from average-bitrate plus data-rate-limits to constant bitrate; constant-bitrate rate control still did not beat the corrected four-slot baseline
270	4873406	89.58	discard	set MinAllowedFrameQP=18 only for detached high-refresh HDR HEVC so easy regions cannot drop to ultra-low QP; minimum-QP floor still did not beat the corrected four-slot baseline
271	79b7346	89.58	discard	disable PreserveDynamicHDRMetadata only for detached high-refresh HDR HEVC because static HDR metadata is already attached separately; dynamic-metadata preservation was not the useful-output bottleneck
272	104ae11	89.79	discard	require hardware VideoToolbox encoding for detached high-refresh HDR HEVC sessions to rule out latent software or hybrid fallback in the useful-output cadence path
273	a4943ab	89.58	discard	force BaseFrameQP=28 for detached high-refresh HDR HEVC sessions when VideoToolbox reports support, to test whether disabling standard rate control improves useful-output cadence
274	c84c71b	89.79	discard	derive per-frame VideoToolbox presentation timestamps from mach displayTime instead of a synthetic frame-index timeline to test whether real arrival cadence improves detached HDR HEVC useful-output scheduling
275	5b33c0c	89.38	discard	prefer the same GPU registry ID for detached high-refresh HDR HEVC VideoToolbox sessions as the Metal staging device to test for hidden cross-GPU encoder selection overhead
276	665bf52	89.58	discard	isolate high-refresh HDR HEVC recovery replay into a dedicated VideoToolbox sidecar compression session so forced-IDR recovery no longer competes inside the primary fresh-cadence session
277	a517fa6	89.58	discard	clamp detached high-refresh HDR HEVC inflight staging allocation to VideoToolbox recommendedParallelizationLimit instead of treating it as a note only
278	589ae9f	89.58	discard	use a live detached HEVC inflight staging control loop that tightens four-slot admission to three after repeated high-latency staged callbacks and restores it after low-latency recovery
279	165cad7	89.38	discard	reuse the VideoToolbox encoder-owned shared pixel-buffer pool for detached high-refresh HDR HEVC staging when its advertised buffer attributes already match the staging dimensions and pixel format; encoder-pool staging still regressed both codecs relative to the four-slot baseline
280	7890038f	84.38	discard	replace the bridge q1 override with q2 for 120 Hz SDR-base HDR overlay so 3512x2290x120 partial-HDR capture uses the overlay/high-resolution queue path instead of the low-latency q1 choke point
281	d1e08562	89.38	discard	keep bridge forwarding semantics at q1 for 120 Hz overlay but leave the MDK source queue profile unset so MacDisplayKit autotuning can choose its own high-refresh SkyLight source candidate for SDR-base HDR overlay capture
282	c53f640e	86.88	discard	give 120 Hz SDR-base HDR overlay one extra Lumen core forwarding frame so startup and recovery can absorb one metadata-bearing frame without changing the generic q1 forwarding budget
283	8f80943+2166e61f	89.58	discard	keep q1 bridge semantics for 120 Hz overlay but widen only the SkyLight source queue depth to two by honoring explicit queueDepth overrides even when q1 is selected
284	c782c7d1	89.38	discard	remove the bridge-side BGRA preference for 120 Hz SDR-base HDR overlay so corrected local-package runs can use the raw YUV producer topology end-to-end instead of forcing BGRA private IOSurface capture
285	7dc19300	87.08	discard	reopen the raw YUV producer topology for 120 Hz SDR-base HDR overlay and pair it with q2 bridge semantics so the corrected local-package stack can test a non-BGRA partial-HDR producer path against detached BGRA best 225
286	22c8757+886f1008	89.38	discard	open a direct BGRA HEVC Main10 path for 120 Hz SDR-base HDR overlay by keeping the BGRA producer seam but letting MacDisplayKit admit BGRA frames directly to VT instead of forcing detached staging
287	80bd272	89.58	discard	serialize detached source-texture cache lookups, cursor texture cache lookups, and staging slot acquisition on the encoder queue so detached resource bookkeeping no longer races slot release across threads
288	6645114	89.79	discard	serialize detached presentation timestamp issuance through a dedicated frame-index queue so staged submits, direct submits, and recovery replays cannot race on the shared frame counter
289	b693c8b	89.79	discard	return detached staging slots synchronously on the encoder queue at VT output callback time instead of queueing slot reclamation asynchronously behind unrelated encode work
290	d53e627	89.38	discard	replace full-frame cursor-overlay branching in the BGRA-to-YUV detached path with a full-frame base conversion plus luma/chroma patch passes limited to the cursor region so tiny cursor overlays stop taxing the entire frame
291	09db0e2	89.58	discard	relax the automatic keyframe interval only for detached high-refresh PQ HDR HEVC so periodic keyframe cost drops while explicit immediate recovery still forces IDRs
292	9a2a3ea	89.58	discard	reorder detached stageAndEncode so staging-slot acquisition happens before source and cursor texture construction, failing early under slot pressure instead of spending texture/cache work on frames that cannot enter the encoder
293	e70e7ac	90.21	discard	release detached staged source-frame budget immediately after commandBuffer.commit so fresh capture admission is no longer blocked behind GPU completion latency
294	8095af2	89.79	discard	align private high-refresh PQ HDR HEVC source surface ring to five surfaces so producer pending depth matches the detached four-slot staging budget instead of oversupplying private IOSurface capture
295	9d64b50	89.38	discard	drop detached staged frame source and cursor-surface retention after GPU staging by replacing the post-staging frame payload with metadata only before VT submit
296	6abcf32	89.38	discard	cap private high-refresh PQ HDR HEVC recommended pending-frame budget to five while keeping the underlying private IOSurface surface ring unchanged so source callback pressure matches the detached path without shrinking capture residency
297	0f75c81	89.79	discard	move HDR static metadata augmentation and encoded-frame construction off the VT callback thread onto the output queue so detached high-refresh HDR HEVC can return from output callbacks earlier without changing transport semantics
298	ff83ccc	89.58	discard	move detached staged processing success and failure bookkeeping off synchronous outputQueue hops so commandBuffer completion does not wait behind output callback delivery and HDR transport work
299	2cfc422	90.42	discard	clamp detached high-refresh PQ HDR HEVC staging inflight to three only until the first completed output arrives, then restore the proven four-slot steady-state cap to test whether startup oversubmission is still the remaining bottleneck
300	72e31c0	89.58	discard	lower HEVC reference buffer count from one to zero on the corrected detached baseline to test whether VT inter-frame reference residency is still taxing useful-output cadence under partial HDR overlay
301	7b5a206	90.21	discard	retain the freshest staged slot outside the reusable pool so recovery replay never re-encodes a detached pixel buffer after the staging pool has recycled it for newer work
302	0c3d55a	90.00	discard	expand detached high-refresh PQ HDR HEVC staging inflight from four to five only until the first completed output arrives, then restore the proven four-slot steady-state cap to test whether startup under-admission is limiting useful-output cadence
303	f1bcf49	90.00	discard	make Lumen the sole HDR static-metadata owner for 120 Hz PQ HEVC by skipping MDK callback-side sample-buffer augmentation on that path
304	0c64ea2	90.00	discard	separate detached high-refresh PQ HEVC recovery replay backing from the reusable staging-slot pool with a tiny dedicated replay buffer ring
305	bea3505	90.00	discard	move VT submit/accounting counters off outputQueue sync onto a dedicated accountingQueue so detached high-refresh HDR HEVC submit path no longer blocks on callback delivery bookkeeping
306	2b7eec3	89.58	discard	replace detached commandBuffer completion callbacks with synchronous waitUntilCompleted plus immediate VT submit for high-refresh PQ HDR HEVC staged work
307	f778ce7	89.38	discard	prewarm the VideoToolbox session from resolved capture dimensions before the first detached HDR frame arrives so startup session creation cost is removed from the staged HEVC hot path
307	aff5dda	89.79	discard	force 120 Hz PQ HEVC BGRA overlay workloads onto the SkyLight display stream backend to test whether callback-driven producer topology beats the private IOSurface timer producer while keeping the detached encoder path unchanged
308	cfd3b7b	89.79	discard	exactly align high-refresh PQ HDR HEVC private producer depth by forcing the source surface ring and pending budget to four, matching the proven detached staging inflight cap
309	9b034f2	89.58	discard	prewarm detached staging slots and textures before source start for corrected high-refresh PQ HDR HEVC so first fresh staged frames avoid slot allocation on the source callback path
310	035ce1b	90.00	discard	route corrected private-direct PQ HEVC frames through an actor-owned latest-wins mailbox so source callbacks return before detached staging preparation runs
311	f30ef077	90.21	discard	trust MDK-authored complete HDR extensions on encoded ingress and skip Lumen HEVC static-metadata reinjection when sample buffers already carry both mastering display and content light metadata
312	b3f455f	90.00	discard	suppress cursor-overlay composition inside corrected detached high-refresh PQ HEVC staging to isolate whether cursor-plane blending itself is the remaining useful-output bottleneck
313	1da63947	90.62	discard	disable producer-side cursor emission only for corrected 120 Hz HDR overlay capture to isolate whether cursor-plane emission itself dominates the remaining ceiling
314	37c1678	89.79	discard	move private-direct producer cursor image and surface refresh off the capture timer queue by prewarming once synchronously and refreshing asynchronously on a dedicated cursor queue
315	daa1db7	89.79	discard	suppress private-direct stale clean-surface fallback on high-refresh extended-range capture misses so only freshly captured producer surfaces enter the detached path
316	39de8d7	89.79	discard	decouple private-direct producer frameHandler delivery from the capture timer queue by dispatching delivery onto a dedicated serial producer delivery queue
317	0a4d799	90.00	discard	move private-direct per-frame cursor draw geometry off the capture timer queue onto the producer delivery queue while preserving producer cursor emission semantics
318	e2457f73	87.71	discard	make SDR-base HDR overlay use 8-bit YUV capture+encode as an SDR base plane with no HDR base metadata
319	1c99b405	87.71	discard	keep BGRA producer but make partial HDR overlay encode an SDR 8-bit base with no HDR base metadata
320	496c298	89.38	discard	strip source surface and cursor overlay references from cached replay-state frames so recovery replay only retains encoded image buffers and timing metadata
321	e5a188fd	build-fail	discard	separate cursor emission from 120Hz HDR overlay base path by disabling producer cursor emission so the bridge can drop BGRA-for-cursor producer preference and try raw 10-bit producer topology
322	24825c63	89.79	discard	remove cursor-driven BGRA producer requirement from 120Hz HDR overlay by disabling producer cursor emission and updating the bridge contract to use raw 10-bit producer topology
323	8fa934c	90.21	discard	enforce source-order submission for completed detached HDR HEVC staging work before VT encode so out-of-order Metal completion cannot reshuffle fresh frame cadence
324	f0531cf	89.58	discard	raise detached HEVC output, encode, and submission queue QoS to prioritize useful-output callback scheduling under high-refresh HDR load
