experiment	commit	metric	status	description
1942	106.04	discard	MacDisplayKit=8e1ed76	MacDisplayKit: experiment: inline staged vt submit
1943	106.04	discard	Lumen=c0082b6	LumenMacBridge: experiment: preserve explicit forwarding capacity
1944	25.00	crash	MacDisplayKit=e99c381	MacDisplayKit: experiment: sample HEVC source cadence
1945	106.04	discard	MacDisplayKit=3746a02	MacDisplayKit: experiment: retry skylight cadence probe
1946	25.00	crash	MacDisplayKit=bc63677	MacDisplayKit: experiment: preconsume staged keyframe flag
1947	106.04	discard	MacDisplayKit=4443bda	MacDisplayKit: experiment: stabilize staged keyframe preconsume
1948	25.00	crash	MacDisplayKit=947ce90,Lumen=12d30530	MacDisplayKit: experiment: add temporal encoded lanes | Lumen: experiment: enable hevc temporal lanes
1949	106.04	discard	MacDisplayKit=fadaa68,Lumen=07d3e105	MacDisplayKit: experiment: retry skylight temporal lanes | Lumen: experiment: enable partial hdr temporal lanes
1950	25.00	crash	MacDisplayKit=a3f9b5f	MacDisplayKit: experiment: combine hevc retention cuts
1951	106.25	discard	MacDisplayKit=62ccf78	MacDisplayKit: experiment: stabilize hevc retention cuts
1952	106.25	discard	MacDisplayKit=da787eb	MacDisplayKit: experiment: stabilize encoded metadata cache
1953	25.00	discard	MacDisplayKit=ccd27eb,Lumen=5c2a7d33	MacDisplayKit: experiment: add spatial hevc tile encoding | Lumen: experiment: request encoded hevc tiles
1954	25.00	discard	MacDisplayKit=badbc49,Lumen=80c15d0d	MacDisplayKit: experiment: gate spatial hevc tiles on output | Lumen: experiment: request encoded hevc tiles
1955	25.00	discard	MacDisplayKit=6543961	MacDisplayKit: experiment: fallback prores source backend
1956	25.00	discard	MacDisplayKit=8db280c	MacDisplayKit: experiment: serialize skylight stream lifecycle
1957	NA	crash	MacDisplayKit=280c661	MacDisplayKit: experiment: fallback encoded source runtime
1958	25.00	discard	MacDisplayKit=64849a7	MacDisplayKit: experiment: defer skylight stream release
1959	25.00	discard	MacDisplayKit=bb72786	MacDisplayKit: experiment: cache metal conversion pipelines
1960	25.00	discard	MacDisplayKit=ac2b10c	MacDisplayKit: experiment: fallback raw skylight backend assembly
1961	25.00	discard	MacDisplayKit=130fa0f	MacDisplayKit: experiment: fallback skylight default properties
1962	25.00	discard	MacDisplayKit=91967ca	MacDisplayKit: experiment: warm public display stream before raw retry
1963	25.00	discard	MacDisplayKit=1679bde	MacDisplayKit: experiment: diagnose raw skylight create failure
1964	25.00	discard	MacDisplayKit=99ddd68	MacDisplayKit: experiment: retry raw stream at native mode size
1965	25.00	discard	MacDisplayKit=c473135	MacDisplayKit: experiment: proxy iosurface fallback for encoded source
1966	25.00	discard	MacDisplayKit=ef2c511	MacDisplayKit: experiment: cgdisplaystream fallback for encoded source
1967	25.00	discard	MacDisplayKit=021c5b6	MacDisplayKit: experiment: avfoundation fallback for encoded source
1968	25.00	discard	MacDisplayKit=cde3665	MacDisplayKit: experiment: route prores through avfoundation fallback
1969	25.00	discard	MacDisplayKit=7a927aa	MacDisplayKit: experiment: use avfoundation encoded source directly
1970	105.83	discard	MacDisplayKit=8027702	MacDisplayKit: experiment: narrow staging texture usage
1971	106.04	discard	MacDisplayKit=0d08b6d+87e5186	MacDisplayKit: experiment: cache processor hdr signal | MacDisplayKit: experiment: fix hdr signal override getter
1972	106.04	discard	MacDisplayKit=ff68e6a	MacDisplayKit: experiment: prime initial hevc keyframe
1973	106.04	discard	MacDisplayKit=d08039f	MacDisplayKit: experiment: require hardware vt encoder
1974	106.04	discard	Lumen=b992b668	Lumen: experiment: drain core forwarding without actor hop
1975	106.04	discard	MacDisplayKit=83875b4	MacDisplayKit: experiment: mark vt sessions as continuing streams
1976	96.17	discard	Lumen=f208a4be	Lumen: experiment: let hevc request native yuv capture
1977	103.54	discard	Lumen=f07b432b MacDisplayKit=ddb8ba9	Lumen: experiment: request native hevc yuv capture | MacDisplayKit: experiment: submit matching yuv directly
1978	102.92	discard	Lumen=5bc5ab74 MacDisplayKit=cfb74b2	Lumen: experiment: request native hevc yuv capture | MacDisplayKit: experiment: direct yuv without wrapper cache
1979	25.00	discard	MacDisplayKit=e0d2e40	MacDisplayKit: experiment: align hevc coded aperture
1980	105.83	discard	MacDisplayKit=df857e8	MacDisplayKit: experiment: height align hevc coded aperture
1981	106.04	discard	MacDisplayKit=b5b0dda	MacDisplayKit: experiment: width align hevc coded aperture
1982	98.04	discard	MacDisplayKit=85ec1f1	MacDisplayKit: experiment: add unscaled ycbcr read kernels
1983	106.25	discard	MacDisplayKit=f9387ae	MacDisplayKit: experiment: combine unscaled ycbcr conversion
1984	106.04	discard	MacDisplayKit=e5db156	MacDisplayKit: experiment: combine sampled ycbcr conversion
1985	103.83	discard	MacDisplayKit=3b37372	MacDisplayKit: experiment: enter replay actor from skylight callback
1986	106.04	discard	MacDisplayKit=dc7e978	MacDisplayKit: experiment: combine 420 conversion with unretained staging
1987	106.04	discard	MacDisplayKit=afd5b3d	MacDisplayKit: experiment: combine read 420 conversion with unretained staging
1988	104.04	discard	MacDisplayKit=103bf80	MacDisplayKit: experiment: skip hevc immediate replay cache
1989	106.04	discard	MacDisplayKit=bf58e75	MacDisplayKit: experiment: remove target fps high refresh gate
1990	106.04	discard	MacDisplayKit=64a5a5b	MacDisplayKit: experiment: enqueue staged submit before timing
1991	106.04	discard	MacDisplayKit=ea0a514	MacDisplayKit: experiment: defer encoded output assembly
1992	104.25	discard	MacDisplayKit=65dc65a	MacDisplayKit: experiment: pair combined conversion with early staged submit
1993	106.04	discard	MacDisplayKit=9b9daa8	MacDisplayKit: experiment: pair combined conversion with hot diagnostics alignment
1994	104.25	discard	MacDisplayKit=3118a61	MacDisplayKit: experiment: decouple encode stats accounting
1995	104.04	discard	MacDisplayKit=ccb8d5f	MacDisplayKit: experiment: decouple submitted frame accounting
1996	104.04	discard	MacDisplayKit=415a0a7	MacDisplayKit: experiment: align metal command queue capacity
1997	100.25	discard	MacDisplayKit=52fd147	MacDisplayKit: experiment: pair fused conversion with metal queue capacity
1998	98.04	discard	MacDisplayKit=c48f6ea	MacDisplayKit: experiment: use prores metal queue capacity
1999	102.04	discard	MacDisplayKit=c5e101d	MacDisplayKit: experiment: remove target fps high refresh gate
2000	106.04	discard	MacDisplayKit=4f34b67	MacDisplayKit: experiment: actorize encoded pending tracker
2001	106.04	discard	MacDisplayKit=6394f6d	MacDisplayKit: experiment: pair actor admission with fused conversion
2002	102.04	discard	MacDisplayKit=766e27e	MacDisplayKit: experiment: split hevc fused and prores actor admission
2003	106.25	discard	MacDisplayKit=a5c5bda,Lumen=0635360f	MacDisplayKit: experiment: restore fused ycbcr conversion; Lumen: experiment: share ingress sample buffer retain
2004	93.83	discard	MacDisplayKit=43bd783	MacDisplayKit: experiment: drain mailbox source frames in loop
2005	106.04	discard	MacDisplayKit=9576773	MacDisplayKit: experiment: hand skylight frames directly to replay actor
2006	106.04	discard	MacDisplayKit=cef5679	MacDisplayKit: experiment: use unscaled read ycbcr kernels
2007	106.25	discard	MacDisplayKit=1f5b709	MacDisplayKit: experiment: skip nonkeyframe hdr output inspection
2008	98.04	discard	MacDisplayKit=395e762	MacDisplayKit: experiment: pair hdr keyframe gate with actor admission
2009	94.04	discard	MacDisplayKit=c5fa0e6	MacDisplayKit: experiment: direct prores bgra submission
2010	104.25	discard	MacDisplayKit=ed02085	MacDisplayKit: experiment: direct prores bgra without output hold
2011	92.04	discard	MacDisplayKit=700c5c3	MacDisplayKit: experiment: pace prores bgra direct submit
2012	102.25	discard	MacDisplayKit=875c38e	MacDisplayKit: experiment: pair fused conversion with keyframe hdr gate
2013	96.04	discard	MacDisplayKit=c6c934f	MacDisplayKit: experiment: cache metal conversion pipelines
2014	106.25	discard	MacDisplayKit=9bbd0fa	MacDisplayKit: experiment: lazy prores color converter
2015	106.04	discard	MacDisplayKit=4604e8b	MacDisplayKit: experiment: pair lazy prores converter with early submit
2016	98.83	discard	MacDisplayKit=2c65a77	MacDisplayKit: experiment: lazy prores metal helpers
2017	106.25	discard	MacDisplayKit=8bfc738	MacDisplayKit: experiment: split hevc prores pipeline cache
2018	100.04	discard	MacDisplayKit=dae4970	MacDisplayKit: experiment: pair split cache with hdr gate
2019	100.25	discard	MacDisplayKit=8f9e6f7	MacDisplayKit: experiment: pair split cache with fused conversion
2020	105.83	discard	MacDisplayKit=9e1cce6	MacDisplayKit: experiment: decouple output delivery from stats queue
2021	98.25	discard	MacDisplayKit=546a27b	MacDisplayKit: experiment: submit hevc staged frames from metal callback
2022	104.04	discard	MacDisplayKit=2420038	MacDisplayKit: experiment: raise vt submission queue qos
2023	106.04	discard	MacDisplayKit=66c4159	MacDisplayKit: experiment: release source after metal stage
2024	106.04	discard	MacDisplayKit=66e2e09	MacDisplayKit: experiment: decouple prores output delivery
2025	98.04	discard	MacDisplayKit=1929951	MacDisplayKit: experiment: gate hevc hdr metadata transport
2026	106.25	discard	MacDisplayKit=a684f30	MacDisplayKit: experiment: lazy prores shared converter pipelines
2027	102.04	discard	MacDisplayKit=3dd6dfe	MacDisplayKit: experiment: split cache with prores command capacity
2028	106.04	discard	MacDisplayKit=10ef653	MacDisplayKit: experiment: split cache with prores output delivery
2029	25.00	discard	MacDisplayKit=f180ccb	MacDisplayKit: experiment: repeat hevc presentation gaps
2030	106.04	discard	MacDisplayKit=11b95f9,Lumen=c8b664fb	MacDisplayKit: experiment: split cache with ingress retain sharing | Lumen: experiment: share ingress retain with split cache
2031	105.83	discard	MacDisplayKit=4d71b55	MacDisplayKit: experiment: defer hdr sample resolution to output queue
2032	106.04	discard	MacDisplayKit=fa1a6bf	MacDisplayKit: experiment: async submitted frame stats
2033	92.04	discard	MacDisplayKit=200ce2a	MacDisplayKit: experiment: pair hdr gate with async stats
2034	104.04	discard	MacDisplayKit=524c4d4	MacDisplayKit: experiment: pair lazy prores converter with hdr gate
2035	106.04	discard	MacDisplayKit=6e3bcf8	MacDisplayKit: experiment: pair fused conversion with early source release
2036	102.25	discard	MacDisplayKit=b7ac6f0	MacDisplayKit: experiment: release prores source after metal stage
2037	103.83	discard	MacDisplayKit=9bfb6d2	MacDisplayKit: experiment: pair lazy prores converter with delivery queue
2038	105.83	discard	MacDisplayKit=7c599b7	MacDisplayKit: experiment: defer vt diagnostic property reads
2039	98.04	discard	MacDisplayKit=f5b1265	MacDisplayKit: experiment: pair split cache with prores source release
2040	25.00	discard	MacDisplayKit=c06db34,Lumen=d2321aee	MacDisplayKit: experiment: gate spatial hevc tile groups | Lumen: experiment: request gated hevc tile stream
2041	106.04	discard	MacDisplayKit=777a226	MacDisplayKit: experiment: pair split cache with hdr source diagnostics
2042	67.83	discard	Lumen=c591fc2f	Lumen: experiment: drain runtime probe at frame cadence
2043	106.04	discard	MacDisplayKit=300587b	MacDisplayKit: experiment: collapse skylight callback dispatch hop
2044	105.83	discard	MacDisplayKit=81ba94e	MacDisplayKit: experiment: pair actor replay with combined ycbcr conversion
2045	104.04	discard	MacDisplayKit=a71663e	MacDisplayKit: experiment: precompute staged VT frame state
2046	98.38	discard	Lumen=9a68b4c9	Lumen: experiment: request HEVC HDR YUV capture surfaces
2047	96.04	discard	MacDisplayKit=fac28db	MacDisplayKit: experiment: isolate videotoolbox timing metrics
2048	106.04	discard	MacDisplayKit=7ba1c2f	MacDisplayKit: experiment: submit target frame durations
2049	25.00	discard	MacDisplayKit=14c3b73	MacDisplayKit: experiment: extend hevc hdr keyframe interval
2050	79.83	discard	MacDisplayKit=6695574	MacDisplayKit: experiment: restart silent skylight startup
2051	106.04	discard	MacDisplayKit=ed0259d	MacDisplayKit: experiment: combine vt submit bookkeeping
2052	104.25	discard	MacDisplayKit=a58a9e5	MacDisplayKit: experiment: pair hdr keyframe gate with frame durations
2053	106.04	discard	MacDisplayKit=4875e0b	MacDisplayKit: experiment: preserve fresh mailbox under saturation
2054	104.04	discard	MacDisplayKit=10af0f0	MacDisplayKit: experiment: bound concurrent hevc vt admission
2055	94.04	discard	MacDisplayKit=dfc2143	MacDisplayKit: experiment: hold hevc source credit until output
2056	106.04	discard	MacDisplayKit=b0e7247	MacDisplayKit: experiment: discard saturated hevc replay frames
2057	25.00	discard	MacDisplayKit=98571e0,Lumen=bee2637d	MacDisplayKit: experiment: emit independent hevc tile lanes | Lumen: experiment: consume encoded hevc tile stream
2058	110.00	keep	MacDisplayKit=6588b59,Lumen=f3bd5684+df5fabec	MacDisplayKit: experiment: emit independent hevc tile lanes | Lumen: experiment: consume tile stream with protocol capacity + expose tile layout for capacity
2059	110.00	discard	MacDisplayKit=6845697	MacDisplayKit: experiment: isolate prores replay timer queue
2060	68.00	discard	MacDisplayKit=11eb329	MacDisplayKit: experiment: catch up prores replay frames
2061	110.00	keep	MacDisplayKit=6bbe0af	MacDisplayKit: experiment: isolate prores replay catch up
2062	110.00	keep	Lumen=56b4b799	Lumen: experiment: audit encoded tile frame groups
2063	110.00	keep	MacDisplayKit=e7a190f	MacDisplayKit: experiment: split hevc tile lanes by columns
2064	110.00	discard	Lumen=f197370e	Lumen: experiment: request three hevc tile lanes
2065	110.00	discard	MacDisplayKit=97eacad	MacDisplayKit: experiment: rotate hevc tile lane scheduling
2066	102.00	discard	MacDisplayKit=61d29cc	MacDisplayKit: experiment: align hevc column tile width
2067	110.00	discard	MacDisplayKit=1a57ff3	MacDisplayKit: experiment: parallelize hevc tile lane scheduling
2068	108.00	discard	MacDisplayKit=ff1eb4b,Lumen=3c5329d6	MacDisplayKit: experiment: expose hevc tile lane diagnostics | Lumen: experiment: surface hevc tile lane metrics
2069	100.00	discard	MacDisplayKit=f05fc8f,Lumen=55a2e73c	MacDisplayKit: experiment: expose fast hdr signal check | Lumen: experiment: use fast hdr signal for forwarding
2070	68.00	discard	MacDisplayKit=04a5649	MacDisplayKit: experiment: catch up hevc tile replay
2071	108.00	discard	MacDisplayKit=a1511ad	MacDisplayKit: experiment: preserve tile fresh mailbox frames
2072	92.00	discard	MacDisplayKit=63a2541,Lumen=818717cd	MacDisplayKit: experiment: expose vt timing percentiles | Lumen: experiment: collect vt timing percentiles
2073	102.00	discard	Lumen=180a86f8	Lumen: experiment: measure tile freshness composites
2074	98.00	discard	Lumen=d842a831	Lumen: experiment: measure skew bounded tile freshness
2075	92.00	discard	Lumen=45cad4c0	Lumen: experiment: measure tile freshness skew distribution
2076	96.00	discard	MacDisplayKit=9f81dcb,Lumen=ead741e8	MacDisplayKit: experiment: reverse hevc tile enqueue order | Lumen: experiment: measure tile freshness skew distribution
2077	69.00	discard	MacDisplayKit=79881ff,Lumen=1b8602e7	MacDisplayKit: experiment: pair hevc tile output by group | Lumen: experiment: measure tile freshness skew distribution
2078	102.00	discard	MacDisplayKit=e49a4f2,Lumen=3b70c063	MacDisplayKit: experiment: parallelize hevc tile lane scheduling | Lumen: experiment: measure tile freshness skew distribution
2079	102.00	discard	Lumen=7ea7abdb	Lumen: experiment: model receiver tile arbitration
2080	108.00	discard	Lumen=cbb28e27	Lumen: experiment: bootstrap receiver tile arbitration
2081	90.00	discard	Lumen=c9b6d9b5	Lumen: experiment: model phase-normalized tile arbitration
2082	104.00	discard	Lumen=5b6e6aa6	Lumen: experiment: model offline phase tile arbitration
2083	100.00	discard	Lumen=7854e57c	Lumen: experiment: measure nearest phase tile pairing
2084	94.00	discard	Lumen=6eb0a912	Lumen: experiment: measure arrival phase tile pairing
2085	92.00	discard	Lumen=8908a5ca	Lumen: experiment: model bounded partial presentation
2086	96.00	discard	MacDisplayKit=578c8cd	MacDisplayKit: experiment: fuse unscaled hevc 420 conversion
2087	88.00	discard	MacDisplayKit=101e49a	MacDisplayKit: experiment: let vt convert hevc hdr bgra input
2088	88.00	discard	MacDisplayKit=2e54527	MacDisplayKit: experiment: phase stagger hevc tile presentation timestamps
2089	100.00	discard	MacDisplayKit=fc86585	MacDisplayKit: experiment: defer hevc hdr callback augmentation
2090	92.00	discard	MacDisplayKit=54616cc	MacDisplayKit: experiment: set vt encode frame duration
2091	92.00	discard	MacDisplayKit=5744da2	MacDisplayKit: experiment: share tile metal command queue
2092	98.00	discard	MacDisplayKit=c93a895	MacDisplayKit: experiment: share tile vt output queue
2093	98.00	discard	MacDisplayKit=b41e9e5	MacDisplayKit: experiment: skip hevc tile session prepare
2094	96.00	discard	MacDisplayKit=a45d790	MacDisplayKit: experiment: share hevc tile vt session
2095	96.00	discard	MacDisplayKit=61834d9	MacDisplayKit: experiment: tune shared tile session cadence
2096	25.00	discard	MacDisplayKit=1308f9d	MacDisplayKit: experiment: cap shared tile inflight
2097	25.00	discard	MacDisplayKit=902d793	MacDisplayKit: experiment: pace shared tile submissions
2098	25.00	discard	MacDisplayKit=c34aa62	MacDisplayKit: experiment: share tile presentation timestamps
2099	25.00	discard	MacDisplayKit=279f474	MacDisplayKit: experiment: drain shared tile submissions
2100	25.00	discard	MacDisplayKit=81511ad	MacDisplayKit: experiment: limit shared tile source window
2101	25.00	discard	MacDisplayKit=da0bb2d	MacDisplayKit: experiment: widen shared tile source window
2102	25.00	discard	MacDisplayKit=676c93f	MacDisplayKit: experiment: zero shared tile frame delay
2103	25.00	discard	Lumen=ec774513	Lumen: experiment: classify runtime drop events
2104	25.00	discard	Lumen=7d607c2f	Lumen: experiment: fail runtime probe with no frames
2105	25.00	discard	Lumen=92e93773	Lumen: experiment: retry runtime probe startup capture
2106	25.00	discard	Lumen=0ce6d84b	Lumen: experiment: expose capture session startup stats
2107	25.00	discard	Lumen=7304d169;MacDisplayKit=68f662d	Lumen/MacDisplayKit: experiment: expose skylight source callback stats
2108	25.00	discard	Lumen=3ccc2828;MacDisplayKit=f386941	Lumen/MacDisplayKit: experiment: bypass raw skylight in probe
2109	25.00	discard	Lumen=0319a152;MacDisplayKit=9640bb8	Lumen/MacDisplayKit: experiment: enable raw skylight rect properties
2110	25.00	discard	Lumen=26747fa0;MacDisplayKit=4117f8c	Lumen/MacDisplayKit: experiment: use nil raw skylight properties
2111	25.00	discard	Lumen=68d85af3;MacDisplayKit=838d9a1	Lumen/MacDisplayKit: experiment: use rectless raw skylight profile
2112	25.00	discard	MacDisplayKit=b0dcf58	MacDisplayKit: experiment: retain raw skylight callback owner
2113	25.00	discard	Lumen=265c135f;MacDisplayKit=2946aa7	Lumen/MacDisplayKit: experiment: force public CGDisplayStream source
2114	25.00	discard	MacDisplayKit=7e0a1c8	MacDisplayKit: experiment: start raw stream through CGDisplayStream
2115	25.00	discard	Lumen=1b310d56;MacDisplayKit=c3eae6a	Lumen/MacDisplayKit: experiment: expose raw SkyLight lifecycle diagnostics
2116	25.00	discard	Lumen=88b31af2;MacDisplayKit=a9a219c	Lumen/MacDisplayKit: experiment: use main dispatch queue for raw SkyLight callbacks
2117	98.00	discard	Lumen=581bcb81;MacDisplayKit=3b4378d	Lumen/MacDisplayKit: experiment: run raw SkyLight preflight benchmark before encoded capture
2118	94.00	discard	Lumen=7b0252b6;MacDisplayKit=ffcef1a	Lumen/MacDisplayKit: experiment: reduce raw SkyLight preflight to 10ms warmup
2119	96.50	discard	Lumen=6863c0e;MacDisplayKit=5f35593	Lumen/MacDisplayKit: experiment: combine 10ms raw SkyLight warmup with shared HEVC tile-session cadence
2120	108.00	discard	Lumen=c9f78ae6;MacDisplayKit=7ceb653	Lumen/MacDisplayKit: experiment: event-driven first-complete-frame SkyLight warmup; numeric win rejected due HEVC drop/stability regression
2121	108.00	discard	Lumen=22501f65;MacDisplayKit=d5b9838	Lumen/MacDisplayKit: experiment: event-driven first-callback SkyLight warmup; numeric win rejected due HEVC drop/stability regression and worse group coherence
2122	110.00	keep	Lumen=d8efb2e4;MacDisplayKit=61903ed	Lumen/MacDisplayKit: experiment: event-driven first-clean-complete-frame SkyLight warmup; kept new best with zero evaluator drops but HEVC strict groups still 95
2123	98.50	discard	Lumen=8a94f1f1	Lumen: experiment: start runtime probe sample window only after first complete tile group; regressed to 190 HEVC records, 94 complete groups, 5 drops, and queued-frame pressure
2124	104.00	discard	Lumen=91562c30	Lumen: experiment: model stateful tile presentation offline in runtime probe; recovered 116 two-frame and 191 three-frame stateful updates but regressed to 96 complete groups with 3 HEVC drops
2125	84.00	discard	MacDisplayKit=336be99;base=afbbf7c	MacDisplayKit: experiment: shared tile VT session with callback-gated tile source release; kept ~36ms callback latency but regressed to 96 complete groups with 13 HEVC drops
2126	110.00	discard	MacDisplayKit=5243a74	MacDisplayKit: experiment: suppress post-clean raw warmup callback processing; tied best with zero drops, reduced warmup callbacks to 1, and nudged HEVC complete groups to 96 but did not beat score 110
2127	108.00	discard	MacDisplayKit=a00f3c2	MacDisplayKit: experiment: stop raw warmup stream from first clean callback via async stop queue; regressed to 94 HEVC complete groups, 5 incomplete groups, 1 drop, and warmup callbacks returned to 2
2128	50.00	discard	MacDisplayKit=d422f44	MacDisplayKit: experiment: fast-exit first clean warmup callback before dirty-rect accounting; collapsed stability with 30 HEVC drops, 96 complete groups, and warmup callbacks increased to 3
