experiment	commit	metric	status	description
1265	104.17	discard	MacDisplayKit=b90846b7108679b25797bcc82c0ff45b796028f1	MacDisplayKit: exp1265: disable hdr hevc wrap cache
1266	104.17	discard	MacDisplayKit=e0ec3a37e5fb43c3c0eadbb5ab68ee38f7f7638d	MacDisplayKit: exp1266: disable hdr hevc texture cache
1267	104.17	discard	MacDisplayKit=69256c2817bb11e990cf7c9b10355476f5e3203f	MacDisplayKit: exp1267: disable hdr hevc staging pool reuse
1268	104.17	discard	MacDisplayKit=0bfafca08bc6e1da4df28db5ea53ca1f41dd478d	MacDisplayKit: exp1268: disable hdr hevc staging pool attrs
1269	104.38	discard	MacDisplayKit=98d995a87915ddb00df453cf247c157708dd4212	MacDisplayKit: exp1269: reduce hdr hevc staging pool
1270	104.17	discard	MacDisplayKit=46fd0d6ce01e862f92baea2faae69d9af6144224	MacDisplayKit: exp1270: cap hdr hevc staging slots
1271	104.17	discard	MacDisplayKit=983585eaa9bfbb8cad08453377075a18bc4ca1b6	MacDisplayKit: exp1271: cap hdr hevc wrapped buffer cache
1272	104.38	discard	MacDisplayKit=10f0fb5c4a2450239775a93a6175d6343457de0b	MacDisplayKit: exp1272: cap hdr hevc texture cache
1273	104.17	discard	MacDisplayKit=e32944cac67f883c8c63164824a50abeff5d93a3	MacDisplayKit: exp1273: skip hdr hevc texture validation
1274	104.17	discard	MacDisplayKit=863e785577d4b9c07f9f6ae6a0aa9e080137b797	MacDisplayKit: exp1274: relax hdr hevc replay suppression
1275	104.17	discard	MacDisplayKit=ce20bd1f08f0ac7aa225cb9bd1ddb0c8a5c80098	MacDisplayKit: exp1275: tighten hdr replay timestamp
1276	104.17	discard	MacDisplayKit=c37416daa2bbe803e7b05d0f9fa47ce08e061737	MacDisplayKit: exp1276: defer hdr replay keyframe
1277	104.17	discard	MacDisplayKit=8c177555beb6124188849c84e8cd6d3ef288a72e	MacDisplayKit: exp1277: use replay backpressure fallback
1278	104.17	discard	MacDisplayKit=294bc35397463e5ec8bd219de7efb0932bd5b6d0	MacDisplayKit: exp1278: set hdr hevc frame duration
1279	104.17	discard	MacDisplayKit=ed5463f9b0bb5487cb7e6ce68f02e035a53af199	MacDisplayKit: exp1279: preserve hdr replay seed
1280	104.17	discard	MacDisplayKit=57028b65f3eed0592f258611b40515f4dc395fc1	MacDisplayKit: exp1280: clear hdr replay seed
1281	104.17	discard	MacDisplayKit=72969d17afca764d5b618ac30373448de84ba226	MacDisplayKit: exp1281: skip hdr replay wakeup
1282	104.17	discard	MacDisplayKit=1b305df46570a9e55a1fdc9fbd6ba09072fbeab7	MacDisplayKit: exp1282: skip hdr replay attachments
1283	104.17	discard	MacDisplayKit=1ad39166f5c53d7c0e0a806d08696170afee3861	MacDisplayKit: exp1283: trim hdr texture cache evictions
1284	104.17	discard	MacDisplayKit=25fbcb34b6442419a6aafee955a73b7bdd3a25b7	MacDisplayKit: exp1284: narrow hdr blit texture usage
1285	104.38	discard	MacDisplayKit=c5a264f8194ceb04b14a197e5f91aae401f027fa	MacDisplayKit: exp1285: skip hdr latency tracking
1286	104.17	discard	MacDisplayKit=cd1e4bfe43fda926605d7daa50e86cc1da3fd0e5	MacDisplayKit: exp1286: tighten callback pending frames
1287	104.38	discard	MacDisplayKit=4719da48667f61da0b6014156e1b07f58b1a56f9	MacDisplayKit: exp1288: flatten hdr callback pending frames
1288	104.38	discard	MacDisplayKit=a842d383ec06ce3677f7615a0794844aa92725d2	MacDisplayKit: exp1288: trim callback pending slack
1289	104.17	discard	MacDisplayKit=3714d1d2405efea534b997035f0c0cf6fab7cbb1	MacDisplayKit: exp1289: widen private capture surface pool
1290	104.17	discard	MacDisplayKit=9e706b6c2058c63595ce7aa78be4fc8639122913	MacDisplayKit: exp1290: widen prores private surface pool
1291	104.38	discard	MacDisplayKit=499dc8987be5d147fdb31c0acb6ccd8e8cdd1736	MacDisplayKit: exp1291: widen prores private pending budget
1292	104.17	discard	MacDisplayKit=3b1d1976e8768e741cff627016f1983b6dfd1bef	MacDisplayKit: exp1291: widen prores private pending budget
1293	104.38	discard	MacDisplayKit=663890d367a0eab7191f4efa4949fd551efbb65c	MacDisplayKit: exp1293: relax prores direct submit accounting
1294	104.17	discard	MacDisplayKit=c7e51b3e3a2d661cde441eaed8ca2631b2ce771d	MacDisplayKit: exp1294: relax prores success bookkeeping
1295	104.17	discard	MacDisplayKit=72a7f0d5c88665b26d88599d8442ab04168a7300	MacDisplayKit: exp1295: widen prores callback pending slack
1296	104.38	discard	MacDisplayKit=63aff0c9d79cb0f23b4d90d4c949e1f8396c4243	MacDisplayKit: exp1296: widen prores callback pending slack
1297	104.17	discard	MacDisplayKit=7475dc0df6dc429b5ec6f8aa9fbc5d4ed138bdce	MacDisplayKit: exp1297: add prores high-refresh q2 bootstrap candidate
1298	104.38	discard	Lumen=d44fcbec49ed4ec6295bcf1d4b71cccd42c9191b	Lumen: exp1298: keep prores bridge input strategy automatic
1299	104.38	discard	Lumen=79f798c0c0ac4b88ff27742d34a70e22e5ce7b74	Lumen: exp1299: raise prores auto queue to q4
1300	104.38	discard	Lumen=6d9c5ec9f10a4025d8d29296138322c54e6c64f3	Lumen: exp1300: add one prores forwarding slot at 120fps
1301	104.17	discard	Lumen=b20cebfa87e9b56e594b8dd74da84239ad8304db	Lumen: exp1301: lower prores auto queue to q2
1302	93.75	discard	Lumen=b50144f3e57f09d7b36bb95e9c20c188828a5163	Lumen: exp1302: lower prores auto queue to q1
1303	104.17	discard	Lumen=33c1748cfa66203f1c66cdb8a41005744693aeda	Lumen: exp1303: prefer bgra input for overlay prores
1304	98.59	discard	MacDisplayKit=748a3c5061da7341378a1982ddefcbe28c9412d2	MacDisplayKit: exp1304: prefer private iosurface backend for high-refresh prores
1305	104.17	discard	MacDisplayKit=d652b2722db8b859f30480d6f599a7f472d61f3f	MacDisplayKit: exp1305: raise prores expected cadence to 180hz
1306	103.3	discard	MacDisplayKit=1eb6ec617eef2ca1d16e95c9bec69a18198fa9c4	MacDisplayKit: exp1306: widen raw prores pending slack to ten
1307	104.17	discard	MacDisplayKit=d5ba46c272f768ca2bd6eaf72c8c71f973ab5dff	MacDisplayKit: exp1307: preserve p3 hdr signaling for prores
1308	104.38	discard	MacDisplayKit=c3c8c26dcb89de493aee94e0304803c4d52373bd	MacDisplayKit: exp1308: keep prores speed-quality bias at default
1309	104.17	discard	MacDisplayKit=257512052efb3bab81e6ec70780341904cc05405	MacDisplayKit: exp1309: keep prores realtime flag at default
1310	104.38	discard	MacDisplayKit=9ba3d502f1f447520206c9b9d3acea76cc124226	MacDisplayKit: exp1310: keep prores hdr metadata mode at default
1311	104.17	discard	MacDisplayKit=cdea80843d9adfd612e2b6137f7c6c3ab7163646	MacDisplayKit: exp1311: keep prores progressive scan at default
1312	81.52	discard	MacDisplayKit=81e371999cf264ec6fd411ccda06b2826f2834a4	MacDisplayKit: exp1312: leave prores hdr signal props at default
1313	102.71	discard	MacDisplayKit=2b9484af07c5ae930aa3a9b07d77541862c6f95d	MacDisplayKit: exp1313: omit prores content light session metadata
1314	102.5	discard	MacDisplayKit=195233d5d34ab605653a023505959741674f0b43	MacDisplayKit: exp1314: omit prores mastering display metadata
1315	102.29	discard	MacDisplayKit=07eda38339e383828604fff89fa5482724f11239	MacDisplayKit: exp1315: omit prores static hdr metadata
1316	103.13	discard	MacDisplayKit=ea1be78bd3b155ba9aeef722dc33faebdc871257	MacDisplayKit: experiment: MacDisplayKit: exp1316: default prores keyframe duration hint
1317	84.45	discard	Lumen=6e272e6ddb222bc76abd13cbdc0e32c23a513283	Lumen: experiment: Lumen: exp1317: tighten 120fps prores forwarding capacity
1318	102.5	discard	MacDisplayKit=61eb3f50685c00ca4e8475d176b5f48aa422aa77	MacDisplayKit: experiment: MacDisplayKit: exp1318: honor explicit 420 input for prores
1319	25.0	discard	Lumen=7c48b5d8c7f37adb4ba69bb64e0cf194537c7d59	Lumen: experiment: Lumen: exp1319: align prores capture format with explicit 420 input
1320	102.29	discard	Lumen=4701e611c7ca0a96a5c77123f018ea71db5d150b	Lumen: experiment: shorten callback-only prores restart delay
1321	101.67	discard	MacDisplayKit=4fd09b29b0c9b57a827b7abb71215db6de19a9af	MacDisplayKit: experiment: set prores realtime ceiling to 180hz
1322	89.17	discard	MacDisplayKit=8645cee894d9dcddc206645aaa546f12a556ffe0	MacDisplayKit: experiment: retune private prores surface pool
1323	104.28	discard	MacDisplayKit=6cdd9c793916518a8a90c00bd7cf13528fbaad8c	MacDisplayKit: experiment: enable private prores proxy capture
1324	101.88	discard	MacDisplayKit=bde6f6e076f4699b38e0e9f662cce50271724c9e	MacDisplayKit: experiment: collapse prores proxy surface ring
1325	101.67	discard	MacDisplayKit=ce6e75944996f2ccb393ee910abdbd8bf093f91a	MacDisplayKit: experiment: cap private prores pending backlog
1326	102.29	discard	MacDisplayKit=25094d3fe727323542867e90840a585faac7de5b	MacDisplayKit: experiment: disable private prores extended-range bit
1327	97.11	discard	MacDisplayKit=cbdf0297027b0b70aa42a4cedfef1820e1f2eee5	MacDisplayKit: experiment: prefer private iosurface for high-refresh prores
1328		discard	MacDisplayKit=05a9c8ed52e2e9051e020b514a5058147b33b7c7	reverted out-of-scope change in MacDisplayKit: Sources/MacDisplayKitObjCShim/Internal/MDKObjCShim.mm, Sources/MacDisplayKitObjCShim/Public/MDKObjCShim.h
1329	101.59	discard	MacDisplayKit=6a157325865cf06f738b8e8bd411738a36bb3a6d	MacDisplayKit: experiment: allow one prores frame delay at 120hz
1330	101.67	discard	MacDisplayKit=9c380809d9af37ff2e4def66303191f0f79c3545	MacDisplayKit: experiment: enable prores power efficiency at 120hz
1331	101.67	discard	MacDisplayKit=dd40b52e743bc0e095402e7880dddfd456919ee4	MacDisplayKit: experiment: lower prores expected cadence to 90hz
1332	102.08	discard	MacDisplayKit=056a5c13434a5579d356c334c37bcb27694e5ee1	MacDisplayKit: experiment: allow direct prores bgra passthrough
1333	102.77	discard	MacDisplayKit=67243170726a84147a380d52ccafa1ecd6b3dff9	MacDisplayKit: experiment: lower raw prores pending slack
1334	103.99	discard	MacDisplayKit=650f1552784e54c61870a93ab96bff966f5a51fc	MacDisplayKit: experiment: minimize raw prores pending slack
1335	25.0	discard	MacDisplayKit=00b3defb45836f3f79448e215567d2462906fd19	MacDisplayKit: experiment: prefer proxy iosurface path for prores
1336	79.04	discard	MacDisplayKit=0b759faf239693d23adfcac97c1ba4b1c590dda7	MacDisplayKit: experiment: normalize prores bgra input to 422
1337	78.21	discard	MacDisplayKit=c766066e0a1ac0d3120ac8e53cfb30afedf7125f	MacDisplayKit: experiment: prefer 422 capture for prores
1338	101.88	discard	Lumen=d8060139e9797cc77cdbcc9c29653b29701ca905	Lumen: experiment: collapse stale prores forwarding backlog
1339	101.67	discard	MacDisplayKit=9f0948b0b993f86524e7e3d6b5e0a14465bc328c	MacDisplayKit: experiment: exp1339 accept surfaced skylight idle frames
1340	25.0	discard	MacDisplayKit=314eca82e14d88d6e64cd7dd7f0abec4f35e3ed9	MacDisplayKit: experiment: exp1340 replay complete skylight gaps
1341	102.92	discard	Lumen=e242dff99be292fb063c674253f07e1ab6097ad8	Lumen: experiment: exp1341 gate bridge frame status tasks
1342	101.46	discard	Lumen=5e7e0c64f8364492503e05e8f01e1612566bc0ec	Lumen: experiment: exp1342 cache ingress payload size
1343	101.67	discard	Lumen=e092c17f23cc8622712f44cf38f52bf17e985bf7	Lumen: experiment: exp1343 mirror frame metadata only
1344	101.88	discard	Lumen=633dc16718630496fa8cc57d00e836f9000c47f1	Lumen: experiment: exp1344 compact encoded ingress queue
1345	102.28	discard	MacDisplayKit=aa2c061414005418b18b3246a5d2102ed67ea06d	MacDisplayKit: experiment: exp1345 reserve vt hot path storage
1346	102.08	discard	MacDisplayKit=6b0f6372a7b4748c19c78ede46cabf3b85cd7d79	MacDisplayKit: experiment: exp1346 reuse skylight display time for replay gate
1347	101.46	discard	MacDisplayKit=7180f44436cd664db8b68670269662ff4fa1f39b	MacDisplayKit: experiment: exp1347 skip prores hevc hdr augmentation probe
1348	101.46	discard	Lumen=c7bb55d1a601a25c5b6eda71e6ae32ec19bc857a	Lumen: experiment: exp1348 notify one encoded frame waiter
1349	101.88	discard	Lumen=9f28b576c33e57a6e922808c3d6083ab062fb01f	Lumen: experiment: exp1349 keep ingress last frame metadata only
1350	104.08	discard	MacDisplayKit=585812aa9178d48dbc36387b3db04f1ccf8fa7a9	MacDisplayKit: experiment: exp1350 skip prores source metadata decode
1351	101.46	discard	MacDisplayKit=fe12beb1646e7dc81f1526c1bc4fccf4e10076ac	MacDisplayKit: experiment: exp1351 keep replay frames out of overflow mailbox
1352	102.08	discard	MacDisplayKit=f8b15d21eeb007f68db0da17bc6925ab88115228	MacDisplayKit: experiment: exp1352 cache hdr pixel buffer attachments
1353	102.48	discard	MacDisplayKit=c57e39d0367c89a86457adedeb203d32912478cf	MacDisplayKit: experiment: exp1353 reuse hevc hdr payload scan
1354	103.14	discard	MacDisplayKit=549f9cd604aca36ec37fac96b3336b969d691b95	MacDisplayKit: experiment: exp1354 deliver vt frames before stats
1355	102.29	discard	MacDisplayKit=3d9f7b2ebda194d6e9d7e658d2dd83a1996a4a20	MacDisplayKit: experiment: exp1355 deliver vt frames directly
1356	101.46	discard	Lumen=84ebf52ead4d3f1ac0aca69a0afac39721d6a7b3	Lumen: experiment: exp1356 skip first frame diagnostics
1357	101.48	discard	MacDisplayKit=70a6aa8044ca541f1ce837d6d42f8118ac8e7038	MacDisplayKit: experiment: exp1357 skip confirmed hdr payload scan
1358	101.67	discard	MacDisplayKit=6571a0d2ba77b61d689b7b66efa43f398d78300f	MacDisplayKit: experiment: exp1358 cache encoded frame flags
1359		crash	Lumen=6a4539587706e713e2bd14f33bc4b7d004538a8d	Lumen: experiment: exp1359 route hevc hdr via private iosurface
1360	101.46	discard	Lumen=36023384ad146daf2cf2a8c3b6b25240558264fa	Lumen: experiment: exp1360 infer bridge hdr signal from config
1361	104.17	discard	MacDisplayKit=126357127cd942767e3cc99d0502bb14ab7c6132	MacDisplayKit: experiment: exp1361 prefer display stream proxy seam
1362	101.67	discard	MacDisplayKit=00fe85e0254c1fbf3915139f55d83340bdbaea81	MacDisplayKit: experiment: exp1362 reuse skylight capture surfaces
1363	102.08	discard	Lumen=84f39674e3ca7098da4736f0e5611b543514d37d	Lumen: experiment: exp1363 ensure private display set on runtime start
1364	101.74	discard	Lumen=ce373ccba953851e602dfbfbe3e8f9660714151c	Lumen: experiment: exp1364 ensure private display set before capture mirror
1365	101.67	discard	Lumen=a9bca1e6111d366dc399170d48602ebaafaad4e2	Lumen: experiment: exp1365 avoid overflow event string allocation
1366	103.07	discard	MacDisplayKit=14c94b2dfd763e36ffd7b142aee314795db23b7e	MacDisplayKit: experiment: exp1366 use requested skylight surface metadata
1367	101.25	discard	MacDisplayKit=fc27d98101beac141de48d8942bfcaa74a1057de	MacDisplayKit: experiment: exp1367 use staged surface metadata
1368	101.67	discard	Lumen=4bddc0e4442ad6ba9afc52a4adb2d20be663d225	Lumen: experiment: exp1368 skip high-refresh interval frame logs
1369	102.08	discard	Lumen=1b9fc21d0fa5b633cff208acf1c1928ca42c17b0	Lumen: experiment: exp1369 gate latest frame snapshot refresh
1370	101.67	discard	MacDisplayKit=5a9efc9bf5964933df770e10810cf02d44c6b651	MacDisplayKit: experiment: exp1370 skip callback source metadata decode
1371	102.29	discard	Lumen=d774217c8c0b33e72b4a1f0d34cce6bfb716f6f9	Lumen: experiment: exp1371 notify one encoded ingress waiter
1372	101.88	discard	Lumen=ebb63109989eeae0e176b6b07612430920f1ee20	Lumen: experiment: exp1372 bypass actor drain for encoded ingress
1373	102.29	discard	MacDisplayKit=ae0e5660ae6e99ae8394a28221928e0fd4211bdc	MacDisplayKit: experiment: exp1373 trim hevc startup event diagnostics
1374	101.67	discard	MacDisplayKit=aefb0cb8b20cc3b045666650bf12a4a6460177cc	MacDisplayKit: experiment: exp1374 cache vt source note flags
1375	101.79	discard	Lumen=4bd9b8da858e3d32054396b8ceed68bf30e7556f	Lumen: experiment: exp1375 notify encoded ingress on demand
1376	101.67	discard	MacDisplayKit=0fe27b43f33d9f563b4f64b6ce4c7abd0b36c878	MacDisplayKit: experiment: exp1376 own vt submit count on encode queue
1377	102.81	discard	MacDisplayKit=5011840be55d740866e38ce9c583ac159e6da119	MacDisplayKit: experiment: exp1377 use mach clock for vt latency
1378	101.67	discard	MacDisplayKit=89093a6b3ad0b55a920c58be5528ebae21a24a1e	MacDisplayKit: experiment: exp1378 audit private path boundary
1379	25.0	discard	MacDisplayKit=e5ae64c2cd6b48a14652c7482219d67175cf58ed	MacDisplayKit: experiment: exp1379 use iosurface proxy for hdr hevc
1380	103.15	discard	MacDisplayKit=47b7aae7f91248f672852aa166853a6dc225ecc2	MacDisplayKit: experiment: exp1380 split hot source diagnostics path
1381	101.46	discard	MacDisplayKit=fd75a803a6f0924260de7f1c943dfa529975c9ce	MacDisplayKit: experiment: exp1381 cache vt input layout
1382	102.29	discard	Lumen=51420e5243a28442536638f0eb5f2edf77110aab	Lumen: experiment: exp1382 store latest frame without actor task
1383	101.67	discard	MacDisplayKit=13fc7ca9b4ce3590c87ce711e43fc11a5fe74966	MacDisplayKit: experiment: exp1383 cache private capability probe
1384	102.29	discard	MacDisplayKit=956af9c4181e6f870960c7fd09a9bdcd432710ee	MacDisplayKit: experiment: exp1384 streamline dirty rect decode
1385	101.46	discard	Lumen=e7a060a57d1097e6af3b151155686de12fb50df9	Lumen: experiment: exp1385 mark prores bridge frames key
1386	102.14	discard	MacDisplayKit=169b44d6ba9109d475cd47438786dd4c25f9af85	MacDisplayKit: experiment: exp1386 fast path vt status accounting
1387	101.25	discard	MacDisplayKit=879b0a802982fd3198de6576eec3795f6828c386	MacDisplayKit: experiment: exp1387 avoid source handler self promotion
1388	101.67	discard	MacDisplayKit=1f0c44f26d42e603d4525bdaa1dff395db395485	MacDisplayKit: experiment: exp1388 defer skylight dirty metadata decode
1389	102.29	discard	MacDisplayKit=5be985ce5f0c73d6120a20ca8c6f102d80e97ec6	MacDisplayKit: experiment: exp1389 lock vt processing counters
1390	102.29	discard	MacDisplayKit=665fd23e533fd0b8d53c7dbdf760fb20e5d25479	MacDisplayKit: experiment: exp1390 fast path skylight frame action
1391	101.25	discard	MacDisplayKit=67da706e5b3f79f325237e6b733ceaf72b52e3a6	MacDisplayKit: experiment: exp1391 skip prores hevc hdr augmentation
1392	101.46	discard	Lumen=1edf8742ac4326bf64c898b0a5c6f0f6c32d6d1c	Lumen: experiment: exp1392 inline encoded frame ingress
1393	103.36	discard	Lumen=e3a96e295d021319f9eac698697b240834212e41	Lumen: experiment: exp1393 share retained ingress sample buffers
1394	101.1	discard	Lumen=6cedf3d5766f8dce12c547ed8a868cc1edc46214	Lumen: experiment: exp1394 skip drained payload sizing
1395	102.08	discard	Lumen=0bc10e09e96cbaac7179e7a4ba0b2eec209417c2	Lumen: experiment: exp1395 keep ingress last frame metadata only
1396	102.08	discard	MacDisplayKit=f345b73aa0d7c20363c645e4a2472f72bdbfe99b	MacDisplayKit: experiment: exp1396 avoid live summary encode barrier
1397	102.08	discard	Lumen=fc360de1a4670b49d88f1792a57268a371847108	Lumen: experiment: exp1397 reuse frame diagnostic hdr report
1398	102.5	discard	Lumen=278ef567d300fd2295e2dde82492bb5a67e2f525	Lumen: experiment: exp1398 precompute bridge frame flags
1399	102.29	discard	MacDisplayKit=d78203094a4319daf7f4603942c2b33c0b5aeb25	MacDisplayKit: experiment: exp1399 reuse keyframe frame properties
1400	102.08	discard	MacDisplayKit=4cc4dec0fd3c4d6d03d0b580a9c1bf6654d02214	MacDisplayKit: experiment: exp1400 skip hevc latency buckets
1401	101.67	discard	MacDisplayKit=ba736e1d691528a63d11fef86754b810aa737d1a	MacDisplayKit: experiment: exp1401 drop no-op completion release
1402	101.88	discard	Lumen=ba7523631e26c56a48bdd26b200d06a52c224978	Lumen: experiment: exp1402 aggregate probe latencies
1403	102.08	discard	Lumen=4d937588faa804aa6901662f9da3dddee36077b9	Lumen: experiment: exp1403 drain probe records only
1404	102.71	discard	Lumen=62a716c86fef7b93c12f618bf0d35a6eef590804	Lumen: experiment: exp1404 defer bridge delta diagnostics
1405	101.88	discard	Lumen=df346b7c542b6d9296664ae6dca76d4ab0e6da3b	Lumen: experiment: exp1405 add record-only probe drain
1406	102.29	discard	Lumen=326e68e777fd60f2bc98777734d4a85571a3fbb9	Lumen: experiment: avoid per-frame bridge actor snapshot
1407	103.36	discard	MacDisplayKit=7312fceedfd65cfd8cd66b8eead7908d6b90cd1a	MacDisplayKit: experiment: replace latest frame mailbox actor
1408	101.67	discard	MacDisplayKit=b1e7244d7acbde62288a7e3b498c7ad9d1332c28	MacDisplayKit: experiment: skip hevc source metadata decode
1409	93.88	discard	MacDisplayKit=d2549ff8417e4b485ecb52a045f88ada8b422ad1	MacDisplayKit: experiment: async handoff source frames
1410	102.29	discard	MacDisplayKit=0b026b9f216ba22df461cb9b428fef520a351617	MacDisplayKit: experiment: cache source cadence timebase
1411	101.67	discard	Lumen=59abfba7387a99a68e48aa6bb5dcbbabb9e4fdaa	Lumen: experiment: skip prores frame status task
1412	102.03	discard	Lumen=0e7e214f752e7d8c0cdcc87ef69ed5f7d9dff3f1	Lumen: experiment: notify ingress after unlock
1413	101.88	discard	MacDisplayKit=5dc97ee6a05dce155c96720c53f8914106d9f0af	MacDisplayKit: experiment: sparse skylight update drops
1414	102.08	discard	MacDisplayKit=3cad7b30a231073d5fa35654a4f54e7ad6348f15	MacDisplayKit: experiment: defer vt encoder attrs
1415	102.08	discard	MacDisplayKit=c86b571344eb521863aea1ab1ca30537eb437ad3	MacDisplayKit: experiment: reuse vt source attrs
1416	101.88	discard	MacDisplayKit=25da8bf7f0c1f0a119b36282f072e492e8de2fea	MacDisplayKit: experiment: fast path source texture cache
1417	101.67	discard	MacDisplayKit=3b048540666aa883b7cbc42aaba3bf212d9b6ce2	MacDisplayKit: experiment: fast path retained frames
1418	101.88	discard	MacDisplayKit=dc143fb343daf897f7f4721a8cadae1da6a84d02	MacDisplayKit: experiment: disable high-refresh source diagnostics
1419	101.46	discard	Lumen=47a241cf66250c7539815383217ee21c63830372	Lumen: experiment: direct bridge core codec
1420	102.29	discard	MacDisplayKit=859b26f330e2cb8d57ebe9b75fc64c5d20a32625	MacDisplayKit: experiment: cache encoded frame flags
1421	102.08	discard	MacDisplayKit=49c1cc6ab48e97f980baed9a2f91ffb93ea84c3f	MacDisplayKit: experiment: skip prores latency buckets
1422	101.88	discard	MacDisplayKit=708dd194c44c404e8ea95dd35a568d0b6c9de53f	MacDisplayKit: experiment: gate vt callback frame creation
1423	102.08	discard	MacDisplayKit=2e2dd1a0cc10ee64d13eed5a3807d6793af328ff	MacDisplayKit: experiment: cache color conversion note
1424	101.88	discard	MacDisplayKit=5139ce32ad60b9edbd6ef891743fa78382a6dd6c	MacDisplayKit: experiment: prefer extended range iosurface plan
1425	102.08	discard	Lumen=7882a5ee71c2af3d6b3329e4bd33a5265205a58c	Lumen: experiment: lighten startup capture event log
1426	102.29	discard	Lumen=bb70c52de126fd838f3a9710a9d55449544d88f5	Lumen: experiment: coalesce high refresh capture start status
1427	101.13	discard	MacDisplayKit=ba46c6b81872960ad17e3d2918825842bde2ceaf	MacDisplayKit: experiment: prefilter skylight callback drops
