experiment	commit	metric	status	description
0	1ee2f3df	25.00	baseline	runtime-dominant host stream metric baseline
1	474e9530	25.00	discard	live runtime probe inside xctest still failed to create SLDisplayStream and did not improve the metric
2	b14803b2	25.00	keep	standalone live capture probe became the new runtime baseline despite matching the previous scalar score
3	f0bd5263	25.00	discard	relaxing saturation-triggered idr wait and restart thresholds at 120Hz did not improve the runtime score
4	818076b1	25.00	discard	preserving HDR encoder config fixed overlay HDR signalling in the probe but did not improve the total runtime score because drop instability still dominated
5	fccde63f	20.00	discard	moving 4K 120Hz overlay auto queue from q1 to q2 reduced drops somewhat but regressed the synthetic score and still failed HDR signalling in the live probe
6	fe05c1ba	25.00	discard	multiplexed delivery cut drop events sharply but still left the total runtime score flat because latency stayed too high and overlay HDR signalling was still missing
7	01bd3a7e	20.00	discard	combining HDR overlay signalling with multiplexed q2 delivery still regressed the total score because latency and drop instability remained too high
8	e3d9eb57	20.00	discard	maximizing overlay queue headroom to q4 increased buffering but still regressed the total score because latency and drop instability worsened
9	4d09ea68	25.00	discard	forcing the private iosurface backend cut drop pressure sharply but still left partial HDR signalling at zero
10	a796b139	59.83	keep	combining the private iosurface backend with overlay hdr encoding restored hdr signalling while sharply reducing drop pressure
11	007b9843	47.50	discard	adding a 41 Mbps default bitrate for the 4k 120hz overlay path sharply regressed progression and callback latency
12	db1976f0	25.00	discard	switching the 4k 120hz overlay path to multiplexed delivery did not improve runtime progression or hdr signalling
13	1b0da5e	25.00	discard	forcing MDK to prefer private iosurface for high-refresh HDR overlay sessions did not move the runtime probe off zero-frame startup
14	a9d7b71b	25.00	keep	extending the runtime probe to wait through real startup exposed live HDR frames and callback backlog instead of falsely scoring the host path as an immediate zero-frame failure
15	143497c	37.02	keep	retuning the private iosurface surface pool for 4k-class 120 Hz capture cut startup time and drop pressure while preserving live HDR frames
16	7b2958f	25.00	discard	trimming the private iosurface surface pool another step regressed startup time and drop pressure even though HDR frames still arrived
17	b5efc56	25.00	discard	lowering the automatic HEVC low-latency bitrate target reduced encoder pressure somewhat but still regressed startup time and drop pressure versus the current best
18	aa705fa	63.20	keep	capping the high-refresh HDR HEVC staging backlog cut startup time and drop pressure sharply while preserving live HDR frames
19	c18418c	25.00	discard	tightening the HDR staging backlog to two frames destabilized the runtime probe and triggered a startup crash
20	31bd338	61.26	discard	setting the HDR staging backlog ceiling to three frames improved average latency slightly but still regressed the best total score because startup and drop pressure were worse than the four-frame cap
21	b7b606c	37.10	discard	dropping the HEVC max-frame-delay policy to zero increased startup time and drop pressure enough to lose most of the staging-backlog gains
22	7a6212b	30.55	discard	disabling temporal compression for the 4k 120 Hz HDR HEVC path regressed startup time and callback latency versus the current best
23	7d2c8d5	25.00	discard	reducing the private-direct pending frame budget to two at 120 Hz sharply regressed startup time callback latency and drop pressure
24	f9583e1	25.00	discard	serializing the encoded capture processing queue regressed startup time callback latency and drop pressure versus the current best
25	6b8deee	25.00	discard	raising the HDR staging backlog to five frames improved startup somewhat but left callback stalls and drop pressure far worse than the current best
26	d7cec3b	65.17	keep	raising the 4k-class private iosurface pool from four to five surfaces improved startup progression and average callback latency while preserving live hdr frames
27	35be35d	67.17	keep	capping the private-direct pending frame budget at three preserved the larger source pool gains while shaving startup time and drop pressure further
28	776a9bb	65.38	discard	raising the 4k-class private iosurface pool from five to six surfaces added a little progression but regressed max callback latency and drop pressure
29	643f254	67.38	keep	lowering the hdr staging backlog to three frames on top of the newer source pool and pending cap shaved max latency and kept drop pressure flat
30	173465d	25.00	discard	lowering the hdr staging backlog to two frames destabilized the runtime probe again and remains unusable even on the newer source configuration
31	2d25c87	64.54	discard	setting the hevc max frame delay to zero on the newer base regressed progression and did not recover any real latency points
32	ac535b3	63.17	discard	trimming the hevc low-latency bitrate range moderately still regressed max callback latency and drop pressure against the current best
33	d3c27ebb	36.85	discard	clamping the 120 hz core forwarding capacity to two frames in the bridge collapsed progression and startup despite looking appealing for latency
34	3a6f207	67.00	discard	lowering the private-direct pending cap to two reduced drop pressure but cut progression too sharply to beat the current best
35	e2ea061	25.00	discard	raising the private-direct pending cap to four destabilized the runtime probe and is not viable on the current best base
36	2d98c56	72.79	keep	loosening the hevc low-latency burst window cut drop pressure sharply enough to outweigh the lower frame progression on the current best base
37	ee8e3b6	71.21	discard	raising the private iosurface pool to six on top of the looser burst window recovered a little progression but reintroduced too much callback stall
38	93d340e	69.21	discard	lowering the private-direct pending cap to two on top of the looser burst window still made callback spikes worse than the current best
39	5f14bf2	66.38	discard	widening the hevc low-latency burst window beyond the current best only made callback spikes worse without recovering progression
40	936620c	43.95	discard	trimming the quarter-second low-latency burst under the current best setup sharply regressed startup progression and callback latency
41	b866b42	25.00	discard	setting the hevc reference buffer count to zero made the encode path dramatically less stable on the current best base
42	12eebd7	25.00	discard	switching the high-refresh raw skylight bootstrap from the synthetic 240 hz queue-two candidate to baseline queue-two collapsed startup latency and drop pressure on the current best base
43	32f1211	25.00	discard	switching the high-refresh raw skylight bootstrap to the queue-one synthetic 240 hz candidate still collapsed startup latency and drop pressure on the current best base
44	a49e5ed	30.17	discard	raising the hevc low-latency bitrate ceiling relieved some startup and drop pressure but left progression and callback latency far below the current best
45	448e338	25.00	discard	raising the hevc max-frame-delay count to two reduced some pressure but still collapsed runtime score because callback stalls stayed far outside the low-latency target
46	c91527b	25.00	discard	reusing cached encoded frames for synthetic replay did not relieve the raw skylight steady-state bottleneck and still collapsed startup latency and drop pressure on the current best base
47	d284ecc	25.00	discard	raising the hevc reference buffer count to two increased encoder state without relieving the raw skylight stall pattern on the current best base
48	b0c178c	25.00	discard	serializing callback-only processing removed fan-out ahead of the encoder queue but still worsened progression and callback stall pressure on the current best base
49	cfb49bc	41.42	discard	enabling open gop improved startup and drop pressure somewhat but still fell far short of the current best because callback latency stayed outside the low-latency target
50	b218a1e	47.61	discard	raising the high-refresh raw skylight pending depth into a two-to-three frame range improved startup and drop pressure but still failed to recover progression enough to beat the best burst-window setup
51	f35ba4d	25.00	discard	trimming the high-refresh raw skylight pending depth against the current clean base broke private-direct warmup outright for both hevc and prores-proxy so the runtime probe never reached steady-state delivery
52	07ab67d	25.00	discard	forcing high-refresh prores-proxy onto raw skylight changed the failure mode to an sldisplaystream construction nil while hevc still failed private-direct warmup so the backend preference did not improve runtime delivery
53	fbe1437	25.00	discard	revalidating the shallower two-to-three frame high-refresh skylight pending depth sequentially confirmed that it worsens startup latency callback spikes and drop pressure against the current codec-aware baseline
54	9436b0d	25.00	discard	disabling the fixed high-refresh skylight bootstrap and forcing startup benchmarking only increased startup latency callback spikes and drop pressure on the current codec-aware sequential baseline
55	45ec221	25.00	discard	disabling the extra 120 hz timer replay while leaving callback-driven idle replay intact increased starvation and worsened startup latency callback spikes and drop pressure on the current baseline
56	4e9a8ff	51.23	keep	lowering the hevc low-latency bitrate ceiling to 200 mbps reduced startup latency callback spikes and drop pressure enough to beat the median-filtered sequential baseline without sacrificing resolution frame rate or hdr delivery
57	99984da	46.33	discard	lowering the hevc low-latency bitrate ceiling further to 180 mbps gave back most of the gain from the 200 mbps keep and fell back near the current median baseline
58	46f77f5	34.95	discard	tightening the one-second burst window on top of the 200 mbps keep collapsed most of the gain from that bitrate cap and regressed back toward the unstable baseline
59	5d23719	84.75	keep	disabling hevc low-latency rate control on top of the 200 mbps cap lifted both codecs into the working 120 hz path with hevc startup latency callback spikes and drops collapsing far enough to raise the combined suite score sharply
60	2e0ca21	75.29	discard	switching ProRes Proxy to a raw 10-bit 4:2:2 source path lifted progression hard but triggered enough queue saturation and resync churn to drag the worst-codec suite score below the current keep
61	42e5336	63.17	discard	adding extra callback-only high-refresh pending headroom on top of the raw ProRes YUV path increased queue churn further and regressed the combined suite score well below the current keep
62	b45a52f	88.54	keep	feeding ProRes Proxy from a raw 10-bit 4:2:2 source and allowing direct submission for matching YUV frames cut the extra staging overhead enough to raise the worst-codec suite score above the prior hevc-only keep
63	18be30d	88.75	keep	lowering high-refresh HEVC max frame delay to zero on top of the direct YUV ProRes keep shaved a little more hevc callback latency and nudged the combined suite score to a new best
64	8554e4ff	25.00	discard	adding a tiny runtime-probe stimulus made both codecs reveal real dynamic invalidation weakness but overwhelmed the current hevc path badly enough that the official suite score collapsed instead of improving
65	e699362	88.54	discard	releasing direct hevc pending slots immediately after submit did not beat the current best combined suite score once measured on the stable no-stimulus metric
66	c520609	88.54	discard	disabling temporal compression for high-refresh hevc failed to lift hevc progression on the official suite and gave back a little prores latency headroom versus the current keep
67	3baaa74	88.96	keep	forcing the HEVC high-refresh bootstrap onto baseline-q1 improved hevc progression a bit without destabilizing prores and lifted the combined suite score above the prior best
68	452b0ad	88.98	keep	driving the high-refresh HEVC synthetic idle replay timer at 240 hz nudged hevc startup and max callback latency just enough to set a new combined suite best
69	5f25cac	88.75	discard	moving hevc high-refresh bootstrap back to min-frame-240hz-q1 still lost to the current best because progression did not improve enough to offset the slight combined regression
70	a94f662	79.19	discard	checking the hevc replay timer at 300 hz while keeping the emission gate at 240 hz helped hevc a bit but destabilized prores enough that the suite score collapsed
71	4e714e5	89.05	keep	lowering the hevc low-latency bitrate ceiling slightly from 200 mbps to 192 mbps eased encoder pressure enough to set a small new best without hurting prores
72	a17f515	88.58	discard	pushing the hevc low-latency bitrate ceiling down to 188 mbps over-corrected and dragged the combined suite below the 192 mbps keep
73	251d0cb	88.12	discard	raising the hevc low-latency bitrate ceiling back up to 196 mbps gave back too much combined suite score versus the 192 mbps keep
74	592ae63	87.25	discard	tightening only the hevc replay timer leeway did not help the limiting hevc path enough and regressed the combined suite score badly once prores noise was accounted for
75	337fbe7	88.94	discard	lowering the hevc target quality to 0.34 did not beat the 192 mbps keep even though it nudged prores forward because the limiting hevc path stayed flat
76	070e126	25.00	crash	forcing zero lookahead for high-refresh hevc sessions caused the hevc runtime probe path to die outright so that direction was discarded immediately
77	9f089f0	88.33	discard	pinning the quality property for high-refresh hevc sessions reduced hevc progression and failed to beat the 192 mbps keep
78	ea2da86	88.33	discard	raising the hevc idle replay ceiling from 240 hz to 300 hz reduced hevc progression and failed to beat the 192 mbps keep
79	c781853	89.17	keep	raising the hevc frame-rate hints to 240 hz improved the limiting hevc progression path enough to produce a new combined suite best
80	031ddd7	87.14	discard	pushing the hevc frame-rate hints past 240 hz to 300 hz regressed the combined suite badly enough that the 240 hz keep remains the better pacing hint
81	7b48086	87.31	discard	adding a latest-frame mailbox for queued hevc work did not beat the current best and regressed the combined suite despite the larger structural change
82	7d351b1	89.30	keep	forcing high-refresh callback-only hevc sessions onto a pending-frame limit of two reduced stale source admission enough to set a new combined suite best
83	0e36ecd	87.51	discard	forcing the high-refresh callback-only hevc pending depth all the way down to one over-tightened source admission and lost to the depth-two keep
84	fcec0dd	88.96	discard	forcing high-refresh hevc sessions onto the private iosurface backend did not beat the current skylight-based keep despite the structural backend change
85	419982d	85.12	discard	shortening the hevc keyframe interval to half a second hurt the combined suite badly enough that the current keep remains better
86	de8df70	86.08	discard	serializing the high-refresh hevc processing queue regressed both the limiting hevc path and prores stability so the concurrent handoff keep remains better
87	5c81bc4	88.75	discard	making only the high-refresh hevc encode handoff asynchronous improved prores but cost enough hevc progression that the combined suite stayed below the pending-depth keep
88	aacec70	59.34	discard	enabling VideoToolbox low-latency rate control for 120 hz hevc destabilized the encoder badly enough to crater startup and callback latency so that path is unusable
89	381dddd	88.75	discard	dropping the high-refresh hevc reference buffer count to zero did not move the limiting hevc progression path and gave back enough prores score to stay below the keep
90	2f9527a	87.48	discard	giving high-refresh hevc one frame of VideoToolbox delay tolerance failed to improve the limiting hevc progression path and regressed prores enough to lower the suite score
91	3c0b380	86.81	discard	a saturation-only latest-frame overflow for high-refresh hevc improved hevc latency a little but did not lift progression and regressed prores enough to lose to the pending-depth keep
92	1132d15	86.44	discard	pruning stale queued hevc work only when saturation and a newer display time existed still reduced hevc progression and failed to preserve enough prores score to beat the keep
93	91ebfe0	89.17	discard	preferring baseline-q2 for the hevc high-refresh bootstrap improved hevc progression but not enough to beat the baseline-q1 keep once the combined suite score was measured
94	67d51d4	89.17	discard	preferring the 240 hz q2 hevc bootstrap preserved the q2 progression gain and helped prores further but still did not clear the current baseline-q1 keep on the combined suite
95	688e9a5	88.96	discard	preferring baseline-q3 for the hevc high-refresh bootstrap added more queue headroom than the current best stack could afford and landed below both q1 and q2 variants
96	16dbf73	87.42	discard	splitting SkyLight replay from HEVC re-encode reduced HEVC progression and destabilized ProRes despite the larger structural change
97	473084f	87.93	discard	copying replay HEVC sample buffers with fresh timing still reduced HEVC progression and left ProRes below the kept high-refresh stack
98	7dd88d14+fcb4f3b	88.54	discard	driving partial hdr overlay regions from SkyLight reduced dirty rects preserved partial HDR but did not improve the limiting HEVC progression enough to beat the kept stack
99	d79daf5	91.09	keep	coalescing small SkyLight dirty updates at the source sharply improved HEVC progression and startup while also lifting ProRes enough to establish a new best
100	e9c5ff4	87.47	discard	broadening reduced-dirty coalescing to 24 percent over-coalesced high-refresh HEVC, collapsed progression, and also hurt ProRes stability
101	e2c742b	90.29	discard	tightening reduced-dirty coalescing to 12 percent avoided the worst over-coalescing but still fell short of the 18 percent producer sweet spot
102	e7a8021	89.04	discard	shortening the small-dirty emission interval let partial updates through too quickly and gave back the producer-side backpressure win
103	a5f3cb2	88.96	discard	lengthening the small-dirty emission interval over-absorbed tiny updates and pushed both HEVC progression and startup below the new best producer cadence
104	95a1f6b	91.36	keep	gating small reduced-dirty coalescing on consecutive bursts preserved meaningful partial updates while still cutting the HEVC producer flood path and established a new best
105	d7bf5b2	89.07	discard	broadening the burst-coalescing threshold to 24 percent still overreached and gave back too much stability despite preserving HEVC progression
106	cb5a30f	89.99	discard	keeping the small-dirty burst gate alive across replay emissions over-suppressed updates and lost too much HEVC progression
107	716fe12	89.60	discard	adding region clustering to the burst gate under-coalesced real partial hdr traffic and gave back too much HEVC progression
108	bd6b06e	89.15	discard	delaying burst coalescing until the third small update reopened too much producer churn and lost both HEVC progression and ProRes stability
109	5d2cb5c	89.04	discard	tightening the burst dirty threshold to 15 percent preserved more medium partial updates but lost too much HEVC progression to beat the 18 percent sweet spot
110	c2ed506	86.41	discard	adding a max-dimension guard to the burst dirty classifier under-coalesced real traffic and heavily regressed ProRes stability
111	c38cee9	83.74	discard	shortening the burst dirty coalescing window under the new burst gate reopened producer churn and severely regressed both HEVC and ProRes
112	faf284f	86.70	discard	lengthening the burst dirty coalescing window over-suppressed repeated partial updates even with the first-update pass-through gate in place
113	f36dc4f+1e6b9f25	89.19	discard	propagating zero-copy per-frame partial hdr dirty rects into the overlay transport was architecturally correct but did not improve the host-stream score enough to beat the burst-gated source keep
114	6e388d00	85.71	discard	treating source-side capture queue saturation as fully recoverable producer backpressure removed too much ingress recovery and regressed both hevc progression and prores stability
115	35f0ffa9	87.82	discard	collapsing repeated source-saturation resyncs into a single burst recovery reduced self-inflicted churn but still left both hevc and prores below the burst-gated source best
116	514189f	25.00	discard	allowing one extra startup-only pending hevc frame destabilized the hevc probe and crashed the runtime path before it could improve startup burst saturation
117	a61f570+71fdb20	87.51	discard	deferring one startup-only overflowed hevc source frame into the next available processor slot removed an observed source drop but still regressed the combined hevc and prores host-stream score
118	2a29caf1	84.41	discard	adding one extra 120 hz hevc bridge forwarding slot increased queue slack but still worsened both hevc startup and the combined host-stream score
119	a4417d6	86.81	discard	suppressing startup-only hevc saturation events reduced reported drops but did not beat the burst-gated source best once the full hevc plus prores suite was measured
120	65689fd	90.13	keep	prewarming the VideoToolbox session before source start beat the downloads checkout baseline once the real baseline was remeasured and established a new local best
121	c307f7f	88.93	discard	processing the first callback-only high-refresh frames inline removed one ingress queue hop but further regressed HEVC startup and combined score
