experiment	commit	metric	status	description
122	ed30fff	88.00	discard	submitting the first staged high-refresh frames synchronously after GPU completion worsened both HEVC and ProRes startup and closed the startup submit-hop direction
123	197922e	88.62	discard	prewarming startup staging slots did not recover HEVC progression and suggests the limiting startup cost is not lazy staged slot allocation
124	9923be6	85.45	discard	restoring the full historical measured stack did not reproduce on the downloads checkout because the old ProRes default path regressed badly under the current repo and host combination
125	b2dd590	88.76	discard	restoring only the historical HEVC and source-freshness keep stack still did not reproduce on the downloads checkout so the old measured baseline cannot be trusted here
126	942d9cb	88.60	baseline	remeasured the clean downloads checkout baseline after discarding the non-reproducible historical stack and used it to realign keep-discard decisions
127	091cb68	84.95	discard	plumbing reduced-dirty metadata and burst-gating tiny fresh updates directly into the current downloads baseline regressed ProRes badly and closed the source-freshness path in its current form
128	949a3ac	88.13	discard	reapplying the historical HEVC-only 192 Mbps 240 Hz and pending-depth retune on top of the current downloads best still regressed both startup and combined score
129	b453d0f	87.25	discard	prewarming startup staging slots only for ProRes regressed ProRes progression and showed that the current best is not limited by lazy ProRes slot allocation
130	1511d5b	88.62	discard	raising the high-refresh HEVC frame-rate hint alone on top of the current downloads best did not improve the combined host-stream score
131	95e129f	87.83	discard	clamping callback-only high-refresh HEVC pending depth to two frames on top of the current downloads best still regressed the combined score
132	8491167	89.12	discard	lowering the HEVC bitrate ceiling alone improved over the clean baseline but still did not beat the current downloads best session-prewarm path
133	9558862	88.62	discard	restricting the current prewarm path to HEVC only removed too much benefit so the downloads best is not a pure HEVC prewarm win
134	c708c3b	85.86	discard	restricting the current prewarm path to ProRes only collapsed the combined score so the downloads best depends on keeping prewarm enabled for both codecs
135	96b3b43	86.68	discard	setting high-refresh HEVC max frame delay to zero on top of the current downloads best regressed both HEVC and ProRes and closed that latency knob
136	c3876ee	88.42	discard	replacing the high-refresh encoded bootstrap default with baseline-q2 lost HEVC progression and confirmed that the current downloads best still prefers the request120-like queue-2 source bootstrap
137	d1599fc	87.50	discard	disabling the HEVC low-latency VideoToolbox encoder spec regressed both codecs on the current downloads best and closed that old-tree regression lead here
138	ff3bf37	88.55	discard	disabling high-refresh HEVC temporal compression did not improve progression over the current session-prewarm best and kept the remaining ceiling upstream of inter-frame dependency choices
139	2623aa0	88.62	discard	disabling high-refresh HEVC data-rate limits lifted ProRes modestly but left HEVC unchanged and failed to beat the current session-prewarm best
140	751a558	88.62	discard	raising callback-only high-refresh pending capacity from four to five lifted ProRes slightly but left HEVC unchanged and did not beat the current session-prewarm best
141	1979433	88.13	discard	releasing staged source frames immediately after Metal completion reduced source hold time but still regressed the combined score versus the current session-prewarm best
142	a77264be+7332271	66.06	baseline	corrected the Lumen macOS workspace to use the local /Users/skyline23/Downloads/MacDisplayKit package path and re-established the first valid baseline for the active checkout
143	a7ddf02	85.04	keep	reverting the local VideoToolbox prewarm hook removed the corrected-setup startup collapse and established the first real local-MacDisplayKit best
144	79de19e	84.83	discard	raising the high-refresh HEVC ExpectedFrameRate and ExpectedDuration hints to 240 Hz improved ProRes but regressed HEVC enough to miss the corrected local best
145	81ca617	83.04	discard	lowering the corrected-setup HEVC bitrate ceiling to 192 Mbps lifted ProRes sharply but regressed HEVC enough to miss the new local best
146	f8c392d	83.04	discard	disabling corrected-setup HEVC data-rate limits regressed HEVC further and confirmed that the remaining local bottleneck is not relieved by removing VideoToolbox burst pacing clamps
147	e94b48b+12cb6a4	82.83	discard	gating repeated small reduced-dirty fresh frames improved ProRes but regressed HEVC enough to show that source freshness is not the remaining corrected-setup win in this form
148	cf4647f	83.04	discard	preferring baseline-q2 over the request120-like queue-depth-2 bootstrap regressed the corrected local path and closed the raw-source default direction
149	5c896bb	84.83	discard	serializing the outer processing queue reduced fan-out overhead but still traded away too much HEVC progression to beat the corrected local best
150	a03fe81	90.00	keep	removing the extra processingQueue handoff and calling processor.process directly from the source callback established the new corrected local-package best
151	429e082	84.83	discard	queue the encode submission asynchronously instead of blocking the source callback on encodeQueue.sync; this hurt HEVC startup and latency badly under the corrected local-package setup
152	91bfcc8	90.21	keep	inline staged VideoToolbox submission directly from the Metal completion handler instead of hopping through submissionQueue after the staged copy; this improved the corrected local-package best
153	3cf2e4b+35854c5	90.00	discard	move VideoToolbox processing statistics bookkeeping off the synchronous outputQueue hot path; this did not beat the corrected local-package best and slightly hurt HEVC startup
154	5f495db	89.79	discard	release staged source frames immediately after the detached Metal copy completes instead of after VideoToolbox submission; this reduced the corrected local-package score
155	559d488	90.00	discard	deliver encoded frames directly from the VideoToolbox callback before the serial stats queue; this did not improve the corrected local-package best
156	727cd93	89.58	discard	reuse the already-copied HEVC payload when checking existing HDR static metadata before augmentation; this regressed the corrected local-package best
157	d8081b7	89.79	discard	avoid rebuilding an equivalent MDKCaptureFrame before dispatching onto the encode queue; this regressed the corrected local-package best
158	01c5cef	90.21	discard	remove per-frame source cadence and timing tracker recording from the encoded capture source callback hot path; this only matched the corrected local-package best
159	ce54405	NA	crash	synchronize staged slot release through encodeQueue from the VideoToolbox output callback; this caused the corrected local-package metric run to hang and was discarded
160	bf66c88	90.00	discard	raise the VideoToolbox encode, submit, and output queues to userInteractive QoS; this did not beat the corrected local-package best
161	ee46a75	25.00	discard	move source cadence and timing tracker recording to after pending-frame admission succeeds; this catastrophically regressed the corrected local-package run
162	1ef98b7	25.00	crash	prebuild staged source and cursor textures before entering the synchronous VideoToolbox queue; this crashed the corrected local-package runtime probe and was discarded
163	682c405	93.96	keep	double the high-refresh HEVC expected frame-rate and duration hints to 240 Hz on top of the corrected local-package staged direct-submit keep; this established the new best
164	b9962e5	69.64	discard	lower the HEVC low-latency average bitrate ceiling from 240 Mbps to 192 Mbps on top of the 240 Hz hint keep; this badly regressed the corrected local-package best
165	f16fb23	60.11	discard	set the HEVC max frame delay count to zero on top of the 240 Hz hint keep; this badly regressed the corrected local-package best
166	7678bd7	88.54	discard	increase the callback-only high-refresh SkyLight recommended pending-frame count by one slot on top of the 240 Hz hint keep; this regressed the corrected local-package best
167	9e2ee69	67.82	discard	reduce the callback-only high-refresh SkyLight recommended pending-frame count by one slot on top of the 240 Hz hint keep; this badly regressed the corrected local-package best
168	184d29b4	72.74	discard	stop treating capture processing queue saturation as a decoder reset or restart trigger in Lumen ingress; this removed recovery entirely and caused severe backlog-driven latency and startup regressions
169	fd674475	73.34	discard	gate saturation-triggered resync on repeated packet stalls in Lumen ingress; this still let startup backlog run away and did not recover HEVC progression
170	b7050537	81.97	discard	handle startup queue saturation by requesting a fresh IDR without flushing ingress state or restarting the session; this improved over fully disabling resets but still left startup backlog and regression versus the best
171	c1c56248	57.63	discard	lightly reset startup saturation backlog by flushing ingress and requesting a fresh startup IDR without a full decoder resync; this amplified startup drop churn and regressed far below the best
172	6c8042b2	89.79	discard	fast-forward startup ingress backlog toward the freshest queued recovery point while waiting for the first IDR packet; this removed drop churn and improved startup materially but still regressed the active best
173	9a36abd4	90.21	discard	combine startup backlog fast-forwarding with an immediate fresh IDR request when no queued recovery point survives; this substantially improved bring-up but still did not beat the active best
174	bc3d770f	89.58	discard	gate startup backlog fast-forwarding and fresh IDR requests behind observed startup queue pressure; this preserved the same bring-up pattern but still regressed the active best
175	7e7da337	90.21	discard	clamp the shared encoded ingress to a single startup frame and restore steady-state capacity after the first accepted packet; this matched the best Lumen-side startup latest-wins result but still trailed the active best
176	eb33378b	89.17	discard	clamp startup forwarding capacity in the bridge actor and restore steady-state capacity after the first encoded frame callback; this moved startup latest-wins earlier but restored too early to beat the active best
177	4b50d841	81.01	discard	keep the bridge startup forwarding clamp active until the first startup key frame arrives; this held startup latest-wins too long and regressed HEVC with new drop churn
178	c8dd54f8	65.38	discard	limit startup bridge forwarding clamp to high-refresh HEVC only and restore steady-state capacity after the first encoded frame; this still destabilized startup and regressed both codecs
179	16d3f383	88.96	discard	teach the shared encoded ingress to keep only the freshest startup frame until a recovery point is queued and to end startup mode when that recovery point is consumed; this improved startup latency but reduced early progression below the active best
180	ea3f97ee	89.17	discard	preserve a startup recovery point plus one following frame in the shared encoded ingress; this kept startup latency low but still did not recover enough early progression to beat the active best
181	5a1f3db7	90.00	discard	widen the shared-ingress startup recovery continuity window to the recovery point plus two following frames; this improved early progression but still did not beat the active best
182	a4dffa5	89.79	discard	defer SkyLight synthetic idle replay until the first encoded output callback; this removed startup duplicate churn but reduced HEVC and ProRes progression below the active best
183	46fcb69	89.79	discard	separate replay and recovery by forcing immediate keyframe requests to wait for fresh frames and never replay the last submitted frame through VT; this confirmed startup still lacks enough fresh early continuity to beat the active best
184	07bb47a	NA	crash	prioritize fresh frames over replay backlog by dropping replay admission whenever pending work exists; this build failed because the replay-origin metadata experiment had already been reverted from the baseline
185	4cb42be	89.38	discard	split fresh, replay, and recovery flow by tagging frame origin, keeping recovery bound to the last fresh frame, and making replay low-priority admission; this proved replay still carries too much early continuity to deprioritize without hurting startup
186	e72c92b+8a5102de	NA	crash	move continuity replay after encode and mark replay frames in Lumen ingress; the first build crashed because the MDK origin-tagging stack was incomplete
187	2bd5e62+b6319d82	NA	crash	continue the post-encode continuity replay experiment after restoring MDK origin tagging; the first retry still failed because bridge synthetic forwarding needed a default non-replay flag
188	2bd5e62+b6319d82	93.96	discard	move continuity replay after encode, tag replay frames through the bridge, and exempt replay-tagged duplicate payloads from recovery; this matched the active best but did not improve it
189	b06dbf8+b6319d82	93.75	discard	keep post-encode continuity replay but remove immediate encoder-side keyframe replay so recovery only latches the next fresh keyframe; this slightly reduced HEVC and ProRes progression below the active best
190	6fe808a	94.58	keep	separate recovery replay from continuity replay by tagging fresh versus replay frames, pinning immediate keyframe recovery to the freshest real frame, and suppressing duplicate recovery replays for the same fresh frame
191	dc01bb7	93.54	discard	gate immediate recovery replay on fresh-frame age so very recent fresh frames absorb the pending keyframe request instead of triggering a synthetic replay; this reduced HEVC and ProRes progression below the active best
192	44c0e154	93.96	discard	suppress redundant wait-for-IDR resets while an external keyframe request is already in flight so duplicate payload and saturation signals stop reflushing ingress state; this matched an older best but did not beat the current fresh-frame recovery replay keep
193	518dcb5	94.58	discard	route replay-origin frames through an actor-backed latest-wins mailbox so only fresh frames consume synchronous pending admission while replay drains when capacity returns; this matched the active best but did not improve it
194	c0137f6+e53b30c0	94.38	discard	move continuity replay after encode on top of the fresh-frame recovery split and mark replay duplicates in ingress so only fresh output and immediate recovery stay on the VideoToolbox path; this improved structure clarity but scored below the active best
195	1302e5f+2e013c52	94.58	discard	offload only synthetic timer replay after encode while keeping idle replay and fresh-frame recovery on the active-best VideoToolbox path; this matched the active best but did not improve it
196	ad6bc5a	90.42	discard	use only completed fresh output as the recovery replay source instead of the last submitted fresh frame; this delayed recovery too much and collapsed early HEVC and ProRes progression
197	6fc92d0	89.58	discard	apply MaxFrameDelayCount=0 only during high-refresh HEVC startup and restore the steady-state delay budget after the first output callback; this still collapsed early HEVC and ProRes progression below the active best
198	1cfd688	93.96	discard	apply a startup-only 360 Hz HEVC expected frame-rate and duration hint before the first successful output callback, then restore the steady-state 240 Hz hint after startup completes; this matched the older pacing-only HEVC gain but regressed versus the active fresh-frame recovery split
199	3c3de6f	93.54	discard	extend the startup-only 360 Hz HEVC expected frame-rate and duration hint across the first three successful output callbacks before restoring the steady-state 240 Hz hint; the longer startup pacing window reduced both HEVC and ProRes progression below the active best
200	110de85	90.42	discard	skip steady-state HEVC data-rate limits for the first three successful startup outputs and restore them afterward so early output is not clamped by the long-run bit budget; this sharply reduced both HEVC and ProRes progression and closed the startup data-rate split axis
201	453ae41	88.75	discard	let immediate recovery replay force a keyframe without consuming the pending next-fresh keyframe request so the next real fresh submission also stays recovery-ready; this caused excessive keyframe pressure and collapsed both HEVC and ProRes startup progression
202	7295278	88.54	discard	suppress synthetic recovery replay when a fresher real frame has already been submitted before the replay reaches the encode queue; even generation-accurate replay suppression collapsed startup continuity for both codecs
203	b0063b1	89.17	discard	run immediate recovery replay synchronously on the encode queue instead of deferring it asynchronously so recovery work lands earlier; prioritizing replay timing this way still hurt startup continuity and both codec scores
204	64c5edc	88.75	discard	allow only one idle or timer replay submission between successful output callbacks so continuity replay cannot flood the encoder path; continuity density turned out to be necessary and both codecs regressed sharply
205	b9547b8	88.54	discard	add an actor-backed latest-fresh-frame mailbox at the source boundary so saturated fresh frames are retained and drained after pending capacity returns; preserving fresh frames this way still collapsed startup continuity and did not improve the active best
206	90061cc	20.00	crash	reduce HDR HEVC staging cost by letting the staged HDR HEVC path accept BGRA input while keeping Main10/HDR session properties; this caused private direct IOSurface capture warmup failure for both codecs and crashed the runtime probe
207	484c5f54	87.71	discard	widen bridge forwarding capacity for >=120fps HDR paths by one slot and update bootstrap expectations; this compiled after bridging replay compatibility but regressed HEVC/ProRes progression and startup badly
208	3ae2d36	89.58	discard	reduce ProRes Proxy detached staging when direct submit is already valid and restore replay metadata contract for the local-package bridge; build succeeded but both HEVC and ProRes progression regressed versus the current best
209	51b9fc5	89.79	discard	restore replay metadata across the local MDK-to-Lumen package boundary so the local-package bridge builds against the fresh-frame recovery split; this re-enabled the build but measured far below the historical best
210	45b29279	89.79	keep	select a corrected local-package baseline by defaulting bridge-consumed MDK frames to non-replay against MDK best 6fe808a; this does not recover the historical 94.58 but restores a reproducible buildable baseline for continued autoresearch
211	eaeb7a1	89.79	discard	let matched-format ProRes Proxy frames stay on the direct submission path on the corrected local baseline; this did not improve either codec and slightly reduced ProRes progression
212	5082bd8	89.79	discard	avoid reapplying identical HDR image-buffer attachments on replayed frames by caching a per-buffer marker; this improved callback timings slightly but did not move fresh-frame progression or the combined score
213	9ace9f9	89.79	discard	deliver encoded frames directly from the VT output callback thread and leave the outputQueue for bookkeeping only; removing this callback-to-consumer hop did not improve fresh-frame progression on the corrected local baseline
214	6d67104	90.00	keep	release direct-path pending budget immediately after VT accepts an IOSurface-backed frame while leaving staged paths unchanged; this recovered ProRes startup/latency enough to raise the corrected local baseline
215	999f8c1	89.58	discard	combine direct-path early pending release with direct VT callback delivery; once the callback hop was removed on top of the new baseline, both HEVC and ProRes startup regressed
216	d41d4bb+7c665a30	89.58	discard	restore replay provenance across the local MDK-to-Lumen boundary on top of the corrected direct-submit baseline; HEVC progression ticked up slightly but ProRes stayed flat and the combined score regressed
217	deddcfe	90.21	keep	add one more high-refresh SkyLight callback-low-latency pending slot on top of the corrected direct-submit early-release baseline; this improved both HEVC and ProRes enough to raise the corrected best
218	85bfb83	90.42	keep	add yet another high-refresh SkyLight callback-low-latency pending slot above 217; HEVC held while ProRes startup and latency improved further, raising the corrected best again
219	c7f364c	90.21	discard	probe one more high-refresh callback-low-latency pending slot above experiment 218 by raising the callback budget to queueDepth+5/min7/max9; the added floor hurt startup/progression and fell back to experiment 217 levels
220	9f43130	78.47	discard	keep the experiment 218 startup floor of six callback frames but allow one extra high-refresh slot under pressure with queueDepth+5/min6/max9; this blew up HEVC startup and collapsed the combined score
221	d2496dd	90.00	discard	keep experiment 218's wider callback budget for HEVC but relax ProRes back toward experiment 217; codec-specific pending budgets gave back too much ProRes and still failed to lift the combined score
222	0ccaaa8	90.21	discard	keep experiment 218's cold-start callback budget at queueDepth one but expand more aggressively only after pressure appears; the pressure-only headroom merely fell back to experiment 217 levels
223	b96676a	89.79	discard	provide an explicit 240 Hz-style per-frame duration alongside the existing high-refresh HEVC session hints; VT still produced fewer useful outputs and regressed below the corrected best
