experiment	commit	metric	status	description
788	104.17	discard	MacDisplayKit=205e48c3e8a96000f21f90adcb983a12bbcc8c07	MacDisplayKit: exp788: stop rebuilding capture frames
789	104.38	discard	MacDisplayKit=6d5a9389ba50648809b3856b00b3cff292495a12	MacDisplayKit: exp789: stop scanning note prefixes
790	104.38	discard	MacDisplayKit=45715c3cd7b272d64732923da320ee454b4ad43f	MacDisplayKit: exp790: coalesce immediate keyframe requests
791	104.38	discard	MacDisplayKit=326b0367a0db61032893137f73aa40016ab6627a	MacDisplayKit: exp791: submit replays without frame rebuilds
792	104.17	discard	MacDisplayKit=341046aa455571bd2501a50a73321d7bccc98075	MacDisplayKit: exp792: skip hdr reapply on recovery replays
793	104.17	discard	MacDisplayKit=4d7a3b0170fe168a60655c56f0b3b6e35e82ee9f	MacDisplayKit: exp793: skip impossible replay scheduling
794	104.17	discard	MacDisplayKit=a0c81d3bcaaea558bfa117603a64670eeb255c2e	MacDisplayKit: exp794: disable vt hevc hdr metadata insertion
795	104.17	discard	MacDisplayKit=80648013ad54bfc12d21867f3e0e41517c70c6d4	MacDisplayKit: exp795: widen hevc source texture cache
796	104.17	discard	MacDisplayKit=b4c61779caa89bea8bf82f4562a86da7402ff174	MacDisplayKit: exp796: evict one hevc texture cache entry
797	104.17	discard	MacDisplayKit=f0c338e3cb12efc87c67a24d96d743a262e524fa	MacDisplayKit: exp797: keep recent hevc source textures
798	104.38	discard	MacDisplayKit=291f1dad5fd69fec01b59e1beb00924d89c6d31d	MacDisplayKit: exp798: dedupe hevc slot release checks
799	104.38	discard	MacDisplayKit=f9271d7be5cc02a5731e4901ee2183b367bba3a5	MacDisplayKit: exp799: split vt delivery from stats queue
800	104.17	discard	MacDisplayKit=4e5d68b204d81da974d79b94fbae2b06fbfc0453	MacDisplayKit: exp800: lock the latest frame mailbox
801	104.38	discard	MacDisplayKit=4b16aff739ac46d800e0d0ae0d3239fd22124840	MacDisplayKit: exp801: skip hot-path source drop events
802	104.38	discard	MacDisplayKit=1e3b85815bba42b0618082e22e5e6588d9e8777b	MacDisplayKit: exp802: drop dead vt finalize barrier
803	104.38	discard	MacDisplayKit=e3482f99aa0b2f026da599822bb64235c4c9e9bb	MacDisplayKit: exp803: queue callback-only frame delivery
804	104.17	discard	MacDisplayKit=c4746486957163e732ab5894c8ebc8c1c8f10379	MacDisplayKit: exp804: lengthen hevc idr interval hint
805	104.17	discard	MacDisplayKit=9483027331b3b78d2e993fcc69b7f7afbbd2e0eb	MacDisplayKit: exp805: drop hevc keyframe duration hint
806	104.17	discard	MacDisplayKit=de4462ad5b098a394974a18c017cf962dc6e6e9f	MacDisplayKit: exp806: align hevc expected cadence to 225hz
807	104.38	discard	MacDisplayKit=81703d63f0d5de77c253addebcb03553b6cfaaa4	MacDisplayKit: exp807: default hevc hdr profile hint
808	104.17	discard	MacDisplayKit=5b5a96b3799e0eee60ea691456193c868b7218b1	MacDisplayKit: exp808: default hevc hdr reference count
809	104.17	discard	MacDisplayKit=ca0d33e4ebb918e117251d52d6f17dcee585cc73	MacDisplayKit: exp809: default hevc hdr progressive hint
810	104.17	discard	MacDisplayKit=180ece8c2810952bfae16b67c9d8f91e65382457	MacDisplayKit: exp810: default hevc hdr speed bias
811	104.38	discard	MacDisplayKit=b785eaeb1019f1eb3cebcf8ed1462c726612a20c	MacDisplayKit: exp811: default hevc hdr power hint
812	104.38	discard	MacDisplayKit=51fe04ea66b5c7d9b1a868059431f41d2303836b	MacDisplayKit: exp812: raise hevc realtime ceiling to 240hz
813	104.17	discard	MacDisplayKit=e371b4177b70456b28c77322fae8556ecbc8204d	MacDisplayKit: exp813: disable hevc startup lookahead
814	104.38	discard	MacDisplayKit=94d7843d18729dfed05dbda789444a49da2f34a5	MacDisplayKit: exp814: hint hevc source frame count
815	102.08	discard	MacDisplayKit=ce3b6171ccb4035f295c3a625d98917662bc47bb	MacDisplayKit: exp815: default hevc data rate limits
816	104.17	discard	MacDisplayKit=a7cb6e1892c9e8a7553c7d60b3a0700cf8a5670c	MacDisplayKit: exp816: default hevc vbv initial delay
817	104.38	discard	MacDisplayKit=4256cc54b745e28b237b9f10115d2b6e41afb7ad	MacDisplayKit: exp817: default hevc expected duration
818	104.17	discard	MacDisplayKit=6a3752ede235ec2abc86f8a0e7fd87e852e4e6a7	MacDisplayKit: exp818: default hevc realtime hint
819	104.17	discard	MacDisplayKit=0818cea65d5d51db5f3ae5de1fae05fa6d8d3ba6	MacDisplayKit: exp819: default hevc open gop hint
820	104.17	discard	MacDisplayKit=52d70cfc93e86a588aea930a4adce3d1742d554d	MacDisplayKit: exp820: default hevc frame reordering hint
821	104.38	discard	MacDisplayKit=d2a2b9008bbfeefe8d9d6f48e40d0cd5a9574f56	MacDisplayKit: exp821: default hevc temporal compression hint
822	87.71	discard	MacDisplayKit=9b4b00329a407b78be6861dfc49b59af190c95ee	MacDisplayKit: exp822: cap skylight replay to one per fresh frame
823	102.69	discard	MacDisplayKit=40aabdb2238f2e04cf004e8a140b288339007f96	MacDisplayKit: exp823: inline skylight delivery queue handoff
824	104.38	discard	MacDisplayKit=30e18fdd4d935d2915c0ee556af5493069eeb69f	MacDisplayKit: exp824: default hevc keyframe count hint
825	104.17	discard	MacDisplayKit=c5c41754704da5ea07c956a51fe937674b5fb752	MacDisplayKit: exp825: release direct source after success accounting
826	104.17	discard	MacDisplayKit=098ce5fcc67150a9d738bc6450f3e0261fba1179	MacDisplayKit: exp826: hint hevc source frame count at 240hz
827	104.17	discard	MacDisplayKit=e81eb830b60155792c01435f6e2b0e396c963928	MacDisplayKit: exp827: align hevc keyframe count to 240hz
828	104.38	discard	MacDisplayKit=8c8ebbd1f1af6e83937a2b5829341ec665a47af9	MacDisplayKit: exp828: default hevc output bit depth hint
829	104.38	discard	MacDisplayKit=9608ff0daedfb835054c3ec2da0ea1bd8a7ec8d3	MacDisplayKit: exp829: default hevc expected frame-rate hint
830	104.17	discard	MacDisplayKit=193377fe894d1ce0f494e112897001b3de5d90ae	MacDisplayKit: exp830: align direct hevc pts with source display time
831	104.17	discard	MacDisplayKit=93e919816a076829d7e5beb6729ed3f6d0d285be	MacDisplayKit: exp831: widen hevc hdr burst rate limits
832	104.38	discard	Lumen=5aa1773470777c6ab3a0391a1b92f9f31df762c7,MacDisplayKit=85b31020db66898b2598c8fa6bde569e3ae9068c	Lumen: exp832: forward hevc recovery replay tags | MacDisplayKit: exp832: tag hevc recovery replays
833	104.38	discard	Lumen=6cae27c61776288a4cbbd6de2918c21d29582999,MacDisplayKit=19a649a9ffc3edf370f948bf0c93356fcce09160	Lumen: exp833: forward recovery replay identity | MacDisplayKit: exp833: preserve recovery replay source identity
834		discard	Lumen=9e58df9a59a44730901e1349f9e6969bd5c09164,MacDisplayKit=dad0f1f5befdda682b21355cf90744d97eee211d	reverted out-of-scope change in Lumen: src/video.cpp
835	104.38	discard	MacDisplayKit=c8e8354c2fa4d69b2a7625a781b585d8c0f0a924	MacDisplayKit: exp835: keep hevc recovery display time
836	104.17	discard	MacDisplayKit=7ef1153d6af7025f52bd5e8662339abefe276054	MacDisplayKit: exp836: keep hevc recovery sequence
837	104.38	discard	MacDisplayKit=44cd7cadef4d294c965cf572c5571ba288f81b3a	MacDisplayKit: exp837: preserve hevc recovery identity
838	104.38	discard	MacDisplayKit=dc318209ad38462c5473156acf82d8f560a0f2d3	MacDisplayKit: exp838: widen hevc callback pending budget
839	101.67	discard	Lumen=a091d6d21b445260ec71ab7ddf9362834d0b5791	Lumen: exp839: lift overlay hevc auto queue to q2
840	104.38	discard	MacDisplayKit=558638bc7c2b55478a6ab2898df6a79914e4b905	MacDisplayKit: exp840: trim q1 hevc callback slack
841	104.38	discard	MacDisplayKit=4463cacb5fd5fb018cbbc9027cb8e96f2bd1557d	MacDisplayKit: exp841: keep 240 ceiling with softer hevc cadence
842	104.17	discard	MacDisplayKit=82482932682da0696ed00c93343c0f36bbbfb9c0	MacDisplayKit: exp842: default hevc vbv initial delay at 225hz
843	104.17	discard	MacDisplayKit=a1a7242d5f9d7d434fb36c0875adcacad4f7794d	MacDisplayKit: exp843: keep pq hevc vbv buffer at 225hz
844	104.17	discard	MacDisplayKit=183e161c037b19f54d80017ad3fec82102c18fde	MacDisplayKit: exp844: pair pq hevc vbv buffer with default delay
845	104.17	discard	Lumen=1a4fc54b8c01ff5d32e5f33e346c9cf99f49cc2a	Lumen: exp845: use full-range yuv for overlay hevc
846	104.38	discard	MacDisplayKit=7208387275ae275874db1deb09894b757156722a	MacDisplayKit: exp846: align hevc keyframe count to 225hz
847	104.17	discard	MacDisplayKit=f5080c762d29686cd9aa80541e99f8650d2cbe63	MacDisplayKit: exp847: allow one hevc pending frame before replay suppression
848	104.17	discard	MacDisplayKit=d9c42924bc4cdf780ab3add99b68e52c1444f81b	MacDisplayKit: exp848: narrow hdr hevc callback pending budget
849	104.17	discard	MacDisplayKit=b75aa9c9e6bde543f9468eb7cd3d73f86031af9b	MacDisplayKit: exp849: raise hevc expected cadence above the 225hz ceiling
850	104.17	discard	MacDisplayKit=ae6eb8c78a5fb4f40285a0870353bbb31e018b8c	MacDisplayKit: exp850: drop metal-compatible input attrs on the hevc keep path
851	104.17	discard	Lumen=c000d91688b05964399b8cc5dddef3f6939ca540	Lumen: exp851: keep auto encoder input on partial hdr hevc
852	70.79	discard	Lumen=8cc1bb040e2cd58526959e6f4c8c72f97c172cea	Lumen: exp852: collapse hevc partial-hdr ingress to one frame
853	104.17	discard	MacDisplayKit=30073f675446176bca881eebcf2cb66c92abbd4e	MacDisplayKit: exp853: relax iosurface attr requirements on the hevc keep path
854	104.17	discard	MacDisplayKit=f27b6ef2381ce4f454761284142953bdb87fae24	MacDisplayKit: exp854: minimize hevc direct wrapper attrs on the keep path
855	104.38	discard	MacDisplayKit=5f83dddb773a1e02f831bf2bafbbccb5c7c630b7	MacDisplayKit: exp855: drop hevc direct wrapper attrs on the keep path
856	103.96	discard	Lumen=2176b6ec2e167a5d22e4837950f0a777e3980598,MacDisplayKit=b7cb27aba81eab2334649d3f2a380792454ea7e6	Lumen: exp856: preserve hevc partial hdr x422 input path | MacDisplayKit: exp856: preserve hevc partial hdr x422 input path
857	25.0	discard	MacDisplayKit=491e53c03bea28990aacc3552c9418f94bace648	MacDisplayKit: exp857: zero hevc suggested lookahead at 120hz
858	104.38	discard	MacDisplayKit=6fa99490cc3ecc3ac577408f400d04c48b4ba77e	MacDisplayKit: exp858: prefer 120hz q3 hevc source bootstrap
859	104.17	discard	MacDisplayKit=17189ea927e2941d9c935ed245f8cc7967f7d467	MacDisplayKit: exp859: prefer exact-120 hevc source bootstrap
860	104.17	discard	MacDisplayKit=cdf76f04c15e9ac227e966ce290b8b79ee1e03e1	MacDisplayKit: exp860: benchmark hevc high-refresh source bootstrap
861	104.17	discard	MacDisplayKit=fadcb01944166b47380c0feda8451cd2b8214fc5	MacDisplayKit: exp861: use encoder attrs for direct wrappers
862	104.38	discard	MacDisplayKit=1cec2622977280bac37a97f9a7e5f408b6c7d690	MacDisplayKit: exp862: gate direct wrapper attrs on shared pool
863	104.17	discard	MacDisplayKit=dd120726d972640889e54caaa9ac183abfabde68	MacDisplayKit: exp863: widen prores pending slack to nine
864	90.89	discard	MacDisplayKit=20facf3e97000e808bc08670315b02dcfeef129c	MacDisplayKit: exp864: prefer direct hdr hevc iosurface capture
865	104.17	discard	MacDisplayKit=a9096e5013ec036055d02b7ca41f6efe79d76486	MacDisplayKit: exp865: use q1 hevc high-refresh bootstrap
866	104.38	discard	MacDisplayKit=7c7a80285b3a2ceabb00f93de85ac80ed7a43e1b	MacDisplayKit: exp866: widen hevc hdr staging slack to eight
867	104.17	discard	MacDisplayKit=79afd3cfef0de14414f6555210cd23c10537b949	MacDisplayKit: exp867: remove hevc high-refresh frame delay
868	104.17	discard	MacDisplayKit=5d27fa0284e4c86ce0341ccc35ced8e03bfde6c8	MacDisplayKit: exp868: disable automatic hdr metadata on hevc keep path
869	104.38	discard	MacDisplayKit=f20bdb5ed92d67496ae56ae29be5c3801794228b	MacDisplayKit: exp869: align hevc expected cadence to 225hz
870	104.38	discard	MacDisplayKit=586e7b4e215f443ccaa7b5dbff474980602bd34c	MacDisplayKit: exp870: skip skyLight dirty metadata on hot path
871	104.38	discard	MacDisplayKit=f29b3893b2d55eaeee2d5bd9c9041b67f1ff1b6d	MacDisplayKit: exp871: keep hevc expected cadence at 120hz
872	104.17	discard	MacDisplayKit=18587cbcbd8ce833d7f3cd412f99e7f9bfca5571	MacDisplayKit: exp872: keep hevc target cadence at 120 with 240 headroom
873	104.38	discard	MacDisplayKit=633f0b265783f42955bb1284f473bff521a1880b	MacDisplayKit: exp873: drop hevc reference buffers on keep path
874	104.38	discard	MacDisplayKit=2fc45e9d897d39150c142768530e487c677f0323	MacDisplayKit: exp874: decouple hevc expected duration from headroom
875	104.17	discard	MacDisplayKit=80d96cf39a431bd1e114f71e3dd716990dc462a0	MacDisplayKit: exp875: default hevc static hdr session metadata
876	104.17	discard	MacDisplayKit=18d0b6d943a25f9ca1c0a8a0eb485e5f62ba7701	MacDisplayKit: exp876: widen hevc hdr staging slack to six
877	104.38	discard	MacDisplayKit=0d220809b7e14cd830d67beb44fb2ce66eb87226	MacDisplayKit: exp877: widen hevc hdr staging slack to five
878	104.17	discard	MacDisplayKit=b42914b6b80abb7422a029b3fac099052fdacb38	MacDisplayKit: exp878: tighten hevc hdr staging slack to three
879	104.38	discard	MacDisplayKit=6ef472c8e3e9f0a313aecb25685454c6e1fe178f	MacDisplayKit: exp879: trim private hevc surface ring to seven
880	104.38	discard	MacDisplayKit=6bbd2570be2b8f5e6642a0d7ecf541b0b174847e	MacDisplayKit: exp880: free hevc pending slot before mailbox drain
881	104.38	discard	MacDisplayKit=33f243ef2417f55efdbf29b052750fc444ae48f5	MacDisplayKit: exp881: widen private hevc surface ring to nine
882	104.17	discard	MacDisplayKit=f41c4917bcc2e96b371e468fa6f22671d988deef	MacDisplayKit: exp882: widen private hevc surface ring to ten
883	104.38	discard	MacDisplayKit=f776be9743d9d5138259640231fbba83b004e62c	MacDisplayKit: exp883: cap private hevc pending budget at six
884	104.17	discard	MacDisplayKit=0304747a45b68d5aaba37bfd9c4d412bb5ffb179	MacDisplayKit: exp884: drop redundant vt frame copy
885	104.38	discard	MacDisplayKit=75db255dff930420d01bd4f02121572d9f5b7f56	MacDisplayKit: exp885: reopen hevc pending slot before mailbox drain
886	104.17	discard	MacDisplayKit=63d35a98de88f322ec46dde45a14fe5577a2ab1f	MacDisplayKit: exp886: remove dead vt pending-release plumbing
887	104.17	discard	MacDisplayKit=a0d008f1f49d60cff8a04b4a38e10069a2ae9404	MacDisplayKit: exp887: gate hdr augmentation to pq hevc
888	104.17	discard	MacDisplayKit=b2416d92e0965c2e43ff43c93b27c3c95358fd43	MacDisplayKit: exp888: remove dead vt submit queue barrier
889	104.38	discard	MacDisplayKit=b20031b4346ef3f7373c755c182b94a58d037c69	MacDisplayKit: exp889: cache vt session note flags
890	104.38	discard	MacDisplayKit=3bb89e5ea1038ec5813b41d43697a61023a14003	MacDisplayKit: exp890: apply hdr attachments when buffers materialize
891	104.17	discard	MacDisplayKit=2e410d6bab4103c9aadf038f0c7170f83ce23574	MacDisplayKit: exp891: cache encoded frame hdr diagnostics
892	104.17	discard	MacDisplayKit=709a101e8a46e8a163427e9448178336cd3739a1	MacDisplayKit: exp892: cache hevc hdr augmented format descriptions
893	104.38	discard	MacDisplayKit=4dfbd48234b5569c505cdfc6986c4aca98f25862	MacDisplayKit: exp893: fast-path encoded hdr signaling
894	104.17	discard	MacDisplayKit=a2ccb5fa34c3c8dcd7fbafe44a354bc7789d9ba8	MacDisplayKit: exp894: lock vt processing counters off output queue
895	104.17	discard	MacDisplayKit=6e68060962bfcc1f5421462a6d7c378cacc528c4	MacDisplayKit: exp895: shift vt output augmentation onto output queue
896	88.71	discard	MacDisplayKit=aa3ed6fe88203680d3f7badf1108091d0dfaa453	MacDisplayKit: exp896: queue vt frame processing asynchronously
897	104.17	discard	MacDisplayKit=1276f7f9b4430519bf106ba4d273759fda2497fb	MacDisplayKit: exp897: avoid vt frame rewrap before encode
898	104.17	discard	MacDisplayKit=a04fd7d667bdce8683068695238e33a09cb6d94f	MacDisplayKit: exp898: preserve fresh mailbox frames under saturation
899	104.38	discard	MacDisplayKit=ac8d9abc8411fb3a4207f3f6ecab38d62f98735a	MacDisplayKit: exp899: bypass replay frames in the saturated mailbox
900	104.38	discard	MacDisplayKit=4b3ede4ce3bee0cbd1154912e70f5442a602ebbd	MacDisplayKit: exp900: oversample hevc replay scheduling at 240hz
901		discard	Lumen=fe96b09cd51d15f9e073403c4ce58d53a73eb3f2	reverted out-of-scope change in Lumen: src/video.cpp
902	104.17	discard	MacDisplayKit=8d89e1f60e9ccaf2e9c10e5cb0661615466e790c	MacDisplayKit: exp902: reuse skylight fresh surface wrappers
903	104.17	discard	MacDisplayKit=3a01f43f9186d47f1a87ef295216200cba4e3dcf	MacDisplayKit: exp903: release staged hevc source frames before vt submit
904	104.17	discard	MacDisplayKit=b851bd3426ff5e2dd951997dfebfd33706906d1d	MacDisplayKit: exp904: prewarm larger hevc hdr staging pools
905	104.17	discard	MacDisplayKit=6f07cbfdef4f9084f08667dd802b2194e498b7bc	MacDisplayKit: exp905: evict one source texture cache entry at a time
906	104.17	discard	MacDisplayKit=64066d6460d8783c31a60e97f3de2dcd810d6e2c	MacDisplayKit: exp906: use cheap signatures for source texture cache hits
907	104.38	discard	MacDisplayKit=f7b23fb89200994fd1de9594be0bff983206f56f	MacDisplayKit: exp907: evict one pixel-buffer wrapper at a time
908	104.38	discard	MacDisplayKit=f99248d4ed354bc67db2990dd5890cf8795e34fd	MacDisplayKit: exp908: reuse hevc force-keyframe frame properties
909	104.38	discard	MacDisplayKit=71d6fcc29b5d6a7ce172db2c4c9f00be0ee771ae	MacDisplayKit: exp909: preapply hdr attachments on reused buffers
910	104.38	discard	MacDisplayKit=4cd9a64fb6dd9d24f660495f4753a0fb7d8e6d5c	MacDisplayKit: exp910: stop blocking hevc submissions on stats updates
911	104.17	discard	MacDisplayKit=f7fedee14f9fada02b30825a198b5073fb036363	MacDisplayKit: exp911: stop scanning staged slot free lists
912	104.17	discard	MacDisplayKit=2f0c60d45538ec39be9d1bf2b63ec9d45d855562	MacDisplayKit: exp912: gate hevc hdr callback augmentation
913	104.38	discard	MacDisplayKit=afa1261c7973fd4470948f719e4b2fadf9dd27c2	MacDisplayKit: exp913: stop rescanning session note prefixes
914	104.17	discard	MacDisplayKit=2b9cd13eb1afdc067ed15f1dd107f37c5494f540	MacDisplayKit: exp914: reuse staged output dimensions decisions
915	104.17	discard	MacDisplayKit=f357d3166699d7eccdcfe21a7e73873b740a3171	MacDisplayKit: exp915: cache source cadence tick conversion
916	104.38	discard	MacDisplayKit=fccc65638e1526b6fac5c8e7d8c62cad8ddb05e1	MacDisplayKit: exp916: reuse private direct surface wrappers
917	104.17	discard	MacDisplayKit=67a2898a58db75eaa982d1c61fa91be7132e6b9f	MacDisplayKit: exp917: disable hevc callback source diagnostics
918	104.17	discard	MacDisplayKit=bd7f96e9df3cea9b24116a81b3b404a8e739672e	MacDisplayKit: exp918: inline latest-frame mailbox hops
919	104.17	discard	MacDisplayKit=e69d97cc1f7931aa888dc5ad5ae084744a52c336	MacDisplayKit: exp919: remove actor hops from frame overflow mailbox
920	104.17	discard	MacDisplayKit=280019eb87ccaed4fc91df4f66ebb25b0ce5421d	MacDisplayKit: exp920: defer source timing diagnostics until processing
921	104.17	discard	MacDisplayKit=10f02c29bd6aadd97f17c52c77776630cccdf877	MacDisplayKit: exp921: avoid source drop event hops without observers
922	104.17	discard	MacDisplayKit=ebfbfed99475d5bf74e58327182b169732fc36bd	MacDisplayKit: exp922: trim hevc callback output diagnostics
923	104.38	discard	MacDisplayKit=d2f73e9e9d7f7e05e0016dd0eec751e564f31b40	MacDisplayKit: exp923: skip hevc callback latency accounting
924	25.0	discard	MacDisplayKit=3dc21ca4774fc6951fa1b4e597a5460ffa078498	MacDisplayKit: exp924: decouple vt success counts from output queue
925	104.38	discard	MacDisplayKit=b25a8c023ca9fa2b4ca6428a82135203e85fb66d	MacDisplayKit: exp925: remove submit-time output queue hop
926	104.17	discard	MacDisplayKit=07d37f684ebf4af777189895b6a12b687c1075af	MacDisplayKit: exp926: skip hevc callback submit timestamps
927	104.38	discard	MacDisplayKit=b517f69d9f971bc7a54f4566ec45bd31d5d55481	MacDisplayKit: exp927: skip hevc callback receipt timestamps
928	104.17	discard	MacDisplayKit=c3dc12f4007b126402e168d4ae1e1603233e82dc	MacDisplayKit: exp928: stop rebuilding capture frames before encode
929	104.17	discard	MacDisplayKit=b489e17b06c5b25c859bc4ae39cff143b25a382f	MacDisplayKit: exp929: use unfair lock for keyframe requests
930	104.17	discard	MacDisplayKit=11640c2c92ddf203023ed9a14775be4c18a0c8f8	MacDisplayKit: exp930: shrink vt submission tokens
931	104.17	discard	MacDisplayKit=f805a56274676adb7ec1466ce03c643d806ba117	MacDisplayKit: exp931: flatten vt callback success path
932	104.38	discard	MacDisplayKit=934aa1ed1e5899afe9ce57a774ed3539aff4bd55	MacDisplayKit: exp932: cache color conversion note emission
933	104.17	discard	MacDisplayKit=dd0658cc50814475a6bbaa9d739d4e44676ca178	MacDisplayKit: exp933: cache source note emission
934	104.38	discard	MacDisplayKit=07c48339bee0649e009719fbe1fd95b8a7eda103	MacDisplayKit: exp934: lazily prepare cursor textures
935	104.17	discard	MacDisplayKit=9434718281694780b684a20a9a4387c57f8882ae	MacDisplayKit: exp934: reuse staged scaling decision
936	104.17	discard	MacDisplayKit=d70fab56aa4c7eb94b6f011edb0e1a54ea19830d	MacDisplayKit: exp936: stop flushing source texture cache
937	104.17	discard	MacDisplayKit=594bd0dbcadc635bc2a8f69d7697a193a73bdbb7	MacDisplayKit: exp937: cache color conversion target description
938	104.38	discard	MacDisplayKit=ebf2a9682fa9940fbdd3af259a2730e05b6bdcb4	MacDisplayKit: exp938: avoid duplicate hdr payload scans
939	104.17	discard	MacDisplayKit=1e1bd2e61ea4b275d19e7d797c9c73cd5b1fefbc	MacDisplayKit: exp939: skip hevc hdr scans on non-keyframes
940	104.38	discard	MacDisplayKit=2c13fd2a3798c518a725ea599e3c92f057798b99	MacDisplayKit: exp940: reuse callback keyframe classification
941	104.38	discard	MacDisplayKit=8c789f8b51e406956d500787647d6076bcfc8c1c	MacDisplayKit: exp941: read hdr extensions without remapping
942	104.17	discard	MacDisplayKit=8f8634f2046822fa847f76a1ce371dc810e67722	MacDisplayKit: exp942: defer hdr payload copy until needed
943	104.17	discard	MacDisplayKit=0555af6fd2d9aaabb6f43f633f668f526d5faa00	MacDisplayKit: exp943: cache encoded hdr validation report
944	104.38	discard	MacDisplayKit=a7c022e8144c388fbba129ae2238f34811dbaa47	MacDisplayKit: exp944: cache encoded frame extensions
945	104.38	discard	MacDisplayKit=4a30a84bade287ae93949f100d5111bce377c5d1	MacDisplayKit: exp945: skip source diagnostics payload decode
946	104.17	discard	MacDisplayKit=b1a282f65c7c6b450c4adc6d12abdba877f0e6b1	MacDisplayKit: exp946: defer output frame wrapping off callback
947	104.17	discard	MacDisplayKit=38e22c8ee973f7497be6da50e67320d1eaea3e97	MacDisplayKit: exp947: skip unobserved dropped-frame events
