experiment	commit	metric	status	description
467	101.67	discard	MacDisplayKit=0af97be343e9e9fbdc30d13f7c195eb21ca28476	MacDisplayKit: exp467: suppress hevc source saturation events
468	101.25	discard	MacDisplayKit=17b06692310026bde232ed496196681b7538172c	MacDisplayKit: exp468: disable hevc end reserve hint
469	101.67	discard	MacDisplayKit=fd84aace1eb66ceac7a21f99b4e0c2261188cbdc	MacDisplayKit: exp469: release staged vt slots without queue hop
470	102.08	discard	MacDisplayKit=28e9b8cb978bc8674bd6c00b7aa6010b57ef4fe3	MacDisplayKit: exp470: use unfair lock for pending tracker
471	101.67	discard	MacDisplayKit=320316531ba4a9b0d1e9d9d7d8430924a4153d56	MacDisplayKit: exp471: make vt submitted-frame accounting async
472	101.25	discard	MacDisplayKit=b9ff8d5538dcb7c088dfcb602b916e4800693034	MacDisplayKit: exp472: raise mailbox continuation task priority
473	101.67	discard	MacDisplayKit=9198763eb8d7253237df6a8046d79277ad19c404	MacDisplayKit: exp473: default hevc frame-delay hint
474	102.29	discard	MacDisplayKit=468ab99f63a9306e78002b5bcd80d507aaf35f9b	MacDisplayKit: exp474: collapse vt bookkeeping queue hops
475	102.29	discard	MacDisplayKit=0c1a1cbe708da5b67ae02c324382ea7a2b86e900	MacDisplayKit: exp475: use work-item autorelease on vt encode queue
476	102.5	discard	MacDisplayKit=d130a0d1707b168190ca4da9668f38205304b9cc	MacDisplayKit: exp476: skip hevc source drop metadata
477	102.08	discard	MacDisplayKit=07f618919f975841419af6aafe25bf383ffc7fda	MacDisplayKit: exp477: relax vt startup replay warmup
478	102.29	discard	MacDisplayKit=cf86d7d7b576f1906f5e893a99d2faf4a634b7c1	MacDisplayKit: exp478: time the hevc proxy prime for 120hz
479	101.67	discard	MacDisplayKit=39f7eb76a57897566c76cb2707802f220052b06f	MacDisplayKit: exp479: defer hevc proxy prime past startup
480	102.29	discard	MacDisplayKit=2a11f4a8003ab5157125d7dfc89cf0c464838dff	MacDisplayKit: exp480: gate hevc startup replay on vt parallelism
481	101.88	discard	MacDisplayKit=387586554051e3dc65b72aabc447bba18ee0a516	MacDisplayKit: exp481: relax hevc replay minimum delta to eleven sixteenths
482	101.67	discard	MacDisplayKit=6deae0565acba5dff7af41e4fffdc50278f93954	MacDisplayKit: exp482: relax hevc replay minimum delta to twenty three thirty seconds
483	101.67	discard	MacDisplayKit=23e68d3af54be1971e5746a6aeb034f535ddc230	MacDisplayKit: exp483: submit original capture frame to encode queue
484	102.5	discard	MacDisplayKit=c5458ae1282d6a2e067984bb3b838e5a32e238b2	MacDisplayKit: exp484: cap hevc maximum realtime frame rate at 144hz
485	102.5	discard	MacDisplayKit=b9d19aaac05c27d8f3291506b80e36129e0b0427	MacDisplayKit: exp485: lower hevc realtime ceiling to 180hz
486	101.88	discard	MacDisplayKit=17faf07dc383b741c86a8a4da36de3dcf6b586da	MacDisplayKit: exp486: pair hevc replay gate with source trim
487	101.88	discard	MacDisplayKit=ec8a700d7a92d94e66d2235cfa44c091bf56b64b	MacDisplayKit: exp487: disable hot-path source diagnostics for prores
488	101.46	discard	MacDisplayKit=ea2374ef5bac8491d1d69d6bdba4166ff10f3f69	MacDisplayKit: exp488: make vt submitted-frame accounting async
489	102.5	discard	MacDisplayKit=271d3bedc131f5198186e363fecc44c680ae41d3	MacDisplayKit: exp489: raise mailbox continuation task priority
490	102.08	discard	MacDisplayKit=7aeaf43e534c1261391531b7211225c660ebe5fc	MacDisplayKit: exp490: use unfair lock for pending tracker
491	102.71	discard	MacDisplayKit=952ce15941c337c7b1b8fea2b44b06cfb53dbe90	MacDisplayKit: exp491: submit original capture frame to encode queue
492	102.08	discard	MacDisplayKit=1ea8061c743e82db38f4f01d43919fddc364b760	MacDisplayKit: exp492: suppress hevc source saturation events
493	102.29	discard	MacDisplayKit=0aee4ad3d8022bb6e422672e3f1a7e9c236748f7	MacDisplayKit: exp493: pair hevc realtime ceiling with target duration
494	101.46	discard	MacDisplayKit=26c50ec4c0cca8f8bfaaadef77ea1d06ac6938b2	MacDisplayKit: exp494: use default hevc power-efficiency hint
495	102.08	discard	MacDisplayKit=f81231df09c4fde04bb66855c4e89fcc9dad530e	MacDisplayKit: exp495: default hevc frame-delay hint
496	102.08	discard	MacDisplayKit=c5a1cba9b5ff2a3156ba1480d1a20009ab9b0f51	MacDisplayKit: exp496: enable hevc vbv buffer on 240hz path
497	101.88	discard	MacDisplayKit=b48fd100388979d60d843c14456cb0766e40caa6	MacDisplayKit: exp497: restore default hevc vbv initial delay
498	101.67	discard	MacDisplayKit=250febddaa45eabc998c5be801374321a07d2b51	MacDisplayKit: exp498: set hevc expected-rate to target
499	101.88	discard	MacDisplayKit=166f45347a580a3ae1fed9d2a2cd0218c4bc63db	MacDisplayKit: exp499: use work-item autorelease on vt encode queue
500	101.88	discard	MacDisplayKit=a9adefaf2fb8e2acc86101ca3e55e1b047feb0e9	MacDisplayKit: exp500: release staged vt slots without queue hop
501	101.88	discard	MacDisplayKit=9a1985fdcb19efdb7168d96c24652ce5612f169c	MacDisplayKit: exp501: time the hevc proxy prime for 120hz
502	101.46	discard	MacDisplayKit=ec7fd91798a0874595449c67c82c374786e6cc02	MacDisplayKit: exp502: skip hevc data-rate limits on pq path
503	101.67	discard	MacDisplayKit=a4072624956691812fea97359ac47526e3d495bc	MacDisplayKit: exp503: gate hevc idle replays
504	102.08	discard	MacDisplayKit=e4fa9e6ba772034101373dca5710e8b93487697f	MacDisplayKit: exp504: tighten skylight hevc pending slack
505	101.88	discard	MacDisplayKit=44a7a8492c8b5ef77951030514eba78b21d0179e	MacDisplayKit: exp505: nudge hevc realtime ceiling above 240hz
506	102.71	discard	MacDisplayKit=2d38580796cf1829de4a6ed93577fab9f3de88d1	MacDisplayKit: exp506: nudge hevc expected duration above 240hz
507	102.71	discard	MacDisplayKit=ce2eebe90ae5e98c34c935ac65ab09ccb0b16431	MacDisplayKit: exp507: default hevc profile level on hdr120 path
508	102.08	discard	MacDisplayKit=1770daabbbe5477f9f26fc71cc83e703b674d752	MacDisplayKit: exp508: default hevc output bit depth on hdr120 path
509	102.08	discard	MacDisplayKit=3ddbd0524c5f9e4c7912b8c422b62671986bddf3	MacDisplayKit: exp509: default hevc speed-priority hint on hdr120 path
510	102.71	discard	MacDisplayKit=a52b67e017e7093b5907b60ef25139ba3d5157ac	MacDisplayKit: exp510: default hevc open-gop hint on hdr120 path
511	101.25	discard	MacDisplayKit=b17216b82917daf63ab59f4a75cab9f600d95b58	MacDisplayKit: exp511: default hevc frame-reordering hint on hdr120 path
512	101.88	discard	MacDisplayKit=7aabe998db242ce6a4eb46e54abaeafbacc8eb35	MacDisplayKit: exp512: default hevc temporal-compression hint on hdr120 path
513	102.29	discard	MacDisplayKit=61b11ea328a502f7cf2ef5bf9fe94e0d2d1143a6	MacDisplayKit: exp513: default hevc progressive-scan hint on hdr120 path
514	102.29	discard	MacDisplayKit=c3e4adf6cca9e9bb7e2e4361894590a4bd76164f	MacDisplayKit: exp514: default hevc realtime hint on hdr120 path
515	101.88	discard	MacDisplayKit=9f4b113053150bf6f41831938aa4739d63d87cc1	MacDisplayKit: exp515: default hevc average bitrate on hdr120 path
516	102.08	discard	MacDisplayKit=556fa9ae0b88dc967139ffce273f0a8ca8be1f2f	MacDisplayKit: exp516: default hevc keyframe hints on hdr120 path
517	101.88	discard	MacDisplayKit=381182b805c39c3b97ba51bde7baf2af61a61509	MacDisplayKit: exp517: default hevc maximum realtime frame rate on hdr120 path
518	101.67	discard	MacDisplayKit=1566b1ddec1e42deecba1e0203180580fa006ab7	MacDisplayKit: exp518: default hevc hardware-encoder request on hdr120 path
519	102.5	discard	MacDisplayKit=4f5d17080cf0ffb83c4d374758775a0b63185b51	MacDisplayKit: exp519: skip hevc source-drop bookkeeping on hdr120 hot path
520	101.88	discard	MacDisplayKit=f67beff9091f2b6e60f289f4168f9aff8f026c75	MacDisplayKit: exp520: skip hevc reduced-dirty rect decode on hdr120 hot path
521	101.88	discard	MacDisplayKit=d023ce3cab649e4c55d5ee9e021499c00992eda4	MacDisplayKit: exp521: split hevc startup pacing hints
522	101.88	discard	Lumen=4720f42caea8af6b1d04d8a45ab42d2596bbcc76	Lumen: exp522: widen overlay ingress capacity at 120hz
523	101.88	discard	Lumen=421b01b52034e7a7f449ae8936de8ec2331e0a4f	Lumen: exp523: soften tiny ingress overflow collapse
524	103.12	discard	MacDisplayKit=38006eb5c3cabbd00e72c69db826ee90d4e8bb6c	MacDisplayKit: exp524: split skylight source state from delivery
525	103.54	discard	MacDisplayKit=c97c8e2a3644c497888dc285b978acf262534822	MacDisplayKit: exp525: prioritize split skylight source queues
526	102.08	discard	MacDisplayKit=40a72dd63ba5cb0ee83b52b74e2986139a7bdfda	MacDisplayKit: exp567: tighten skylight replay leeway
527	102.08	discard	MacDisplayKit=992b034c7b88b813e191415564e52c25ea7e47a2	MacDisplayKit: exp568: split hevc expected and realtime rate hints
528	102.08	discard	MacDisplayKit=168f39e380d97e1f70ef8948c32037ecf043379a	MacDisplayKit: exp569: split hevc expected duration hint
529	96.25	discard	MacDisplayKit=be05b6221abb06a7752b7dc13f162e867c699167	MacDisplayKit: exp570: relax hevc speed-priority hint
530	101.67	discard	MacDisplayKit=a9b166fdfec2ad7eaf35b778b7bf01050b23c3f9	MacDisplayKit: exp571: enable hevc power-efficiency hint
531	102.08	discard	MacDisplayKit=4271032d65a384ec6d4f8909b80835b71abbc366	MacDisplayKit: exp572: drop hevc reference buffers on keep path
532	103.12	discard	MacDisplayKit=d9c516d3353e0f135721e5cf1379d5fc9aafe59d	MacDisplayKit: exp573: split skylight processing queue on keep path
533	103.54	discard	MacDisplayKit=d56e8a940e609a1a971639b9a9f85e04bfbace32	MacDisplayKit: exp574: split skylight replay and processing queues
534	102.96	discard	MacDisplayKit=18819308bfc1745bebde98957b47f325e891760f	MacDisplayKit: exp575: prioritize split skylight queues
535	103.96	discard	MacDisplayKit=b2b7b39ab3207fc1750d99aa6f4b3bb2c209ccfc	MacDisplayKit: exp576: prioritize split skylight replay lane
536	102.97	discard	MacDisplayKit=48d93ac522636be4d851ee59472622c2c90ec2c0	MacDisplayKit: exp577: prioritize replay lane and processing handoff
537	103.54	discard	MacDisplayKit=cc18197bd05617fa91b68084c9041ac3503f471c	MacDisplayKit: exp578: prioritize fresh and replay skylight lanes
538	102.92	discard	MacDisplayKit=2c716abeb9c951113f41ef7cc338be974d019147	MacDisplayKit: exp579: add autorelease to replay handoff split
539	103.54	discard	MacDisplayKit=af6ce5193f746fb49436995b50ac37d8ca42af24	MacDisplayKit: exp580: add autorelease to fresh delivery split
540	100.79	discard	MacDisplayKit=f58535f26898ae766ff0e7cb74875f2002662c9f	MacDisplayKit: exp581: split replay state from delivery handoff
541	103.33	discard	MacDisplayKit=2730bb5a8756489636947cf1e5cc92a3997e4fa5	MacDisplayKit: exp582: prioritize replay split handoff lane
542	103.33	discard	MacDisplayKit=656132f0d5fd6a91f578b9f3cde5bc66ca28ee56	MacDisplayKit: exp583: lower-priority replay split handoff
543	103.75	discard	MacDisplayKit=5c1219d3d89b94e9bd196ba9539ad4087a719dfb	MacDisplayKit: exp584: split skylight state and replay lanes
544	103.54	discard	MacDisplayKit=25f6310b6868b70df44a5fd92c862d620b5d3c54	MacDisplayKit: exp585: split state lane with replay keep
545	103.33	discard	MacDisplayKit=ab07e0b2698674b85ebe250f61529dcfa773a610	MacDisplayKit: exp586: prioritize state and replay split
546	103.75	discard	MacDisplayKit=5ef10a79be6d4aa95444fc5a24eaaa650d49c11d	MacDisplayKit: exp587: prioritize state and replay split keep
547	102.11	discard	MacDisplayKit=cd71e7a8404558ffd0e0821545f9f2f84fccfe79	MacDisplayKit: exp588: moderate-priority state split keep
548	103.54	discard	MacDisplayKit=02e605c7e55e0d8e6ae5de08fe35f78fd86e936e	MacDisplayKit: exp589: add autorelease to state replay split
549	103.96	discard	MacDisplayKit=b9fda46a2782dd13813434efb93f759aae678a54	MacDisplayKit: exp590: moderate state and handoff split
550	103.33	discard	MacDisplayKit=a4dfd63c90729b4e865ce498bc5c5ccd28b0318f	MacDisplayKit: exp591: reserialize split state and replay handoff
551	102.08	discard	Lumen=6f406b6f050ecff54aace929cf362bce98eaec1c	Lumen: exp551: gate tiny backlog collapse on callback latency
552	103.12	discard	MacDisplayKit=2dc8fa591147c2fa3ad8528912813661ac2e5314	MacDisplayKit: exp592: add autorelease to moderate handoff split
553	103.96	discard	MacDisplayKit=044917b6986457fbcf89b9b697314d131d13ccf0	MacDisplayKit: exp593: add autorelease to moderate state split
554	103.33	discard	MacDisplayKit=6d0c9c69eac85b7776f8e61df39cf5fbede16de4	MacDisplayKit: exp594: prioritize moderate handoff split
555	103.75	discard	MacDisplayKit=8f7230c824aabb616530d87cc1fd4081b9c96cf2	MacDisplayKit: exp555: add autorelease to moderate state handoff split
556	104.17	discard	MacDisplayKit=6d127dd69583a7f3d49f10c0c1f2ee0f42c19a13	MacDisplayKit: exp556: blend hevc replay cadence and startup phase
557	104.17	discard	MacDisplayKit=2ba63fb75a78d723a1c7271e9b87c248412c0573	MacDisplayKit: exp557: retune hevc replay cadence only
558	101.88	discard	MacDisplayKit=9670ccb69c99d8754c277d6a7e2841b98170031a	MacDisplayKit: exp558: advance hevc replay startup phase only
559	104.17	discard	MacDisplayKit=ccba03ed9b3a29185993b6eb0be31928124efb45	MacDisplayKit: exp559: blend hevc replay cadence with moderate handoff split
560	101.34	discard	MacDisplayKit=75394012b05fcf57781632be475200de392e9f26	MacDisplayKit: exp560: blend hevc replay cadence with autoreleased handoff split
561	104.17	discard	MacDisplayKit=51483b1a40b8745e545d09232af384b0d402de67	MacDisplayKit: exp561: retune hevc replay cadence to 146hz
562	104.17	discard	MacDisplayKit=6734cc4211084ba7ee1ad1a7161ad98731ea1845	MacDisplayKit: exp562: retune hevc replay cadence to 145hz
563	104.17	discard	MacDisplayKit=6920e6efe0ea1be49b317039fa7db57ea94dfd8b	MacDisplayKit: exp563: retune hevc replay cadence to 143hz
564	104.17	discard	MacDisplayKit=0689c2e35706601baa3f073c3d0f052277143374	MacDisplayKit: exp564: blend 146hz hevc replay cadence with startup phase
565	101.67	discard	MacDisplayKit=a753e078ddb3dab31b360fd7ad6b6be76e2008c3	MacDisplayKit: exp565: blend expected-duration default with lower realtime cap
566	103.33	discard	MacDisplayKit=1d1876568016f73f4b083272544f241013a7195e	MacDisplayKit: exp617: blend realtime hint with moderate source split
567	101.65	discard	MacDisplayKit=125e9b27352e6bf5247cdc30df9d99507540129d	MacDisplayKit: exp618: blend realtime hint with autoreleased state split
568	101.67	discard	MacDisplayKit=27628017310b389980902c62cb796133fd77d635	MacDisplayKit: exp619: blend realtime hint with delivery autorelease
569	101.67	discard	MacDisplayKit=76bf0b84e686e309ee9b3573dde19d277a7a4664	MacDisplayKit: exp620: blend realtime hint with encode autorelease
570	101.88	discard	MacDisplayKit=e67771935aed3d0bd57dd76fae5a95f6bb05ad71	MacDisplayKit: exp621: blend realtime hint with submit autorelease
571	102.29	discard	MacDisplayKit=9075abad9ddbb42b5434d7e864e49ad670ddc507	MacDisplayKit: exp622: blend realtime hint with output autorelease
572	104.17	discard	MacDisplayKit=c9d4ae2dede0c055f6b18388b2b3bcd04b631732	MacDisplayKit: exp623: blend realtime hint with 146hz replay cadence
573	101.25	discard	MacDisplayKit=a4195c054196844b7c84dcda6fa96310cb193e25	MacDisplayKit: exp624: blend realtime hint with default vbv delay
574	101.67	discard	MacDisplayKit=f7d7d62ef36cfb82b1863c6a1ef28d17ab347ac8	MacDisplayKit: exp625: blend realtime hint with source drop trim
575	102.08	discard	MacDisplayKit=80346a702191e060acb2f4877f6c62cb5ef0695d	MacDisplayKit: exp626: blend realtime hint with immediate slot release
576	101.46	discard	MacDisplayKit=f6d566634a5646423618943c6c6b5de8e0eb2db3	MacDisplayKit: exp627: blend realtime hint with default power hint
577	101.67	discard	MacDisplayKit=315c773712684ce86ba205b29b1e1182e8160d82	MacDisplayKit: exp628: blend realtime hint with source diagnostics drop
578	101.88	discard	MacDisplayKit=840b510b1819838da1539d3b91fa586b0c7989b9	MacDisplayKit: exp629: retune realtime ceiling to 192hz
579	101.46	discard	MacDisplayKit=b8e8946b7066b0d100f4e83deb788b87df94a330	MacDisplayKit: exp630: blend realtime hint with surface cache
580	101.46	discard	MacDisplayKit=4a77a9977c940c12f335916a7d44c58a022e75f2	MacDisplayKit: exp631: decouple hevc timing from realtime hint
581	101.88	discard	MacDisplayKit=93d226d0152b39da9155a4e4cf77286333c65109	MacDisplayKit: exp632: relax hevc replay pending suppression
582	101.88	discard	MacDisplayKit=4651efae8fed27859bafe4e6f0ad1c06d9c260ae	MacDisplayKit: exp633: reuse hevc frame values on submit
583	101.88	discard	MacDisplayKit=ed8fc897754e60189decbfb0ac14530a685c6930	MacDisplayKit: exp634: inline latest mailbox drain
584	101.88	discard	MacDisplayKit=65f7be96ad0b29e532b256c7b53dcd59f39516c4	MacDisplayKit: exp635: trim hevc submit-side diagnostics
585	101.46	discard	MacDisplayKit=c5c3a5240707b9c61b3e5a2a630ac572b741c06c	MacDisplayKit: exp636: trim hevc callback histograms
586	101.88	discard	MacDisplayKit=657be509887f77e4a18c82adc28286542759393e	MacDisplayKit: exp637: trim hevc runtime note bookkeeping
587	101.88	discard	MacDisplayKit=65f131a4b0be2ee5c489411ad1a2256c613be193	MacDisplayKit: exp638: reuse frame values on submit
588	101.67	discard	MacDisplayKit=cc4a50b0191de3482bf72af8f7796f9715f7d57f	MacDisplayKit: exp639: skip prores source diagnostics
589	102.08	discard	MacDisplayKit=3b8ec52dd625f1b05ad6e976fa5c997c194dabea	MacDisplayKit: exp640: widen prores callback pending slack
590	102.29	discard	MacDisplayKit=ebc24c71626c42e9f168cc08352b0a4762486e55	MacDisplayKit: exp641: deepen prores callback pending slack
591	102.29	discard	MacDisplayKit=58fc2e8b3fb0f3482199862611bca9c256f1f931	MacDisplayKit: exp642: widen prores callback pending slack again
592	102.71	discard	MacDisplayKit=3f57257c01cb53dc541222e1481d6c49597c3833	MacDisplayKit: exp643: trim prores callback histograms
593	101.88	discard	MacDisplayKit=a154bf18181dcfc284e19b73e642d38106568bf9	MacDisplayKit: exp644: trim prores frame bookkeeping
594	102.08	discard	MacDisplayKit=37bfc7c54027f6be12e07775c6d9018926c42b1d	MacDisplayKit: exp645: disable prores timer replay
595	101.46	discard	MacDisplayKit=8eef7b147a6da686c75954a29c53773ad6585a14	MacDisplayKit: exp646: relax prores replay cadence
596	102.08	discard	MacDisplayKit=4c48f40745a085f2ae200cc3351368220c452f48	MacDisplayKit: exp647: trim prores hot-path diagnostics
597	101.67	discard	MacDisplayKit=d39b6c56800944fc004e749a60d9015fe58d4a23	MacDisplayKit: exp648: blend prores slack with callback trim
598	101.67	discard	MacDisplayKit=d098bce6b48557b515bd6a7f7dc1433db4cda909	MacDisplayKit: exp649: favor fresh prores mailbox frames
599	104.38	discard	MacDisplayKit=cd571cad4a56c68b0c8f32dbf11d9db238f5e488	MacDisplayKit: exp650: raise hevc replay cadence slightly
600	104.17	discard	MacDisplayKit=dac5ed92b51930dd7f6c542339eef086ebeefaae	MacDisplayKit: exp651: advance hevc replay startup
601	104.17	discard	MacDisplayKit=73227cfea4275f32f6b98790463a03abb5f83cd2	MacDisplayKit: exp652: soften hevc replay startup advance
602	104.17	discard	MacDisplayKit=bde18759ba9ca4bd2d488d74fd35ec2e4eabc2e0	MacDisplayKit: exp602: tighten hevc replay leeway
603	104.17	discard	MacDisplayKit=4ddf238ddecae153678c10cf43edb1ff898b3014	MacDisplayKit: exp603: pair hevc startup with 144hz replay
604	104.17	discard	MacDisplayKit=a7b07bb7c6449d64798b2e9a056e4dd7c3fcfe69	MacDisplayKit: exp604: soften hevc startup at 145hz
605	101.25	discard	MacDisplayKit=81f3af113c5b1defc37a11fb495e87eb657af406	MacDisplayKit: exp605: split hevc expected frame rate hint
606	104.17	discard	MacDisplayKit=1acb99832c14f9c47abb0de3b7ea17385bd491b0	MacDisplayKit: exp606: lower hevc replay cadence slightly
607	103.96	discard	MacDisplayKit=0ed87b095915f38002bb808676faef207ed101d8	MacDisplayKit: exp607: raise hevc replay cadence slightly
608	102.08	discard	MacDisplayKit=69b3eb34b61821acb6b9fecec4242763d3db055c	MacDisplayKit: exp608: lengthen hevc keyframe interval hint
609	101.88	discard	MacDisplayKit=bcd3b40c5c48897c6cddad51b879ef2c103ca7ac	MacDisplayKit: exp609: widen hevc realtime frame rate hint
610	102.29	discard	MacDisplayKit=79c8e63bbbf8dab69a5a6605c9d0b8950c78640e	MacDisplayKit: exp610: soften hevc realtime frame rate headroom
611	102.29	discard	MacDisplayKit=2c0759b0e9ee75af2556641840244598b4c40f20	MacDisplayKit: exp611: add one hevc frame delay slot
612	101.88	discard	MacDisplayKit=b83462a36b62fff37b1f1a9942f9f7214107f0d3	MacDisplayKit: exp612: raise hevc reference buffer count
613	101.46	discard	MacDisplayKit=612dd6b42ed9233ffd65c8474cfcaab239627838	MacDisplayKit: exp613: drop hevc source frame diagnostics
614	102.08	discard	MacDisplayKit=c2f102f2ed12b963e428d0aef1fe6b1969fc45b7	MacDisplayKit: exp614: make vt submitted-frame accounting async
615	102.29	discard	MacDisplayKit=96d83dddfbd859dea1466d0abe6c5a9ac12cca07	MacDisplayKit: exp615: gate hevc startup replay on vt parallelism
616	101.67	discard	MacDisplayKit=a43369fe7f8458a587f56f9662a10a06c98b3c1b	MacDisplayKit: exp616: use work-item autorelease on vt encode queue
617	101.88	discard	MacDisplayKit=e6037981225e074d2c57862635ecb4f33849ed5c	MacDisplayKit: exp617: disable hevc end reserve hint
618	101.67	discard	MacDisplayKit=805fb30de0cb9182c76ea2ba7b137ca52bc17455	MacDisplayKit: exp618: cache skylight capture surfaces
619	102.71	discard	MacDisplayKit=9a9e54c4c903dfb5a13f1d262dee9ed6b62d4a45	MacDisplayKit: exp619: use default hevc power-efficiency hint
620	104.38	discard	MacDisplayKit=2de5d328301e9129962075bb9dffb04439177c57	MacDisplayKit: exp620: relax hevc replay minimum delta
621	104.17	discard	MacDisplayKit=4ba78c8faf93ace5eaba5751c759bb7dc1a041ac	MacDisplayKit: exp621: pair hevc replay cadence with relaxed delta
622	104.38	discard	MacDisplayKit=2eb7d061f2f463e39fb2a8d1868efdcfb6db98fc	MacDisplayKit: exp622: pair hevc replay gate with prores callback trim
623	104.17	discard	MacDisplayKit=fdbd28f981667f4693f376ad81c164b2c232d319	MacDisplayKit: exp623: pair hevc replay cadence with prores callback trim
624	102.08	discard	MacDisplayKit=8b7bf68862d9ad593c6bbed6add392143226fd32	MacDisplayKit: exp624: deepen prores slack with callback trim
625	104.17	discard	MacDisplayKit=42be9950137818d19a903d3a33da49d8e9f529b3	MacDisplayKit: exp625: pair hevc startup with replay gate
626	104.17	discard	MacDisplayKit=bdc34e1330bc848ccce6b8304a8b7678a905d333	MacDisplayKit: exp626: pair earlier startup with replay gate
627	104.17	discard	MacDisplayKit=ea5c05ae01c7e57fd680c1ac19276bf1f44fef3e	MacDisplayKit: exp627: pair late startup with milder gate
