experiment	commit	metric	status	description
495	29590e52+efb9276	discard	95.21	limiting the latest-wins VideoToolbox submit coordinator to only the first two HEVC HDR120 startup submissions still regressed HEVC to 49 frames and pushed startup to 381 ms, so startup submit coalescing itself violates the current HEVC recovery invariant even when steady-state immediately falls back to sync submit
496	29590e52+1b3640d	discard	95.21	requesting one extra startup recovery keyframe immediately after the first successful HEVC HDR120 output callback did not lift HEVC above 49 frames and also dragged ProRes Proxy down to 79 frames, so the remaining gap is not missing early recovery-point cadence but a deeper source-visible or pre-submit cost issue
2	95.62	discard	Lumen=160ddb80d28f0c98a70f15ea2bd85113ed22519d,MacDisplayKit=628c31a8f32aae4e54c84f2439e47e13cd50b411	Lumen: Revert "exp493: propagate coalesced capture events" | MacDisplayKit: Revert "exp496: request startup recovery keyframe"
497	29590e52+ba3bd92	discard	build-fail	adding a public CGDisplayStream source backend for encoded callback-only HEVC/ProRes sessions failed to build because the new runtime still used the obsoleted Swift drop-count API and referenced kCGErrorSuccess directly, so this backend-entry experiment needs a compile-clean retry before it can be measured
498	29590e52+bc9db81	discard	85.42	routing high-refresh callback-only HEVC and ProRes through a new public CGDisplayStream encoded source backend collapsed HEVC progression to 2 frames and dragged the total score to 85.42, so changing the source entry point away from raw SkyLight is not a viable backend-level escape hatch for the current dual-codec HDR120 path
3	95.42	discard	MacDisplayKit=df2a226e64b97d31050a5edc7c1ef065eadd2feb	MacDisplayKit: Revert "exp498: retry public cgdisplaystream encoded source"
499	29590e52+9153282	discard	95.83	replacing the source latest-frame mailbox actor with a lock-backed dispatch-queue drain matched the 95.83 best but left HEVC stuck at 52 frames while startup and callback latency worsened, so the actor or Task hop is not the remaining HEVC progression bottleneck
0	95.62	baseline	Lumen=29590e52d582b144864a2f4829eade9bbcbc85d2,MacDisplayKit=8cdf20f367b9fccca35b6230501a8339e99dde65	unmodified code
1	95.62	discard	MacDisplayKit=6999180bee9f2ea3bf8295a14af10830a441a2e3	MacDisplayKit: exp500: remove hevc high-refresh expected-duration hint
2	95.62	discard	MacDisplayKit=f826c807ee908820f300c77b5b28d732cb5feb80	MacDisplayKit: exp501: gate hevc source permit on vt backlog
3	95.42	discard	MacDisplayKit=9ab0cf1e09b6dd4b9753a6ab539055da186f157f	MacDisplayKit: exp502: trim hevc callback source slack
4	95.62	discard	MacDisplayKit=8f48ebe5aca7033e50d46c267bedfed0b09de6a9	MacDisplayKit: exp503: loosen direct hevc replay suppression
5	95.62	discard	MacDisplayKit=2600a01a77714dfffc0719cb2165d49ef8e7d527	MacDisplayKit: exp504: avoid capture frame reconstruction
6	95.62	discard	MacDisplayKit=3339e865f66c2a213402c3fe584d638cf18b7a7d	MacDisplayKit: exp505: inline latest mailbox drain
7	95.83	keep	MacDisplayKit=3611ee106d24aa3073b7626eabf113d6a8aa5d46	MacDisplayKit: exp506: skip hevc hot-path source diagnostics
8	95.42	discard	MacDisplayKit=8bb5e6c5fa606ba60e9afb77c84f2c1c51c46f4e	MacDisplayKit: exp507: extend hot-path diagnostic skip to prores
9	95.42	discard	MacDisplayKit=09d7fc6eb8a9a0ff9531f472d2040db0cde14995	MacDisplayKit: exp508: trim hevc submit-side diagnostics
10	95.62	discard	MacDisplayKit=131d18b7d4edce1be56ea992ff88fa534cff1478	MacDisplayKit: exp509: avoid hevc frame reconstruction
11	94.44	discard	MacDisplayKit=dd75b7515e8a5b784103580e4c992fb3c13ab1f5	MacDisplayKit: exp510: trim hevc callback histograms
12	93.28	discard	Lumen=2a81f8c6b1b02b33efb457427fa76dacd32e8b9b	Lumen: exp511: skip hevc bridge frame diagnostics
13	95.62	discard	MacDisplayKit=aef715f2dd0566c9cccd716b404f122944670a38	MacDisplayKit: exp512: cache last hevc wrapped pixel buffer
14	95.42	discard	MacDisplayKit=3782fd2afec8b486be625ce0d8e0e113c93dd2f0	MacDisplayKit: exp513: inline hevc direct submit bookkeeping
15	25.0	discard	MacDisplayKit=e4cb98b29f553e7e27e50bee04f99995fc2bf98d	MacDisplayKit: exp514: route hevc callback handoff onto encode queue
16	95.42	discard	MacDisplayKit=bfa68f7ab63f3c8c3985ebbbfcf8cbff2e4f63fa	MacDisplayKit: exp515: soften hevc pacing hint to 180hz
17	95.62	discard	MacDisplayKit=e058cfd50cb7426afacfc1e947b9f1e631107e6c	MacDisplayKit: exp516: restore hevc callback pending depth 2
18	95.42	discard	MacDisplayKit=ae6c7ffc8dd90bffe14f24ac4d0d7bf03ed72817	MacDisplayKit: exp517: cap hevc vbv peak bitrate
19	95.42	discard	MacDisplayKit=c61307b0ee8242319360e43004c93cecde739119	MacDisplayKit: exp518: add hevc base-layer frame fraction
20	95.42	discard	MacDisplayKit=023315d217a532b30f1867037e889a4f85b48f0e	MacDisplayKit: exp519: bias hevc base-layer bitrate
21	95.42	discard	MacDisplayKit=1dbabc44a8df7bce4283634052fb4ae83779d320	MacDisplayKit: exp520: bias hevc base-layer bitrate
22	95.42	discard	MacDisplayKit=c015ccf914d6485d4eb2445764ba2b7943f01491	MacDisplayKit: exp521: stamp hevc encode duration
23	95.42	discard	MacDisplayKit=05ae13ac2a20399d183e0b691e5ef05f414d3b77	MacDisplayKit: exp522: latch videotoolbox note probes
24	95.42	discard	MacDisplayKit=7d6fc360ce531fdb38237ebf2ccb5c90b58346fd	MacDisplayKit: exp523: loosen hevc recovery replay gate
25	95.42	discard	MacDisplayKit=19d6d3e0dae8047771e07cb819f88d61b98cef3f	MacDisplayKit: exp524: widen hevc frame delay budget
26	95.42	discard	MacDisplayKit=67e34d03984d7d57a25e35e7c5cc11ddeaf9bd57	MacDisplayKit: exp525: zero hevc vbv initial delay
27	95.42	discard	MacDisplayKit=4ef91cabb5bb4e323f933019dd34607150b749ad	MacDisplayKit: exp526: use mach ticks for hevc callback timing
28	95.42	discard	MacDisplayKit=ff24fd36e01be1cc1ea405d9837a56c04a6998a4	MacDisplayKit: exp527: drop hevc hdr data-rate limits
29	95.42	discard	MacDisplayKit=dffb8c301077f01227abc97a10802be426e8af8f	MacDisplayKit: exp528: set hevc base-layer frame rate
30	95.42	discard	MacDisplayKit=9e98b9d1f19944331ee2ff6fea52ea3802a8e566	MacDisplayKit: exp529: streamline hevc callback keyframe lookup
31	92.72	discard	MacDisplayKit=e3b30852222234f9c573015d9fefa81259e5d8de	MacDisplayKit: exp530: release staged hevc source before submit
32	95.5	discard	MacDisplayKit=9e589d020326cbce8ba57dc0d0c3d356d10c57e0	MacDisplayKit: exp531: async hevc submit accounting
33	93.21	discard	MacDisplayKit=19e80de85d423ef438e1c1df099fcc807913a4bb	MacDisplayKit: exp532: drop no-op submit completion bookkeeping
34	95.31	discard	MacDisplayKit=e0ae9fa3e8917fef694546b28cc7a882573aab1e	MacDisplayKit: exp533: keep timer cadence through hevc idle replay
35	92.9	discard	MacDisplayKit=0548063a35f3d497161d9d59f58c99d40793238f	MacDisplayKit: exp534: reuse fresh skylight surface wrappers
36	92.89	discard	MacDisplayKit=8c915a61c583e9e90fa584640958aae53eca97dd	MacDisplayKit: exp535: trim hevc callback pending budget
37	95.38	discard	MacDisplayKit=9954d15e80170466b1611b7e5156d520d59e7ea7	MacDisplayKit: exp536: latch hevc hdr metadata probe
38	95.42	discard	MacDisplayKit=232f1a2c2988e004c13a3f3d2e44847b3f19818b	MacDisplayKit: exp537: cache keyframe state on encoded frames
39	94.66	discard	MacDisplayKit=7127a0cd8a6c05a6486e256533b7b2d5fefd533d	MacDisplayKit: exp538: cache hdr validation on encoded frames
40	93.68	discard	Lumen=bd1250b5d35bfa177c3fe69b21828e088fb788d7	Lumen: exp539: trim steady-state bridge callback logs
41	91.79	discard	MacDisplayKit=5a24525bcbf9a4484ee3cb230fa446c9ac43541b	MacDisplayKit: exp540: default hevc power-efficiency hint
42	95.62	discard	MacDisplayKit=9127fa7ae8b965d7bf5001be67bf85b71075cd00	MacDisplayKit: exp541: default hevc reference buffer count
43	102.29	keep	MacDisplayKit=c2e0f758fe82a22b13329b407069e1ee0fd30037	MacDisplayKit: exp542: disable hevc low-latency rate control
44	102.29	discard	MacDisplayKit=981957547cdd57444a6d16ac27173749a2388be6	MacDisplayKit: exp543: retune hevc frame-rate hint
45	102.08	discard	MacDisplayKit=5cdc377f7c0cac24cf3506c3e6f34ffd0560b9d6	MacDisplayKit: exp544: drop hevc data-rate limits
46	101.46	discard	MacDisplayKit=21e9ae4e0deda0e007874c5a6393fc11513cea4b	MacDisplayKit: exp545: restore hevc bitrate ceiling
47	25.0	discard	MacDisplayKit=ba4f5ebedac90b75067070b50a6aef143d99b8b7	MacDisplayKit: exp546: zero hevc lookahead
48	102.29	discard	MacDisplayKit=270def321124b09270e9a96ff423ec01f92ae121	MacDisplayKit: exp547: zero hevc vbv initial delay
49	25.0	discard	MacDisplayKit=106215be85f0046193d7796c6dbf78eb4e27d573	MacDisplayKit: exp548: set hevc lookahead to one
50	96.25	discard	MacDisplayKit=e5e6cc8a45ca1c680bc51cbd3cb0fb91977b5774	MacDisplayKit: exp549: relax hevc speed bias
51	101.67	discard	MacDisplayKit=1040081ae41faf52a846e563024b5aa01d2f97e6	MacDisplayKit: exp550: drop hevc frame delay
52	103.96	keep	MacDisplayKit=bed58697f9117229889d16b778e186810287f922	MacDisplayKit: exp551: default hevc vbv buffer
53	104.17	keep	MacDisplayKit=60c83606e2c0f38b70023c758ca9395f8aed6719	MacDisplayKit: exp553: zero hevc vbv initial delay again
54	101.88	discard	MacDisplayKit=1418d09bc8880561882404838e5bc623eb8ef271	MacDisplayKit: exp554: drop hevc data-rate limits again
55	101.46	discard	MacDisplayKit=f5151c6c7997e429e9d560f8c4e8bcb688ceb5ef	MacDisplayKit: exp555: retune hevc frame-rate hint again
56	102.29	discard	MacDisplayKit=50445b4d61dca1f2e7953be46b4a1379f1388562	MacDisplayKit: exp556: raise hevc bitrate ceiling slightly
57	101.88	discard	MacDisplayKit=accf99579a6122e58f8c00f6b5eade8292082110	MacDisplayKit: exp557: tighten hevc vbv buffer slightly
58	102.92	discard	MacDisplayKit=eeba6508dffead5e80b5b086df3ab293ea07b645	MacDisplayKit: exp558: widen hevc vbv buffer
59	102.5	discard	MacDisplayKit=40ecc9871a4093591ca14f9a14765c8f59130a7e	MacDisplayKit: exp559: raise hevc vbv initial delay slightly
60	102.5	discard	MacDisplayKit=6c07114aa1030b33b76bd77a8388c85e0d32666b	MacDisplayKit: exp560: drop hevc frame delay again
61	102.08	discard	MacDisplayKit=923352e6a462cc6728d742bda9fa35b1cb644f21	MacDisplayKit: exp561: default hevc reference buffer count
62	102.29	discard	MacDisplayKit=5a93f7d49c74320a3ac4f96bb79279da831632a5	MacDisplayKit: exp562: trim hevc callback pending slack
63	88.08	discard	MacDisplayKit=f737dc5240166e5915baf9b3abeba30e6a4a827c	MacDisplayKit: exp563: async hevc encode queue handoff
64	102.5	discard	MacDisplayKit=82a1ce3ed62ac660a63bce2b661f85c71b164ca5	MacDisplayKit: exp564: relax hevc replay pending gate
65	102.29	discard	MacDisplayKit=c206961192575128adee3c867ebe7feb6003e673	MacDisplayKit: exp565: widen hevc frame delay budget
66	104.38	keep	MacDisplayKit=74cdedf9279bf445c3a2310433c675855e25f19a	MacDisplayKit: exp566: hint hevc realtime frame rate
67	102.5	discard	MacDisplayKit=a78a028a160395db36546292cd5d59e40b5e6c17	MacDisplayKit: exp567: collapse hevc base layer pacing
68	102.71	discard	MacDisplayKit=7204974f51d9d33599d2f2c9d357322e0bf8410e	MacDisplayKit: exp568: tune hevc realtime cap to 120
69	103.12	discard	MacDisplayKit=791e73043afbbc9fa827e123f679a18abb8a1499	MacDisplayKit: exp569: raise hevc realtime cap slightly
70	101.88	discard	MacDisplayKit=2744043956578ca6d610f2f309e514965dea4e88	MacDisplayKit: exp570: tune hevc realtime cap to 180
71	102.5	discard	MacDisplayKit=5fdea0f2a69c4a3b00e9018687564c1b6327782f	MacDisplayKit: exp571: disable hevc temporal compression again
72	102.08	discard	MacDisplayKit=230664b99e25a6c65d48f830cf9346ec3a2c3fe6	MacDisplayKit: exp572: halve hevc base layer pacing
73	102.71	discard	MacDisplayKit=58be018cc13c35a1b9f8ef3f602d88b9d3e82317	MacDisplayKit: exp573: shorten hevc keyframe cadence
74	102.29	discard	MacDisplayKit=fe0bf37e936b9017db837166d9130c9a606c223a	MacDisplayKit: exp574: lengthen hevc keyframe cadence
75	102.71	discard	MacDisplayKit=a7602fe2255ecdf0c41ab4e08df610669487ac02	MacDisplayKit: exp575: enable hevc open gop
76	101.67	discard	MacDisplayKit=6ca131f51f90e011154c6d926019f18772a97ee7	MacDisplayKit: exp576: raise hevc reference buffers slightly
77	102.08	discard	MacDisplayKit=339c6095839f3604a21bb54b596231045839f401	MacDisplayKit: exp577: enable hevc frame reordering
78	102.29	discard	MacDisplayKit=22e39557da9cff7f83a3cdd0b7fbb5c6f01e1611	MacDisplayKit: exp578: default hevc power hint
79	101.25	discard	MacDisplayKit=dbc77faff85c13d3bb793d3dddf41271bce84105	MacDisplayKit: exp579: decouple hevc expected duration
80	102.29	discard	MacDisplayKit=43f9a1af85bdb9a71cccc156d9ee9a48cf52d776	MacDisplayKit: exp580: trim hevc staging backlog again
81	101.25	discard	MacDisplayKit=be758c9bfb346104841860bece0e7232a766aacb	MacDisplayKit: exp581: widen hevc staging backlog slightly
82	101.88	discard	MacDisplayKit=29d6606d4a6e5015f17fc9722f81ae75c08fcb62	MacDisplayKit: exp582: enable hevc predictive structure together
83	101.67	discard	MacDisplayKit=5beacbb90b4b251813f3116fd66b8c169f453d85	MacDisplayKit: exp583: drop hevc reference buffers again
84	102.29	discard	MacDisplayKit=65d67ebaa5ee4b52af5a42a89948fbd715fe9c7a	MacDisplayKit: exp584: tune hevc realtime cap to 270
85	102.08	discard	MacDisplayKit=d37f7ff55a7233a7e240f0c9186add18e2404bff	MacDisplayKit: exp585: restore tight hevc source pending depth
86	102.08	discard	MacDisplayKit=ea5c485aab0c4763fecb5fda37ef24f4eec0023e	MacDisplayKit: exp586: drop hevc frame delay on realtime cap
87	101.88	discard	MacDisplayKit=a8eb3be3725474c1cbd749d8428a9d947e4695b8	MacDisplayKit: exp587: prefer hevc encoder gpu affinity
88	102.29	discard	MacDisplayKit=97cfa12e9566cd360ae56c7a32b3a866c4bd03fa	MacDisplayKit: exp588: split hevc average and burst hints
89	102.29	discard	MacDisplayKit=74b99ec62601e2f49db4407ab5dac18588dfa925	MacDisplayKit: exp589: async videotoolbox hot-path accounting
90	102.08	discard	MacDisplayKit=ff8dc17c9b630e74472e34ad1776d03ac12f651c	MacDisplayKit: exp590: default hevc average pacing hints
91	100.83	discard	MacDisplayKit=d8aeb1911a446e07fabc43315ee4da440d0beeda	MacDisplayKit: exp591: default hevc expected duration
92	101.46	discard	MacDisplayKit=d2680b1406efd890334253c909292b026d0e85e2	MacDisplayKit: exp592: widen hevc sustained data-rate window
93	101.25	discard	MacDisplayKit=062b61df0c4e408d83e864fce0c7100e7f461137	MacDisplayKit: exp593: require hevc hardware encoder
94	102.08	discard	MacDisplayKit=8d47a6cd0e937f4c4ed7b1a3e15591e9f0fde7e1	MacDisplayKit: exp594: default hevc keyframe duration hint
95	100.62	discard	MacDisplayKit=e9bbc397b95f5504bc0330a7e7541ca82932365e	MacDisplayKit: exp595: set hevc base layer frame rate
96	101.46	discard	MacDisplayKit=6a612ffecfb105ad0bc3f6336776f740081ecf62	MacDisplayKit: exp596: disable hevc segment reserve hints
97	101.04	discard	MacDisplayKit=0eb10e55bf1b7e8883a9ada30be06193c12cb072	MacDisplayKit: exp597: pin hevc hardware encoder selection
98	101.46	discard	MacDisplayKit=e6325266a3a2c55857b80fa93fb5121441aee1fe	MacDisplayKit: exp598: disable hevc startup reserve hint
99	102.08	discard	MacDisplayKit=2dff1ca26c9d2876b8d15f45e6cf931b9b0d6a24	MacDisplayKit: exp599: default hevc keyframe count hint
100	100.83	discard	MacDisplayKit=f280dd28ab0bf3fd71e90cb2c8e38a5a015c4548	MacDisplayKit: exp600: preserve hevc dynamic hdr metadata
101	101.04	discard	MacDisplayKit=3f91c5a406ba0118f0890a221a2738c4f98c425d	MacDisplayKit: exp601: lock hevc latest mailbox only
102	101.46	discard	MacDisplayKit=718337f650f04819d7ccb7a6dab9d65c7bb79a85	MacDisplayKit: exp602: switch hevc hdr to vbr vbv
103	102.29	discard	MacDisplayKit=aaad45a19ee6629ef4e251294b488eb1dfdc862d	MacDisplayKit: exp603: disable hevc tail reserve hint
104	101.88	discard	MacDisplayKit=c013b8a8f5410bb9508aafaa7d7baf8b946069ec	MacDisplayKit: exp604: loosen hevc burst window only
105	101.88	discard	MacDisplayKit=0645f317216350b4aedfbeb98a590c3a30859dab	MacDisplayKit: exp605: inline mailbox drain again
106	101.67	discard	MacDisplayKit=fe2e18b382f7a6bf8afda8d3d965127aecce4e53	MacDisplayKit: exp606: dedupe pending keyframe replay
107	95.62	discard	MacDisplayKit=0734fad7016cabdeaa5db60026467a1ee253005a	MacDisplayKit: exp607: enable pq hevc low-latency rc
108	101.25	discard	MacDisplayKit=d898677f5f535096ae568b7c83e52012d06b8194	MacDisplayKit: exp608: default pq hevc capture to full range
109	102.29	discard	MacDisplayKit=9bf411679bdc51740582899e4c361683a7b9326e	MacDisplayKit: exp609: split hevc average hint to 180
110	102.5	discard	MacDisplayKit=912c239af4875738634202a2195c34b24b601340	MacDisplayKit: exp610: release staged source after gpu copy
111	101.88	discard	MacDisplayKit=6764f83929fb813ab2a005989c66fa4de5000176	MacDisplayKit: exp611: raise skylight delivery qos moderately
112	101.67	discard	MacDisplayKit=fd76229f0f7b13ac4853f4ddfafe5be77159a811	MacDisplayKit: exp612: raise encode queue qos moderately
113	102.71	discard	MacDisplayKit=1e695f6dfe9c57bb887b9de9424a794e27c852a5	MacDisplayKit: exp613: trim hevc pending window by one
114	100.83	discard	MacDisplayKit=e265d2fcd84c4f084f23fd7a2f7de2faf8e2884b	MacDisplayKit: exp614: widen hevc pending window by one
115	101.25	discard	MacDisplayKit=2e14935f1c9b7f1b46a2797a76db06e6bfb9f61d	MacDisplayKit: exp615: adapt hevc pending warmup limit
116	88.5	discard	MacDisplayKit=e432b3d1e25193e174886c1cd296e9c62a392cbe	MacDisplayKit: exp616: async hevc encode handoff
117	101.46	discard	MacDisplayKit=b8f621ec95fa601e6c422b4bcf6ce36b1cda93e5	MacDisplayKit: exp117: clamp hevc vbv buffer to 1/60
118	101.46	discard	MacDisplayKit=7457bcd918554e55f92149567bab5103ada0d98b	MacDisplayKit: exp118: widen hevc frame delay budget
119	101.67	discard	MacDisplayKit=50d5302012083a4a8ea6f53215d6be1e12096928	MacDisplayKit: exp119: raise hevc output queue qos
120	101.25	discard	MacDisplayKit=a8dc80f6fca40c14bce8ae3e6703caef46adf064	MacDisplayKit: exp120: raise hevc vbv initial delay by one
121	101.25	discard	MacDisplayKit=5caf23aa0dd174ff16c99df43d29b8412c177028	MacDisplayKit: exp121: keep fresh mailbox over replay
122	101.67	discard	MacDisplayKit=703dc6794232302e6083ef02d42440ceb5051ab6	MacDisplayKit: exp122: prefer 360hz q2 source bootstrap
123	104.17	discard	MacDisplayKit=431e7427daeeef3095f3febc3ee08c1f99a9d7b1	MacDisplayKit: exp123: raise hevc synthetic replay to 180hz
124	104.38	discard	MacDisplayKit=75e5fcb673486cc799553ccd8c56273c50e5038a	MacDisplayKit: exp124: lower hevc synthetic replay to 144hz
125	102.92	discard	MacDisplayKit=6b4bd7ba5c5345b6f808fe423fdced558f0fad54	MacDisplayKit: exp125: lower hevc synthetic replay to 132hz
126	104.17	discard	MacDisplayKit=6e4088e3bddeb43de2f631f8363293bdf1c89896	MacDisplayKit: exp126: raise hevc synthetic replay to 150hz
127	104.17	discard	MacDisplayKit=b6cdacd2182144c33b705caf54912cdb80df521c	MacDisplayKit: exp127: set hevc synthetic replay to 138hz
128	102.08	discard	MacDisplayKit=056c99e03703ef9c2a9b4dcfe105fb7669c0f8a0	MacDisplayKit: exp128: advance hevc replay startup tick
129	103.12	discard	MacDisplayKit=d7c1a95267e03582c6b601993d7d8345d0b1201c	MacDisplayKit: exp129: relax hevc replay timer leeway
130	104.17	discard	MacDisplayKit=3797cbe2eae0ccdd3acd2cf499a00d58b844bff7	MacDisplayKit: exp130: set hevc synthetic replay to 146hz
131	104.38	discard	MacDisplayKit=e1ab4a5ced1b473c994ca89dadff542a9ee9b159	MacDisplayKit: exp131: advance hevc replay startup to three quarters
132	104.17	discard	MacDisplayKit=d2195bf483a28a632800aed61bc5728cc6176aa6	MacDisplayKit: exp132: drop hevc expected-duration hint
133	104.17	discard	MacDisplayKit=f2ed920c6120310c2745ba9ee552eaee73f1a39b	MacDisplayKit: exp133: lower hevc realtime max-rate hint
134	103.33	discard	MacDisplayKit=c1949cbbc1aaa995c70afb715d6813b0332754a4	MacDisplayKit: exp134: drop replay while hevc work is pending
135	102.92	discard	MacDisplayKit=b3979ad94799823225cd1b743683ff7390eef373	MacDisplayKit: exp135: drop timer replay while hevc work is pending
136	104.17	discard	MacDisplayKit=fa519410570e9a5ed4cb8c6f35dd745985c0ec69	MacDisplayKit: exp136: reserve last hevc slot for fresh frames
137	104.38	discard	MacDisplayKit=9bf08a81baa219eb22fbc0bd72b12a144eb8f995	MacDisplayKit: exp137: use default hevc power-efficiency hint
138	104.38	discard	MacDisplayKit=dac9dcd099c8467b8b614bd0106a4962d116708d	MacDisplayKit: exp138: lower hevc expected-rate hint only
139	104.38	discard	MacDisplayKit=67e92e1e7209ae4e8df32f131164f511c0f3b7ed	MacDisplayKit: exp139: set hevc expected-rate to target
140	104.38	discard	MacDisplayKit=745aeb0afe40f239bb742f8cd044c81fec80c665	MacDisplayKit: exp140: target hevc expected-duration hint
141	104.38	discard	MacDisplayKit=92897fe268c841bb37b7872117b73141ac8249b1	MacDisplayKit: exp141: raise hevc realtime max-rate ceiling
142	104.38	discard	MacDisplayKit=33f9df99a5d104616bbed57a4771e304b9c5925d	MacDisplayKit: exp142: default hevc frame-delay hint
143	104.38	discard	MacDisplayKit=40c3083f139cf0c760167212c91914a618f5a3d9	MacDisplayKit: exp143: boost hevc realtime ceiling only at startup
144	102.08	discard	MacDisplayKit=5efea6c33357ecb01a163d1bdc9169df08b6f4b8	MacDisplayKit: exp144: default hevc data-rate limits
145	104.38	discard	MacDisplayKit=a98d8a27ad11b0d49c6279a34fbe9995d03e22c5	MacDisplayKit: exp145: relax hevc data-rate burst windows
146	104.17	discard	MacDisplayKit=ad67d9a9b2e5c57ebbd13a446c452a852b0e7aee	MacDisplayKit: exp146: disable hevc startup lookahead
147	104.17	discard	MacDisplayKit=4733387cff9a4bd91000a5e2fd65201cbcf32a07	MacDisplayKit: exp147: lighten callback pending tracker lock
148	104.17	discard	MacDisplayKit=7f06649792c4d8228380878d6c82cff38a031029	MacDisplayKit: exp148: spin the callback pending lock briefly
149	104.17	discard	MacDisplayKit=f77ae6e26896c187317cb261d5d49328c31482ac	MacDisplayKit: exp149: tune hevc synthetic replay to 143hz
150	104.38	discard	MacDisplayKit=e216e833aeae9b913dd7c0a5519f3d4a929f950b	MacDisplayKit: exp150: advance hevc replay startup to seven eighths
151	104.38	discard	MacDisplayKit=8bf8c2fc6b6847a1a723450a1ab67e69be6553de	MacDisplayKit: exp151: use strict hevc replay timer
152	104.17	discard	MacDisplayKit=23799ed87c6e75109967bcc06debb831e451946e	MacDisplayKit: exp152: use work-item autorelease on skylight delivery
