experiment	commit	metric	status	description
311	101.04	discard	MacDisplayKit=2398c9f4417f2c8c0a4be65316ac2a462916dacc	MacDisplayKit: exp311: disable hevc end reserve hint
312	101.04	discard	MacDisplayKit=a38d3edd5f26a3351547b09946b7ff35383f41db	MacDisplayKit: exp312: suppress hevc source saturation events
313	101.25	discard	MacDisplayKit=476240b1b2df5c19f58fff4d5d47a6b9f6adf657	MacDisplayKit: exp313: make vt submitted-frame accounting async
314	101.46	discard	MacDisplayKit=bdd7d0cf217719900b144b51d256ad315489ccb2	MacDisplayKit: exp314: cache skylight capture surfaces
315	100.62	discard	MacDisplayKit=7d1824bb2b41410480b3b0879934be5e814d0deb	MacDisplayKit: exp315: raise mailbox continuation task priority
316	101.88	discard	MacDisplayKit=a76786d5c4246f87b52775d6961cd654c7fb403a	MacDisplayKit: exp316: release staged vt slots without queue hop
317	101.88	discard	MacDisplayKit=b7e9c56d370bbf1dfe63a04833c14ed41bec7cf2	MacDisplayKit: exp317: submit original capture frame to encode queue
318	101.46	discard	MacDisplayKit=11ae248ea32d4343372a13b5f064e203e78ad085	MacDisplayKit: exp318: pair strict replay timer with 13/16 startup
319	101.46	discard	MacDisplayKit=f9ecde51c9ee3b994ab046b90c2d77e4b699b8d6	MacDisplayKit: exp319: shift hevc replay startup to thirteen sixteenths
320	101.04	discard	MacDisplayKit=9efb8c2b49bee454bb5e8215a725033a4ca62db5	MacDisplayKit: exp320: use strict hevc replay timer
321	101.67	discard	MacDisplayKit=5ef096321b1f50c9decec7995c8f1198908e6394	MacDisplayKit: exp321: disable hot-path source diagnostics for prores
322	101.25	discard	MacDisplayKit=0225ecea5fdbc5321de5b831efec4ea3d4a4587b	MacDisplayKit: exp322: skip hevc source drop metadata
323	101.88	discard	MacDisplayKit=b088aeb899cec7016a80af89921cd861832885be	MacDisplayKit: exp323: pair hevc realtime ceiling with target duration
324	101.46	discard	MacDisplayKit=bba418fec5158db6f015eac3c9e1aa05e307eebe	MacDisplayKit: exp324: prewrap skylight surfaces for unfair replay lock
325	101.25	discard	MacDisplayKit=584fd44c8482277076c827bed398bb7c29429798	MacDisplayKit: exp325: pair hevc target duration with relaxed burst
326	100.83	discard	MacDisplayKit=7ba5eff7e2449bd75629dcd72502ca6a639ba301	MacDisplayKit: exp326: restore default hevc vbv initial delay
327	101.46	discard	MacDisplayKit=dfa8d7af6b5e5fdd3e7b0f726134ddad39ef3df5	MacDisplayKit: exp327: enable hevc vbv buffer on 240hz path
328	100.83	discard	MacDisplayKit=832b2b38eaaeb71f33e4638c7dd0b2b47a3c3fca	MacDisplayKit: exp328: skip hevc dirty-rect decode when diagnostics are off
329	101.04	discard	MacDisplayKit=e6d6a3ba2174ea70995aefc0a9b4a57a44f85ed0	MacDisplayKit: exp329: relax hevc data-rate burst windows
330	102.29	discard	MacDisplayKit=549bd142664ff6c3401f5477a00f0f57448482a7	MacDisplayKit: exp330: target hevc expected-duration hint
331	101.67	discard	MacDisplayKit=c4e8d1cc399250cca6df5906c5fc283232c8b46d	MacDisplayKit: exp331: collapse vt bookkeeping queue hops
332	101.46	discard	MacDisplayKit=9a4a3569ce5746f2723de4538002734e44cee18d	MacDisplayKit: exp332: raise hevc realtime max-rate ceiling
333	101.25	discard	MacDisplayKit=98afa8f29fd003bb88afcd10e6cfd999dd6a6ef7	MacDisplayKit: exp333: advance hevc replay startup to seven eighths
334	99.58	discard	MacDisplayKit=d52c46cbd3f4c1e50db4563a082ac408a6af93d1	MacDisplayKit: exp334: tighten hevc replay timer leeway slightly
335	101.0	discard	MacDisplayKit=9d383bfebbf0797cbc3e4dc7bf00eced5cbd8534	MacDisplayKit: exp335: default hevc frame-delay hint
336	101.46	discard	MacDisplayKit=ad39f29f25745e69283759c5314d0f3d9eac5294	MacDisplayKit: exp336: set hevc expected-rate to target
337	102.29	discard	MacDisplayKit=b1d54f4aff249276c74d97f604299b99799d3ed4	MacDisplayKit: exp337: use default hevc power-efficiency hint
338	89.19	discard	MacDisplayKit=60bf02bb45e5eff83404418f6c8837d4f324ea57	MacDisplayKit: exp338: prefer private iosurface for hevc hdr
339	101.67	discard	MacDisplayKit=2ba448aeb9d19acc6fb5c1f12f0dedf7cd60a2b1	MacDisplayKit: exp339: widen hevc frame delay budget
340	101.88	discard	MacDisplayKit=93775e0569d9d431352698fe78084a5fa4484d09	MacDisplayKit: exp340: relax hevc data-rate burst windows
341	102.08	discard	MacDisplayKit=383ca6684f83a7d9b6dac35495125b12b61cce81	MacDisplayKit: exp341: raise hevc realtime max-rate ceiling
342	101.67	discard	MacDisplayKit=e9b95f780e2933f3c6e383536ed6356129ffdbf9	MacDisplayKit: exp342: target hevc expected-duration hint
343	101.67	discard	MacDisplayKit=8f44c6c46e4fcc29261fe13f6454b05cf2dc44b5	MacDisplayKit: exp343: lower hevc expected-rate hint only
344	101.67	discard	MacDisplayKit=9a6892d1181dda2c7bb6fd79c240ded4f7cb94db	MacDisplayKit: exp344: boost hevc realtime ceiling only at startup
345	101.04	discard	MacDisplayKit=12644453a28f108c8b44db02e94a4072c55bf60f	MacDisplayKit: exp345: disable hevc end reserve hint
346	102.29	discard	MacDisplayKit=4f3c9a3c9425d37f7d4c8a844d0dcedbe3da701f	MacDisplayKit: exp346: collapse vt bookkeeping queue hops
347	100.62	discard	MacDisplayKit=60418cc47bee340ccf909e70aeeae71e9900ecef	MacDisplayKit: exp347: suppress hevc source saturation events
348	102.5	discard	MacDisplayKit=33a5165c832fa5a28384f474409a50fd6dfe4899	MacDisplayKit: exp348: replace mailbox actor drain hops
349	101.46	discard	MacDisplayKit=a395b7b9f61f8a68b8107d1229483437c0bf9ded	MacDisplayKit: exp349: cache reused skylight capture surfaces
350	87.25	discard	MacDisplayKit=1b26d0147f306665f439cd1271cd0075700753a6	MacDisplayKit: exp350: decouple capture callback from encode queue
351	101.67	discard	MacDisplayKit=e68575a5eabc90e745f958389b54c7718d05fee3	MacDisplayKit: exp351: release direct hevc source permit before submit
352	25.0	discard	MacDisplayKit=5d9b0890453814cdcbf1dfdeeb97d9dc2df5729c	MacDisplayKit: exp352: force detached high-refresh hevc submit
353	87.25	discard	MacDisplayKit=80c7fdb32b358436082e3f085cebecc73ce36066	MacDisplayKit: exp353: async handoff high refresh hevc submit
354	100.83	discard	MacDisplayKit=d2238b27d4dc0306949fe1cb6ddff7d85278dd1e	MacDisplayKit: exp354: defer fresh hevc source release on callback backlog
355	101.04	discard	MacDisplayKit=9f031c00d4d47190bf053ba2aac5319945304c28	MacDisplayKit: exp355: defer fresh hevc source release on callback backlog
356	100.62	discard	MacDisplayKit=de0368f209b33949124476bab43daeac4fdeb339	MacDisplayKit: exp356: queue credit-driven high refresh hevc drain
357	102.08	discard	MacDisplayKit=e87fa6eeba5e4047eeddb49f89eabe9d6b081f5c	MacDisplayKit: exp357: request hdr sdr range preservation
358	102.29	discard	MacDisplayKit=0e8a769ac8885663b18283e2f54096ef8121c5c5	MacDisplayKit: exp358: apply hevc high-speed preset
359	101.67	discard	MacDisplayKit=7cfeb5274ab0477e0679f16f2ccddbb7973784dd	MacDisplayKit: exp359: cache hdr attachments per submission buffer
360	102.08	discard	MacDisplayKit=9e786425eccd0f5bccbb28f34b91c488852f5fed	MacDisplayKit: exp360: add one more hevc source slot
361	101.25	discard	MacDisplayKit=6ee06d5d1257d31911352230692555598e3281f3	MacDisplayKit: exp361: require hardware videotoolbox encoders
362	101.04	discard	MacDisplayKit=9f7afc187549af5d116ea24afc76412bd81a47a1	MacDisplayKit: exp362: force explicit videotoolbox hardware encoder ids
363	25.0	discard	MacDisplayKit=65e8b2de5ffe90d5af6bb2535e58821655e6d490	MacDisplayKit: exp363: prefer proxy iosurface for hdr hevc
364	101.46	discard	Lumen=723b70f8ddb37fcf4a3a0f9133fd0d9cd44bbd23	Lumen: exp364: disable overlay static hdr metadata
365	101.46	discard	MacDisplayKit=ce8b6ffa7ca944daedb8cef61fbc87ab63b61c2c	MacDisplayKit: exp365: benchmark pq hevc bootstrap
366	100.62	discard	MacDisplayKit=c85ad551b6e3571990b8997e296bdcdc4a16e044	MacDisplayKit: exp366: suppress idle replay callbacks
367	101.67	discard	Lumen=f628b3181a8000a733e6f03dd3d057c42f266ef4	Lumen: exp367: sample bridge frame status updates
368	102.08	discard	MacDisplayKit=06fa3187eefcc817f223f6e093b3e1fe044fec2d	MacDisplayKit: exp368: skip hdr hevc data rate limits
369	101.88	discard	MacDisplayKit=2735df2fe81a623424a014c6941a6c2d28f71741	MacDisplayKit: exp369: disable hdr hevc boundary lookahead
370	102.08	discard	MacDisplayKit=0a574ed5afcd662de912a0ae3cc4652ae4b0798d	MacDisplayKit: exp370: deliver hdr hevc frames on callback
371	101.46	discard	MacDisplayKit=7e8f3b08dc7a7755536fca7c1efd3dc5f1801404	MacDisplayKit: exp371: widen realtime hdr hevc pending slack
372	101.25	discard	MacDisplayKit=e49144bb9ae9d30bab6250fdd54dbb57eccaf54f	MacDisplayKit: exp372: prefer q1 120-like bootstrap
373	101.04	discard	MacDisplayKit=f1c4f71312eeadc47bc4e39b47d2cb585cd5dd81	MacDisplayKit: exp373: reserve last hevc slot for fresh frames
374	25.0	discard	MacDisplayKit=76ba9565137d0713eb864de310833009ebaedb90	MacDisplayKit: exp374: time hevc proxy prime on first fresh frame
375	101.67	discard	MacDisplayKit=d1d90ab159915ddd5315f8f0314259d013f1b43f	MacDisplayKit: exp375: delay hevc proxy prime by one interval
376	101.04	discard	MacDisplayKit=459c65b11f6f78e990b9a2a44770140c0698a9f5	MacDisplayKit: exp376: pair slot release with async submit accounting
377	101.88	discard	MacDisplayKit=edaec713303a58b6ab1c2bed4a0f4ee8ee8fa856	MacDisplayKit: exp377: tighten hevc replay timer leeway
378	101.88	discard	MacDisplayKit=2d231a372d740919be742237bfffb619b44464d3	MacDisplayKit: exp378: pair lower ceiling with async submit accounting
379	100.83	discard	MacDisplayKit=fbb64f368a0d611688e3e1457b1004b6e5a59f1e	MacDisplayKit: exp379: trim hevc source diagnostics together
380	100.62	discard	MacDisplayKit=e69dcf8bbe6f040fef222c93d6761f1fa7b8c415	MacDisplayKit: exp380: pair delivery autorelease with direct handoff
381	101.67	discard	MacDisplayKit=669d3fe8ed4af15dfedd45c92d23979cfbfcc38c	MacDisplayKit: exp381: use work-item autorelease on vt queues
382	101.04	discard	MacDisplayKit=8511e3076e3830187e5568d3a323ad4ef07725b3	MacDisplayKit: exp382: pair startup gate with direct handoff
383	25.0	discard	MacDisplayKit=e9c4871270c2b8783a8f050bbe3ff44b72959b12	MacDisplayKit: exp383: prime hevc proxy with receive-send zero
384	25.0	discard	MacDisplayKit=2031d602f6d69e05b5a8648a26d940f7a39445ae	MacDisplayKit: exp384: prime hevc proxy with full public profile
385	101.04	discard	MacDisplayKit=26e976e4f19304b543089b785355535ec9edfc58	MacDisplayKit: exp385: keep fresh skylight frames under saturation
386	101.88	discard	MacDisplayKit=758d3c1d902e5dd587638ef39d0fd62c770055b1	MacDisplayKit: exp386: skip skylight diagnostic payload decode
387	101.67	discard	MacDisplayKit=9a6f4bc638b5aff2c4f3dd0b14abd0a650b67b6e	MacDisplayKit: exp387: prioritize skylight delivery queue
388	101.46	discard	MacDisplayKit=2308f8cdb2681b29633355d3e21ac9659c0ca92e	MacDisplayKit: exp388: align skylight replay interval to tuning
389	104.17	discard	MacDisplayKit=cd3031306e10057a9864cbe14210c94d4abdeb94	MacDisplayKit: exp389: retune hevc synthetic replay to 144hz
390	101.67	discard	MacDisplayKit=ab45bc338abb20f8b417b9dfe23e0a55628c91b2	MacDisplayKit: exp390: retune hdr hevc frame rate hint to target
391	102.08	discard	MacDisplayKit=b12ac8c3027545f4efe26559993b32df27983cd1	MacDisplayKit: exp391: retune hevc realtime frame rate ceiling
392	102.08	discard	MacDisplayKit=d1e8dbd0f836e8180ee0a45d347ae870876ffe93	MacDisplayKit: exp392: retune hevc realtime frame rate ceiling midway
393	96.46	discard	MacDisplayKit=80bd414023bb07528e320c0c6dafb384e33b898f	MacDisplayKit: exp393: relax hdr hevc speed-first bias
394	104.17	discard	MacDisplayKit=2e4c546187470cf4776e54762796fa04a953b483	MacDisplayKit: exp394: retune hevc synthetic replay to 148hz
395	101.88	discard	MacDisplayKit=c39cf7b47ac905ca1a516abf72e47b33b14945e1	MacDisplayKit: exp395: tune hevc expected duration to 144hz
396	101.25	discard	MacDisplayKit=951022ba7611f442d70097e3e82d8bc911f22e13	MacDisplayKit: exp396: decouple hevc pacing hint from realtime cap
397	102.5	discard	MacDisplayKit=8417a0cef29976aeb0849362896f8c9fa5b2848a	MacDisplayKit: exp397: soften hevc expected duration hint
398	101.25	discard	MacDisplayKit=74799e8773b1457a3d22611199c51fa1e694d7a9	MacDisplayKit: exp398: ease hevc expected duration slightly
399	102.5	discard	MacDisplayKit=d16744d719ad1726c4a42ded91b8ae40a76a598b	MacDisplayKit: exp399: nudge hevc expected duration hint
400	104.17	discard	MacDisplayKit=fbb987175448674b66bcaa32c76c20823d0d0006	MacDisplayKit: exp400: set hevc base layer fraction to 0.75
400	102.5	discard	MacDisplayKit=fbb987175448674b66bcaa32c76c20823d0d0006	MacDisplayKit: exp400: set hevc base layer fraction to 0.75
401	101.88	discard	MacDisplayKit=0e2b3f1ae84bfefabfddfb60415672ade97b3c79	MacDisplayKit: exp401: set hevc base layer rate to 90
401	102.92	discard	MacDisplayKit=0e2b3f1ae84bfefabfddfb60415672ade97b3c79	MacDisplayKit: exp401: set hevc base layer rate to 90
402	25.0	discard	MacDisplayKit=e52d6e09b8275ca5da01691cca2ac22a25a1bc92	MacDisplayKit: exp402: set hevc base layer rate to 100
402	25.0	discard	MacDisplayKit=e52d6e09b8275ca5da01691cca2ac22a25a1bc92	MacDisplayKit: exp402: set hevc base layer rate to 100
403	25.0	discard	MacDisplayKit=e7f9580cd6a595d618b1c8dca7586fd3e63008e7	MacDisplayKit: exp403: set hevc base layer fraction to 0.875
403	25.0	discard	MacDisplayKit=e7f9580cd6a595d618b1c8dca7586fd3e63008e7	MacDisplayKit: exp403: set hevc base layer fraction to 0.875
404	102.29	discard	MacDisplayKit=07797ba515eee1fb39383b995dd8da00800374b0	MacDisplayKit: exp404: retest hevc replay startup at three quarters
405	101.88	discard	MacDisplayKit=f6df0dfa6ae10b9f2fcacee282b1e2984a5bef91	MacDisplayKit: exp405: shift hevc replay startup to eleven sixteenths
406	101.67	discard	MacDisplayKit=10b25c427956af1405dbd64229085a7bc27f2db9	MacDisplayKit: exp406: shift hevc replay startup to five eighths
407	102.08	discard	MacDisplayKit=c2ef728fdadbad894eef3beb9aea9cbf0ad2e6b0	MacDisplayKit: exp407: shift hevc replay startup to twenty three thirty seconds
408	102.08	discard	MacDisplayKit=8452cc7dda128fcec952d54df611d2a1ceca2ce4	MacDisplayKit: exp408: set hevc base layer rate to 84
409	102.08	discard	MacDisplayKit=5343013f299e4c8aa5c692fa9b5c8f7d3bb424d2	MacDisplayKit: exp409: set hevc base layer rate to 92
410	102.08	discard	MacDisplayKit=9102b14a70aa5379aa3fee51f73673ca096d8547	MacDisplayKit: exp410: set hevc base layer rate to 89
411	102.29	discard	MacDisplayKit=d73fd5bb529f7716d27dd9d4999a251eeac3bc7a	MacDisplayKit: exp411: set hevc base layer rate to 91
412	101.46	discard	MacDisplayKit=f0198d168d71f92b2f7934795c7da5d44ac049cf	MacDisplayKit: exp412: bias hevc base layer bitrate to 0.9
413	101.88	discard	MacDisplayKit=36db2cf149a197449a8f130ecf2ec5ac97846de1	MacDisplayKit: exp413: pair 90hz hevc base layer with 0.8 bitrate share
414	101.88	discard	MacDisplayKit=88a6af016064621c4fd2dd5119df5074f842066e	MacDisplayKit: exp414: tighten hevc replay timer leeway
415	104.17	discard	MacDisplayKit=1a3881802a771e67620117771b0ac9bbc9e45e90	MacDisplayKit: exp415: relax hevc replay minimum delta slightly
416	104.17	discard	MacDisplayKit=e43338f32fb0d7e4987ce7b192032566ad5f3bca	MacDisplayKit: exp416: relax hevc replay minimum delta to seven eighths
417	104.17	discard	MacDisplayKit=67bcd3c90733b3b02f81d1f88b5c10d445b5100c	MacDisplayKit: exp417: relax hevc replay minimum delta to three quarters
418	103.96	discard	MacDisplayKit=a9d2aa12d8450ac1406c9c625b759b9f27acbc63	MacDisplayKit: exp418: relax hevc replay minimum delta to one half
419	104.17	discard	MacDisplayKit=2b02a473e66404ae6b36f7469bb1a97ec6fcc700	MacDisplayKit: exp419: relax hevc replay minimum delta to five eighths
420	104.38	discard	MacDisplayKit=03339bfcba51817a27cd98e5e7375096430173a2	MacDisplayKit: exp420: relax hevc replay minimum delta to eleven sixteenths
421	104.38	discard	MacDisplayKit=a785e023f626bc8f38ce9c2fd9e1c7fbff5e02fa	MacDisplayKit: exp421: relax hevc replay minimum delta to twenty three thirty seconds
422	104.17	discard	MacDisplayKit=a46a6d0ddaab424ad636b0d7e1dbf1baed6d62f3	MacDisplayKit: exp422: relax hevc replay minimum delta to forty five sixty fourths
423	102.08	discard	MacDisplayKit=9af86afe90c532cf822eb8042c8b6ee8d510cf62	MacDisplayKit: exp423: tighten hevc replay timer leeway to one eighth
424	104.17	discard	MacDisplayKit=0aa24ecba03479ab11b02968aedff9850b05a31d	MacDisplayKit: exp424: relax hevc replay minimum delta to forty seven sixty fourths
425	101.88	discard	MacDisplayKit=c9afd585240f49b37208b635e2038a9e48d0ea11	MacDisplayKit: exp425: clamp hevc pq callback pending window to three
426	101.88	discard	MacDisplayKit=2cbb0b154539d44dabaed143c3e5cb342f4638b2	MacDisplayKit: exp426: cap hevc pq staging backlog at three slots
427	25.0	discard	MacDisplayKit=fb01cb98f9e826876c6edd2d4b4ff4f98cdabc9c	MacDisplayKit: exp427: force detached high refresh pq hevc submit
428	101.88	discard	MacDisplayKit=1d8609492d342e64902785d63766bc204cc1da3f	MacDisplayKit: exp428: clamp hevc pq callback pending window to five
429	102.5	discard	MacDisplayKit=be58d637e98b263b73ab18667b12c7df0244b9a5	MacDisplayKit: exp429: give pq hevc callback path one more pending slot
430	99.17	discard	Lumen=bb5e33b356eac8c46fc377bde88ceb264e7a8347	Lumen: exp430: route 120hz hevc hdr auto queue to q2
431	101.67	discard	Lumen=d7ebda6d2404305379808290a734fb3e51291135	Lumen: exp461: widen 120hz hevc overlay forwarding capacity
432	101.25	discard	Lumen=96cdf4530aac0b7b82659da52ef436ae5c208029	Lumen: exp462: slim dropped-frame capture diagnostics
433	101.46	discard	Lumen=676043b9e054c8ada0612c73991aad72c879616c	Lumen: exp463: skip overlay dropped-frame core events
434	101.88	discard	Lumen=f4850b951d70b440ff732e40773d45d7bbf72b0e	Lumen: exp464: ignore overlay dropped-frame callbacks
435	102.08	discard	MacDisplayKit=22dd87ef7a8dc2f2a695db5d80280eb4702e6265	MacDisplayKit: exp567: keep hdr hevc main10 on staged bgra
436	88.12	discard	MacDisplayKit=5162d1e0899d2ef0fb63374506fb33602fb92c74	MacDisplayKit: exp568: prefer private hdr hevc bgra path
437	102.29	discard	MacDisplayKit=f078ae1fb10b6b0441bf9628496b0499e821de4a	MacDisplayKit: exp569: soften hevc realtime frame cap
438	104.17	discard	MacDisplayKit=6aa43ed717dce5de5ef8f4126304e606b925a0a5	MacDisplayKit: exp570: retune hevc replay minimum delta
439	101.67	discard	MacDisplayKit=e603addb9346ed43b8865d89b8a9001bd5d3dc7f	MacDisplayKit: exp571: pair hevc ceiling with relaxed burst
440	102.5	discard	MacDisplayKit=66c156169f15aefe47ea554518157c33124d69a9	MacDisplayKit: exp572: pair default frame delay with bookkeeping hops
441	101.88	discard	MacDisplayKit=16255936cba81c589d8782660eaf3a6a9babdcdb	MacDisplayKit: exp573: pair default power hint with end reserve
442	101.88	discard	MacDisplayKit=761f1886b0562cdd41251892184781b045389abe	MacDisplayKit: exp574: pair duration split with source drop suppression
443	101.46	discard	MacDisplayKit=2aa32f9750b310af94cdccdcd42db995a377a7af	MacDisplayKit: exp575: pair drop suppression with bookkeeping hops
444	101.67	discard	MacDisplayKit=c8ce457667c97b075cb291e2d52ff0f3eba20fb7	MacDisplayKit: exp576: pair default power hint with source drop suppression
445	102.29	discard	MacDisplayKit=19749c49431dacfc61f805c3212d335a293f561b	MacDisplayKit: exp445: pair default power hint with encode autorelease
446	101.88	discard	MacDisplayKit=1f094370f718f90f24c593c140a775aee1f921a2	MacDisplayKit: exp446: pair startup ceiling with end reserve
447	101.46	discard	MacDisplayKit=a7ecf0d68a02b251ac57247edf7abaa0ae5f9254	MacDisplayKit: exp447: pair slot release with source drop suppression
448	101.67	discard	MacDisplayKit=cb290a474a1ca2871fdc1ee6618893086f890bb4	MacDisplayKit: exp448: pair source diagnostics drop with drop suppression
449	101.67	discard	MacDisplayKit=a1105a7572dd51d2b06983c6569519cdfe35b8e9	MacDisplayKit: exp449: pair slot release with source diagnostics drop
450	101.67	discard	MacDisplayKit=f650ed94b181b92e77c173e93c005ffcb1417e48	MacDisplayKit: exp450: pair unfair pending with source diagnostics drop
451	102.29	discard	MacDisplayKit=dc8a8e61264ea698b16fc5b6527a76c0f5a54b02	MacDisplayKit: exp451: pair strict replay timer with source diagnostics drop
452	102.08	discard	MacDisplayKit=7ec195691ec5540726f9d01d7fc4e3c7c484d29f	MacDisplayKit: exp452: use strict hevc replay timer
453	104.17	discard	MacDisplayKit=57c7f4d942e96d66e6c2f2f2bad2eeed0235c9ff	MacDisplayKit: exp453: retune hevc replay minimum delta
454	102.71	discard	MacDisplayKit=57745f408ec69144e06d5c3b1f9b7db749c44a1c	MacDisplayKit: exp454: drop hevc source frame diagnostics
455	104.17	discard	MacDisplayKit=7e9dbbddd1229200bd463ad79d19a69adf2e2538	MacDisplayKit: exp455: pair strict timer with replay minimum delta
456	101.46	discard	MacDisplayKit=a52cfc9d375984a663eef9a36d1d2bff70a0cfdf	MacDisplayKit: exp456: use work-item autorelease on vt output queue
457	101.46	discard	MacDisplayKit=c04ce220c1dc4f48d13ec0983021c8412176291c	MacDisplayKit: exp457: drop skylight replay lock on delivery queue
458	102.71	discard	MacDisplayKit=3238164b5a18743b9af48c65b5f276f51dd73851	MacDisplayKit: exp458: split hevc replay queue
459	101.46	discard	MacDisplayKit=dd89d62cb2e8ec0e69400c1efbf0f613faeb8324	MacDisplayKit: exp459: allow direct overlay prores passthrough
460	104.17	discard	MacDisplayKit=424f03996c7fe061f8a7dcfae5965371f657643b	MacDisplayKit: exp460: pair replay queue split with replay minimum delta
461	104.17	discard	MacDisplayKit=2f35ff3eaa90e23834ebd2a8ced4cc9b239eb2b4	MacDisplayKit: exp461: pair replay queue split with 11/16 minimum delta
462	104.17	discard	MacDisplayKit=3c899e6c652965cf818825d42dc7b91bc3134e11	MacDisplayKit: exp462: pair replay queue split with 11/16 minimum delta
463	104.17	discard	MacDisplayKit=f35ed5cf18056baa9f157ea43cdcc74fd98cb9fd	MacDisplayKit: exp463: pair replay queue split with 45/64 minimum delta
464	102.08	discard	MacDisplayKit=3238ae4f3f55e4ec151dd6b92349fb39bac8727b	MacDisplayKit: exp464: pair replay queue split with strict timer
465	102.5	discard	MacDisplayKit=640a93f17359a7c4aa0be448be4e55fadcf2b3b2	MacDisplayKit: exp465: stamp hevc submission duration at 120hz
466	101.67	discard	MacDisplayKit=b18e8f3f609de871697f15d9d0b89f076b2d57f6	MacDisplayKit: exp466: split hevc expected duration from frame-rate hint
