experiment	commit	metric	status	description
628	104.17	discard	MacDisplayKit=b7dd5b99bcd34921f2a47c6377a3a4dc88a84b96	MacDisplayKit: exp628: pair earlier startup with relaxed gate
629	104.38	discard	MacDisplayKit=410dc2aa6d286a4347012ea8c09a0f4340675da5	MacDisplayKit: exp629: deepen hevc replay minimum delta relaxation
630	104.17	discard	MacDisplayKit=6920fbddd688147c1016d1843acffae6a095e426	MacDisplayKit: exp630: pair hevc replay cadence with deeper gate
631	104.17	discard	MacDisplayKit=f060bbd8007e4832d7575aecadbb28639d09b239	MacDisplayKit: exp631: pair deeper hevc gate with prores trim
632	104.17	discard	MacDisplayKit=f91226f8a116bcd0fba0c3325a32509fccfe322a	MacDisplayKit: exp632: retune hevc replay gate midpoint
633	104.17	discard	MacDisplayKit=e341c56da67d68a796113bbb9867b9473989db65	MacDisplayKit: exp633: pair midpoint gate with prores trim
634	104.38	discard	MacDisplayKit=50dc78ad84b841cc165b0c672849867325c76dce	MacDisplayKit: exp634: soften hevc replay gate relaxation
635	104.17	discard	MacDisplayKit=51085a456aacb7d8a15d0ba3a59f1465e13d1741	MacDisplayKit: exp635: pair softer hevc gate with prores trim
636	104.38	discard	MacDisplayKit=c453a8da91bcb610613a7fdb39d9274f639ec364	MacDisplayKit: exp636: pair softer gate with prores trim
637	104.17	discard	MacDisplayKit=84e3d1622fa1d93b44e2161508caa29e200a608c	MacDisplayKit: exp637: pair hevc replay cadence with softer gate
638	101.46	discard	MacDisplayKit=b46c025fcf6aafc892eb692d5b64132727b41fda	MacDisplayKit: exp638: tighten hevc replay timer leeway
639	104.17	discard	MacDisplayKit=6d98e5f638fe9b6bcdf83b0e578fef377e60b5e3	MacDisplayKit: exp639: retune hevc replay cadence to 147hz
640	104.17	discard	MacDisplayKit=b896b144f04656aa2cbc22de8570f0f35506ff96	MacDisplayKit: exp640: retune hevc replay minimum delta to forty nine sixty fourths
641	104.17	discard	MacDisplayKit=970679159135c23e86fdc1963b02f5b7707dbd0c	MacDisplayKit: exp641: retune hevc replay minimum delta to forty three sixty fourths
642	101.04	discard	MacDisplayKit=5d2fb9136998ec8da4fe1a0884fcdd0fc4383a07	MacDisplayKit: exp642: require extra tick for replay minimum delta
643	101.67	discard	MacDisplayKit=58cbae0e78ee73d0d073d26cce39b2dca59e8f14	MacDisplayKit: exp643: relax hevc replay timer leeway slightly
644	103.12	discard	MacDisplayKit=10f645a6003a19e69e7a8b60ed34ebb305abf7ac	MacDisplayKit: exp644: split skylight source state from delivery
645	103.75	discard	MacDisplayKit=19ceea37640c2c8877c2c0ed349f14ee3ded1af0	MacDisplayKit: exp645: prioritize split skylight source queues
646	103.75	discard	MacDisplayKit=9f0168efcda57ec81ddeecb88a2cc3443b9bcbab	MacDisplayKit: exp646: prioritize split skylight queues without autorelease
647	103.96	discard	MacDisplayKit=3a1f67fe10b3b9fda9f7e024c71d29500f9b5263	MacDisplayKit: exp647: add autorelease to moderate state split
648	102.08	discard	MacDisplayKit=e1deae261d3358b3999d01b79ba8b7fa25c465be	MacDisplayKit: exp648: pair source saturation suppression with async submit accounting
649	102.29	discard	MacDisplayKit=f78b1deaacd818ff2beb74d9150343425e6a84f3	MacDisplayKit: exp649: skip hevc dirty-rect decode when diagnostics are off
650	101.46	discard	MacDisplayKit=9a03694c1a649b7983acf71fc7600f1baed691ce	MacDisplayKit: exp650: suppress hevc source saturation events
651	101.67	discard	MacDisplayKit=49aead213e3fc43caad3be2dee1eaed041b088fb	MacDisplayKit: exp651: decode dirty rects only for fresh frames
652	101.46	discard	MacDisplayKit=9bf3a5de053f085449563d2e8cb10008cf6fee84	MacDisplayKit: exp652: step synthetic replay timestamps
653	101.46	discard	Lumen=37283d500357f2f0595dd9b410bd55f1e68e0221	Lumen: exp653: keep overlay prores input auto
654	104.38	discard	MacDisplayKit=864eccda063ddd114fee7610d3e8ce01197290a7	MacDisplayKit: exp654: retune hevc replay cadence to 145hz
655	104.17	discard	MacDisplayKit=206f18a023c0e6cce4ebae0ebb1ec1aa74635a4b	MacDisplayKit: exp655: pair 145hz replay cadence with source trim
656	104.17	discard	MacDisplayKit=509ec9eaf63dc52282c283178c49bb25b75d55ad	MacDisplayKit: exp656: pair softer replay gate with source trim
657	104.17	discard	MacDisplayKit=32971d7cb657de0a982befee13ee46753a8e0a50	MacDisplayKit: exp657: pair 145hz cadence with source drop trim
658	104.17	discard	MacDisplayKit=0420b94b832706ac5e1e0e155cec1b7c046d066d	MacDisplayKit: exp658: pair softer gate with source drop trim
659	101.25	discard	MacDisplayKit=c44b578231f561e23b0c501b87c8fd549f7dc880	MacDisplayKit: exp659: relax vt startup replay warmup
660	101.88	discard	MacDisplayKit=2b5b0de28667d3ce6a1c55d27097adda1453e32e	MacDisplayKit: exp660: pair startup warmup with source drop trim
661	104.17	discard	MacDisplayKit=46ec5bd1d8c2bf586c082034bcf5c7a6f47e0c7f	MacDisplayKit: exp661: pair 11/16 gate with source drop trim
662	101.46	discard	MacDisplayKit=a719259c7a533b19ee293cb06da4e1b3e5921671	MacDisplayKit: exp662: relax hevc realtime frame-rate cap
663	101.67	discard	MacDisplayKit=42d3ac37ea0079c49faa2c62940b2dab6956ddaa	MacDisplayKit: exp663: soften hevc expected frame-rate hint
664	101.67	discard	MacDisplayKit=930b4352d867d0d2f0225fa1c8e651a40d519970	MacDisplayKit: exp664: restore startup-only hevc frame delay tightening
665	104.17	discard	MacDisplayKit=469d2787d90aa57258652e4c929e542e72deb507	MacDisplayKit: exp665: pair exp566 with 11/16 replay gate
666	101.25	discard	MacDisplayKit=9fce53d0e1ec3f3e42baeda416bd0c929155025c	MacDisplayKit: exp666: trim hevc source drop metadata
667	104.17	discard	MacDisplayKit=44ab0b7a6fa9509ad93cd85eeb028673351da32b	MacDisplayKit: exp667: trim hevc dirty rect metadata
668	25.0	discard	MacDisplayKit=a618960ec0b6fb0684cbd717acc413196e6acb59	MacDisplayKit: exp668: trim hevc source metadata
668	25.0	discard	MacDisplayKit=a618960ec0b6fb0684cbd717acc413196e6acb59	MacDisplayKit: exp668: trim hevc source metadata
669	25.0	discard	MacDisplayKit=cb2aedf1ad0dbf8facdc6995279b9c47d7271e85	MacDisplayKit: exp669: decouple hevc expected hint from cap
669	25.0	discard	MacDisplayKit=cb2aedf1ad0dbf8facdc6995279b9c47d7271e85	MacDisplayKit: exp669: decouple hevc expected hint from cap
670	25.0	discard	MacDisplayKit=0926c5d96d8626b171b4bee43825964457d52220	MacDisplayKit: exp670: soften hevc vbv initial delay clamp
670	25.0	discard	MacDisplayKit=0926c5d96d8626b171b4bee43825964457d52220	MacDisplayKit: exp670: soften hevc vbv initial delay clamp
671	25.0	discard	MacDisplayKit=21e131924d9aa617ca277192372928843c1e6f2c	MacDisplayKit: exp671: add mild hevc vbv buffer clamp
671	25.0	discard	MacDisplayKit=21e131924d9aa617ca277192372928843c1e6f2c	MacDisplayKit: exp671: add mild hevc vbv buffer clamp
672	102.08	discard	MacDisplayKit=539988dea154d8c8eb83f4aa87a40fcb794f7c91	MacDisplayKit: exp672: narrow startup-only hevc frame delay tightening
673	103.05	discard	MacDisplayKit=6a40f3f153e27108e2b305cff7c91917e4fa9c41	MacDisplayKit: exp673: narrow hevc reference buffer drop
674	101.88	discard	MacDisplayKit=e6cbd27916ba02fe9e09487c90809a6a7db2ae65	MacDisplayKit: exp674: narrow hevc temporal compression disable
675	103.96	discard	MacDisplayKit=c450bcf38c8cfb973a9c52ac464bccee1899840e	MacDisplayKit: exp675: pair replay gate with ref trim
676	103.75	discard	MacDisplayKit=89060ba3e6382b8d487d60cf835db52330fa2792	MacDisplayKit: exp676: pair replay gate with startup tighten
677	95.7	discard	MacDisplayKit=d363b388cbbb855c0bf900246493cbb5c51208ed	MacDisplayKit: exp677: pair replay gate with dirty rect trim
678	25.0	discard	MacDisplayKit=e8b3ce6139bb43f56603b66c4ddec4fd9f34b45f	MacDisplayKit: exp678: soften hevc realtime frame-rate cap
679	94.92	discard	MacDisplayKit=86670ddcd991eb0ff74639a6bf7998257c5175a8	MacDisplayKit: exp679: decouple hevc expected duration hint
680	103.32	discard	MacDisplayKit=37890651c531b22e56d816dac0d68582faf6c855	MacDisplayKit: exp680: cache skylight capture surfaces
681	103.96	discard	MacDisplayKit=b611c1ef99c48df4ce9a3bc46d2f02d1d5ad026a	MacDisplayKit: exp681: pair surface cache with replay gate
682	103.82	discard	MacDisplayKit=adc839c4ea58f101d066b7f1820ff5ee58a4aeac	MacDisplayKit: exp682: pair surface cache with ref trim
683	103.96	discard	MacDisplayKit=420830958fbf29d23187745ec5687d238a396772	MacDisplayKit: exp683: pair cache gate with ref trim
684	92.66	discard	MacDisplayKit=4b452c4152ebd43587bc545575e3a98f1e8747e0	MacDisplayKit: exp684: pair cache gate with drop trim
685	25.0	discard	MacDisplayKit=237c4678c0e0f4282560229f852e74a80fb76222	MacDisplayKit: exp685: pair cache with 145hz replay
686	103.75	discard	MacDisplayKit=75368371097ed64571909e31bfaba6325b674f1c	MacDisplayKit: exp686: pair cache with softer gate
687	104.38	discard	MacDisplayKit=596513b14d0c6d36615fec5663a5a0c8ea8fb00a	MacDisplayKit: exp687: pair cache with softer gate
688	101.46	discard	MacDisplayKit=9e6e98291131cae3d552c104e4e409683e0d302a	MacDisplayKit: exp688: pair vt warmup with bookkeeping
689	102.71	discard	MacDisplayKit=c1fce30e7f736482843f2e74e9c43854e22ed4c6	MacDisplayKit: exp689: suppress hevc saturation events
690	104.17	discard	MacDisplayKit=008c1a9d44a6e90907b60a32a340be5964e2894c	MacDisplayKit: exp690: widen hevc source texture cache
691	104.38	discard	MacDisplayKit=3e146f65bce7f702954fc1d91ef2179fbb768ba1	MacDisplayKit: exp691: split cursor texture cache
692	104.17	discard	MacDisplayKit=33423b2b3052eee3685806d86535502671710ab3	MacDisplayKit: exp692: align hevc presentation pacing
693	104.17	discard	MacDisplayKit=16a1cb4a7b52179f512b791b0b0b2b230c006691	MacDisplayKit: exp693: reuse repeated skylight surfaces
694	104.17	discard	MacDisplayKit=abbb90054ba4251d9589eaba29bfd97e7732cb10	MacDisplayKit: exp694: set hevc submit duration
695	104.17	discard	MacDisplayKit=fe263e956045ed6562fcc068d607ff2e10f77d09	MacDisplayKit: exp695: memoize direct hdr attachments
696	104.17	discard	MacDisplayKit=9b4148deb3d4829e754bff84dd32e8a406b78ced	MacDisplayKit: exp696: release direct source before submit
697	103.77	discard	MacDisplayKit=1aa80d248195d79c0f5ca27ee8724e7449d204d9	MacDisplayKit: exp697: trim replay wrapper churn
698	104.38	discard	MacDisplayKit=53b607b32408fe44d8a750677a19a145df5d2d82	MacDisplayKit: exp698: tighten hdr hevc pending budget
699	98.0	discard	MacDisplayKit=2b0c1f5f51625c63e46189d3578adfdf50ec40eb	MacDisplayKit: exp699: scope encode autorelease to pq hevc
700	104.38	discard	MacDisplayKit=1a26b63532f5d80223aa64b21c34a3bd606e330d	MacDisplayKit: exp700: raise mailbox continuation priority
701	104.17	discard	MacDisplayKit=540366bf92033da1322c338bbd6c79d7136a3afe	MacDisplayKit: exp701: default hevc power hint
702	104.17	discard	MacDisplayKit=25a5cb7274dbf9168569f4701080d1eddd997ae2	MacDisplayKit: exp702: trim callback cadence diagnostics
703	104.17	discard	MacDisplayKit=4400716a1bcc08a7b69691cbe056327677a99930	MacDisplayKit: exp703: default hevc profile level
704	95.21	discard	MacDisplayKit=b554df0b98151cc758a87ca5481958aea6cf547d	MacDisplayKit: exp704: reopen hevc low-latency mode
705	25.0	discard	Lumen=51e5ccc02c3d3dfd59acaaae43c878ae91b6c72c	Lumen: exp705: keep tiny hevc overflow tail
706	104.38	discard	MacDisplayKit=a91a2cbac1c8da686c12c6b94c92b1b51fe6abbc	MacDisplayKit: exp706: limit hevc submit duration to direct frames
707	104.17	discard	MacDisplayKit=98ac4aead93d17d2499dccdcda1ce0e7d7e64e7e	MacDisplayKit: exp707: async direct submit accounting
708	104.17	discard	MacDisplayKit=7ee27a4c78074eece48d07407b8c0b11ee088702	MacDisplayKit: exp708: async direct success accounting
709	102.71	discard	MacDisplayKit=8ea0ebfe94bd560c3324d529fc88b57a5d9d6380	MacDisplayKit: exp709: skip prores keyframe replay
710	104.38	discard	MacDisplayKit=9ea34a9859b52a2e0859a374c0e4b89af20a5b72	MacDisplayKit: exp710: drop staged slot release hop
711	103.96	discard	MacDisplayKit=5554f20f6033f9fa33e24a731edfa02a41e07d48	MacDisplayKit: exp711: use unfair pending tracker
712	102.92	discard	MacDisplayKit=fc4fe9e81bbbb5da260f7d1ed0d3aa84d0289f51	MacDisplayKit: exp712: prewrap skylight replay surface outside lock
713	104.17	discard	MacDisplayKit=52b2e095986935e497f8cd13d7ec8abcd93aa4a7	MacDisplayKit: exp713: retune hevc replay cadence to 145hz
714	33.11	discard	MacDisplayKit=51547d5b45e30b17d3cdcf09618811c0576b9264	MacDisplayKit: exp714: deepen hevc replay minimum delta relaxation
715	103.96	discard	MacDisplayKit=21bce24d82520b1535de4917868e9053a7e97db5	MacDisplayKit: exp715: relax hevc replay minimum delta
716	104.27	discard	MacDisplayKit=3cf3d927a7cd04ee72fed23d8bafb7b48d700a94	MacDisplayKit: exp716: tighten hdr hevc pending budget
717	103.51	discard	MacDisplayKit=d00a682a3c3404a2cddacc7e7398ab57fa59c460	MacDisplayKit: exp717: use work-item autorelease on vt encode queue
718	25.0	discard	MacDisplayKit=e14bd5b8fa421164391067de07b1967479526c4e	MacDisplayKit: exp718: cache skylight capture surfaces
719	76.04	discard	MacDisplayKit=25c1e329ad7445299a2e876ec3af864660fff62a	MacDisplayKit: exp719: restore default hevc vbv initial delay
720	103.74	discard	MacDisplayKit=c71bb040ad8c94ade86acc9385727838ed3ffa25	MacDisplayKit: exp720: disable hevc end reserve hint
721	104.17	discard	MacDisplayKit=8d2b8e389ebda8938ccfc466f50e166e256a118e	MacDisplayKit: exp721: make vt submitted-frame accounting async
722	104.38	discard	MacDisplayKit=27b1928901098fad7ea75e623e8e13312e9aeebb	MacDisplayKit: exp722: raise mailbox continuation priority
723	102.21	discard	MacDisplayKit=946c3b7c67238f9ca2cc129ad1e4a4bd106e531a	MacDisplayKit: exp723: drop hevc source frame diagnostics
724	103.37	discard	MacDisplayKit=59a74cbe4d3ec3d12ae79f759218c055c1f4bf7e	MacDisplayKit: exp724: drop hevc source frame diagnostics
725	102.42	discard	MacDisplayKit=af03df9e72c2c50521c79ed05bc0fb4945e4c80f	MacDisplayKit: exp725: enable hevc vbv buffer on 240hz path
726	104.38	discard	MacDisplayKit=b1183087a484323a6e65361df7dea1dae288689d	MacDisplayKit: exp726: pair hevc realtime ceiling with target duration
727	100.47	discard	MacDisplayKit=79a8471aedd582e7a0bde62a64910228618ce017	MacDisplayKit: exp727: relax vt startup replay warmup
728	102.68	discard	MacDisplayKit=88cf7baf65faddf5df11d0c69b4096ad8f8f898c	MacDisplayKit: exp728: split cursor texture cache
729	102.76	discard	MacDisplayKit=13c57d734f6b66a5e0e93bd2fd78cb818577f8a6	MacDisplayKit: exp729: collapse vt bookkeeping queue hops
730	103.75	discard	MacDisplayKit=084a60041e4ac49000a2e2bb297c8bfe7c4695f5	MacDisplayKit: exp730: prewrap skylight surfaces for unfair replay lock
731	102.24	discard	MacDisplayKit=fcc9067b5a0ad6df74bf46310fe55351e7e5eba5	MacDisplayKit: exp731: time the hevc proxy prime for 120hz
732	102.91	discard	MacDisplayKit=0c21e9e4336018ca238ece6239df795b62e863c5	MacDisplayKit: exp732: drop staged slot release hop
733	102.56	discard	MacDisplayKit=9359b3cea280edd5139b1e1d9a29b739c174d7b6	MacDisplayKit: exp733: limit hevc submit duration to direct frames
734	102.76	discard	MacDisplayKit=4820545b9c3e74b50aad3b3e4b56ca7cb4d3c59b	MacDisplayKit: exp734: cache skylight capture surfaces
735	102.97	discard	MacDisplayKit=0bd1cdb594590c84a77f69008e10795828b50dcc	MacDisplayKit: exp735: gate hevc startup replay on vt parallelism
736	99.94	discard	MacDisplayKit=25e152f35546408a8d1cbb5a8795c31cfe3d88bd	MacDisplayKit: exp736: pair hevc replay gate with prores callback trim
737	104.17	discard	MacDisplayKit=605f69a2d8f696cd5c73fb21b703d054d3fa2f6d	MacDisplayKit: exp737: soften hevc replay gate relaxation
738	25.0	discard	MacDisplayKit=8647556dc7f33a8d5019fa535a261630e4e2d600	MacDisplayKit: exp738: pair softer gate with prores trim
739	100.86	discard	MacDisplayKit=78aa0280d0f56cb49c2070ef872cc17d71a590cb	MacDisplayKit: exp739: pair cache with softer gate
740	97.55	discard	MacDisplayKit=edb88f3a6284fb3d7d28bb3893bf34a5172635b2	MacDisplayKit: exp740: raise hevc replay cadence slightly
741	99.43	discard	MacDisplayKit=3b9dda1c27f346da5c59346a4c69ba04319238e5	MacDisplayKit: exp741: pair hevc replay gate with source trim
742	102.71	discard	MacDisplayKit=f1f971af575382f739fddb8dd22548decafdf0f3	MacDisplayKit: exp742: pair hevc startup replay gate with source trim
743	51.0	discard	MacDisplayKit=43d9dae0232c04b95ce7f3170e06154403ffa435	MacDisplayKit: exp743: defer hevc proxy prime past startup
744	104.38	discard	MacDisplayKit=4c52714315787560ff5e8a824e6f800a26d2f270	MacDisplayKit: exp744: lower hevc realtime ceiling to 180hz
745	104.17	discard	MacDisplayKit=6c89835b0449dcd6d863115cd31356523c35a97a	MacDisplayKit: exp745: use unfair lock for pending tracker
746	87.5	discard	MacDisplayKit=0518a5eea2946c20a0d91edded9fbada962810c0	MacDisplayKit: exp746: pair hevc target duration with relaxed burst
747	104.38	discard	MacDisplayKit=d48d449df72336405191660a4d2b3dda81354dcf	MacDisplayKit: exp747: pair submit accounting with encode autorelease
748	104.17	discard	MacDisplayKit=d507edd15088db83051ef3b1f54f546bfe3bd08e	MacDisplayKit: exp748: set hevc realtime ceiling to 210hz
749	106.04	keep	MacDisplayKit=3ed1c8de178fef078ec58b0bd2dcb6b837837d3e	MacDisplayKit: exp749: set hevc realtime ceiling to 225hz
750	104.17	discard	MacDisplayKit=1f838b9a6cb72eaf2372e4650ae292d9df1647d6	MacDisplayKit: exp750: set hevc realtime ceiling to 230hz
751	104.38	discard	MacDisplayKit=45561b997370570a77d8f195b0d462b1832e2eb4	MacDisplayKit: exp752: restore hevc realtime ceiling to 240hz
752	104.17	discard	MacDisplayKit=ae4206ed825bce3ed824488b32c30305eb0171bc	MacDisplayKit: exp752: drop source diagnostics on high-refresh callback encode
753	98.23	discard	MacDisplayKit=0cc78edffd7d0a74bcc9226a1bcc64ae4111cf89	MacDisplayKit: exp753: cap prores bootstrap at 120hz q2
754	104.38	discard	MacDisplayKit=d5f196d0d62561d13fa51de01c6c787341469f2e	MacDisplayKit: exp754: cap prores realtime ceiling at target fps
755	104.38	discard	MacDisplayKit=91f223b42cb3d81118f5e07768e36ee58cebd484	MacDisplayKit: exp755: keep hevc recovery replay zero-copy
756	104.17	discard	MacDisplayKit=d36b63f1fb543b1f53388b303a383e42ba0c6e72	MacDisplayKit: exp756: require fresh hevc recovery frames
757	104.17	discard	MacDisplayKit=9efb7d07e14a084595564404dc9048fcf88f8b67	MacDisplayKit: exp757: skip hevc replay scheduling on keyframe request
758	104.38	discard	MacDisplayKit=fc4aca5ed67a463d8dcc26d1479fcca31b37293e	MacDisplayKit: exp758: skip hevc direct submit success sync
759	104.38	discard	MacDisplayKit=80a294fd531579fc82b98d5dc7c0f2c6af90d13e	MacDisplayKit: exp759: narrow hevc direct buffer cache to one surface
760	104.17	discard	MacDisplayKit=3c153a298792a47edd291643c6afabc30338cf0b	MacDisplayKit: exp760: bypass hevc direct wrapper cache
761	104.38	discard	MacDisplayKit=c21dc5ef2bb6d200fdf5964809f984323de5b835	MacDisplayKit: exp761: align prores source candidates with hevc
762	98.0	discard	MacDisplayKit=4339e627157b45261c6f00feb42334b0535fffe9	MacDisplayKit: exp762: switch prores capture to native 10-bit 422
763		crash	MacDisplayKit=18159782a8a52331a5912e6585bc86e7fd20c6f0	MacDisplayKit: exp763: align hevc and prores capture format
764	25.0	discard	MacDisplayKit=0d3d7d1d092acc325f3c80cf2b82614416313d04	MacDisplayKit: exp764: align prores capture seam with hevc
765	104.38	discard	MacDisplayKit=70d433a25ebf72aee55ef9e02a918d444b7b86db	MacDisplayKit: exp765: allow prores direct zero-copy submit
766	104.17	discard	MacDisplayKit=9df9d418406dc2f0f00441a16be3865b6162cf65	MacDisplayKit: exp766: tighten skylight callback pending budget
767	104.38	discard	MacDisplayKit=4ad54a1b70974bd2c0a756f2e4f7b8d87dce1422	MacDisplayKit: exp767: zero hevc frame delay at 120fps
768	104.17	discard	MacDisplayKit=6878ddc8c42a87571be694fe2cbf1ef065daf946	MacDisplayKit: exp768: tighten hevc hdr staging backlog
769	104.17	discard	MacDisplayKit=3a513174ce4cc05800f61e913e1cdd3747a2cf08	MacDisplayKit: exp769: align hevc expected rate with realtime ceiling
770	104.17	discard	MacDisplayKit=b5d701572988b8ae31d5cf0c994b04d9bc87a57f	MacDisplayKit: exp770: cap hevc staging by vt parallelism
771	104.17	discard	MacDisplayKit=208c9c4a99ba82fbe68cce5f3cd1e8f7a25a8959	MacDisplayKit: exp771: keep hevc texture cache warm
772	104.38	discard	MacDisplayKit=0eb99e4f026b5e67def5f3f9ef1a1e3df1b55388	MacDisplayKit: exp772: align hevc pts with realtime ceiling
773	104.17	discard	MacDisplayKit=9ea38c68aae957d99eb6059c50d3baf2a485742d	MacDisplayKit: exp773: lazy-init hevc metal helpers
774	104.38	discard	MacDisplayKit=1207a3ab643a2736a9b1859bff83ace13f3142cb	MacDisplayKit: exp774: skip hevc descriptor rebuilds on cache hits
775	104.38	discard	MacDisplayKit=708282cd1f0c43b2f8ad7e1cd12ba4dacab2a05d	MacDisplayKit: exp775: reuse hevc plane descriptors on cache miss
776	104.38	discard	MacDisplayKit=1e87027aa60b468420287a792ec07f93fcd2a752	MacDisplayKit: exp776: cache encoded frame hdr inspection
777	104.17	discard	MacDisplayKit=cb19ace276c2d668ab86f6844699ff0300f8c5bd	MacDisplayKit: exp777: skip redundant hdr payload scans
778	104.38	discard	MacDisplayKit=c180434fa5a698fb3c52b9b8140fe2119ded53c7	MacDisplayKit: exp778: defer hevc hdr keyframe checks
779	104.38	discard	MacDisplayKit=005dd67ab6e293843c09a062c32c468d222ea589	MacDisplayKit: exp779: avoid copying hevc metadata probes
780	104.38	discard	MacDisplayKit=0d6638ae9fd347ebe117635be89946b98f5b5f43	MacDisplayKit: exp780: decouple vt counters from submit path
781	104.38	discard	MacDisplayKit=93ec2c0a75e45f3c3fbc5f1914820127832ff5ad	MacDisplayKit: exp781: defer vt callback frame assembly
782	104.17	discard	MacDisplayKit=1b91fa258cb10f007104f2a09d3c178f8b6fc99f	MacDisplayKit: exp782: skip redundant hdr buffer attachments
783	104.38	discard	MacDisplayKit=a3f64b5d6bb23b3ab3980d1516c8f7c0f6e225bd	MacDisplayKit: exp783: drop replay pixel buffer wrapper
784	104.17	discard	MacDisplayKit=472b5184bd5d6e1e7737e7af7c694254926b8391	MacDisplayKit: exp784: use mach ticks for vt latency
785	104.17	discard	MacDisplayKit=7747387b4c208f6dd828f371bd2960eba9308b9b	MacDisplayKit: exp785: pool vt submission tokens
786	104.17	discard	MacDisplayKit=8efea8f34a7b8e5f59bb98dd606d76e4b20a5079	MacDisplayKit: exp786: reuse force-keyframe properties
787	104.17	discard	MacDisplayKit=25f98c514774e999f2dd04f2275b3f90323719f9	MacDisplayKit: exp787: gate replays by local pending count
