experiment	commit	metric	status	description
1102	104.38	discard	MacDisplayKit=e30183307daf35153578d91fb2ddcfddad638674	MacDisplayKit: exp1102: decouple hdr source texture cache
1103	104.17	discard	MacDisplayKit=8914540fb402269e34538874c30091c87034ce08	MacDisplayKit: exp1103: relax hdr replay suppression threshold
1104	104.17	discard	MacDisplayKit=f9bc29f8fdda8982135fcf7ad2b982789154961d	MacDisplayKit: exp1104: evict hdr source textures incrementally
1105	104.38	discard	MacDisplayKit=01a1510e5e0ce4b134ed0e1cffb20aca2785b513	MacDisplayKit: exp1105: relax hdr staging cap to five
1106	104.17	discard	MacDisplayKit=7829c6dbc4f094ee8a3b75151aa55f87d7a67f50	MacDisplayKit: exp1106: raise hevc realtime ceiling to 226hz
1107	104.17	discard	MacDisplayKit=20dfa53cc91ed23cac6dcc6f807006a5718072bd	MacDisplayKit: exp1107: raise hevc realtime ceiling to 227hz
1108	104.17	discard	MacDisplayKit=2a9c545f2e1c3c327a89f72151030941a4512d50	MacDisplayKit: exp1108: ease hevc expected cadence to 232hz
1109	104.17	discard	MacDisplayKit=70a8141ad6e11d8262e558f3e9e1c4cb3c5ea3c2	MacDisplayKit: exp1109: deepen hdr source texture cache
1110	104.38	discard	MacDisplayKit=8971fd5c2c3d1656af9a5f67131112ad69cc4e05	MacDisplayKit: exp1110: keep only the latest hdr wrapper
1111	104.38	discard	MacDisplayKit=8e6b8122a1fefe630e09f6cbf4693aadb83e9627	MacDisplayKit: exp1111: benchmark raw hevc pq bootstrap live
1112	104.17	discard	MacDisplayKit=4de4e7b9ec44d5923bdbe359e582d919f69060e6	MacDisplayKit: exp1112: set hdr raw pending budget to five
1113	104.38	discard	MacDisplayKit=dc9861dd139feeafcfeda5fa85287020a2da78db	MacDisplayKit: exp1113: lengthen live pq bootstrap benchmark
1114	104.17	discard	MacDisplayKit=0789862e2c268517eb97071fd59b701a39cc21a2	MacDisplayKit: exp1114: widen hevc short burst window
1115	72.92	discard	Lumen=a057f164f34ae20d691d01d8d37630e91137e6e1,MacDisplayKit=c4a8c3ee2c737a7f212d15f680d43f0cd9c5ec7a	Lumen: exp1115: keep overlay encode on sdr base | MacDisplayKit: exp1115: keep overlay encode on sdr base
1116	104.17	discard	MacDisplayKit=980a9463d4161d373eb2665de43b98fae2069e11	MacDisplayKit: exp1116: bypass prores bgra staging
1117	89.79	discard	Lumen=c4ecb9f1eece074fbf91b48fd0b0b5c7c59764c0,MacDisplayKit=3db99e4defe28fe99c6990d7b12a49d46d88e855	Lumen: exp1117: route overlay hevc through bgra | MacDisplayKit: exp1117: route overlay hevc through bgra
1118	104.17	discard	MacDisplayKit=449104cee0a08b97db535a6fe84e5fa746180055	MacDisplayKit: exp1118: zero hevc frame delay
1119	104.17	discard	MacDisplayKit=96cba2a94fe0db762aeb1428bb79c9632fb8ea16	MacDisplayKit: exp1119: raise large capture surface slack
1120	104.38	discard	MacDisplayKit=e72d0186beb74c58994e9b49705bd45de91a43e7	MacDisplayKit: exp1120: cap raw pq hevc staging slack to two
1121	25.0	discard	Lumen=b432fbc055f7edc74d3af4d288ed44070b1d9ff9	Lumen: exp1121: autotune raw partial hdr hevc source
1122	104.17	discard	MacDisplayKit=f60a89419a5ad76692a7436f85b748fdfbd2b032	MacDisplayKit: exp1122: cap raw hdr hevc pending budget at three
1123	104.17	discard	MacDisplayKit=aed2c22fc857a4baf5952e28fa413843c935da45	MacDisplayKit: exp1123: cap raw pq hevc staging slack at one
1124	104.38	discard	Lumen=ccddb11b6ef8b065e8693790ddbe8d77cddca047	Lumen: exp1124: avoid duplicate hevc ingress sample retention
1125	104.17	discard	Lumen=dad4b332a1b05e4d6ff6c488301eecde9ade5bac	Lumen: exp1125: defer high-refresh hevc bridge forwarding
1126	104.17	discard	MacDisplayKit=27ee440bb5b7ebc89e4cac9a85f7814922b1838c	MacDisplayKit: exp1126: cache static hdr attachment payloads
1127	104.17	discard	MacDisplayKit=9534223a9bbe72cd1be649c4425a6acd3717a3a0	MacDisplayKit: exp1127: cache hevc hdr prefix sei
1128	104.17	discard	Lumen=cdd747afdf8ccde70c71075b8fa7bb7acb579fbd	Lumen: exp1128: reuse bridge callback frame flags
1129	104.17	discard	MacDisplayKit=c4a12b28c60f8d993b0432a9623325d870281bb4	MacDisplayKit: exp1129: freeze hevc replay source during backlog
1130	104.38	discard	MacDisplayKit=d510a2a3cc79d3ea11a8fb8ba895c24599368957	MacDisplayKit: exp1130: widen raw prores callback budget
1131	104.38	discard	MacDisplayKit=e6f5c0c08e58dfd317e20d37fb6dfe6b1c7d762f	MacDisplayKit: exp1131: widen raw prores callback budget further
1132	104.38	discard	MacDisplayKit=aef46605813a6f20aec55fb487031e92f3440205	MacDisplayKit: exp1132: disable raw prores source diagnostics
1133	104.17	discard	MacDisplayKit=cb85d9bc98060d8a2202d156cbdb5a965eda59b2	MacDisplayKit: exp1133: release prores budget before mailbox drain
1134	104.38	discard	MacDisplayKit=0f4e869521a07db416b9fd51ac4f58eb459e011d	MacDisplayKit: exp1134: widen raw prores mailbox to two
1135	104.17	discard	MacDisplayKit=cb2ab230b6221061f7f7511e019eacf34fb525a0	MacDisplayKit: exp1135: cap raw prores staging residency
1136	104.17	discard	MacDisplayKit=d94bacd73a7e1987a452f2fae19e34fcac8cc00a	MacDisplayKit: exp1136: widen raw prores mailbox to three
1137	104.17	discard	MacDisplayKit=ec862fb92190d99bb23269b2e665e109a185c861	MacDisplayKit: exp1137: coalesce raw prores mailbox replacements
1138	104.38	discard	MacDisplayKit=b9ee1a8064465e8f410709288d9b5b49a3befcd6	MacDisplayKit: exp1138: prefer legacy q3 for raw prores bootstrap
1139	104.17	discard	MacDisplayKit=34e7024f0742d9b4ebd5d04f4f3417cef5266867	MacDisplayKit: exp1139: prefer q4 for raw prores bootstrap
1140	104.38	discard	MacDisplayKit=4b669fe11a8e48bc33fb2dc90142e3c8098cc061	MacDisplayKit: exp1140: prefer q8 for raw prores bootstrap
1141	104.17	discard	MacDisplayKit=200532c95467dafe4100647b424b8e7167b59776	MacDisplayKit: exp1141: prefer q1 for raw prores bootstrap
1142	104.17	discard	MacDisplayKit=5f911e3e1c0bca948293ef17566214d7c1ff42f8	MacDisplayKit: exp1142: prefer legacy request for raw prores bootstrap
1143	104.38	discard	MacDisplayKit=ecb12bbc44c131b91f7351591616331f2d80d86e	MacDisplayKit: exp1143: prefer 240hz q8 for raw prores bootstrap
1144	104.17	discard	MacDisplayKit=b6930e468ccb3fd8f24f814a3e5fda56513f339a	MacDisplayKit: exp1144: honor raw prores bootstrap ordering
1145	104.38	discard	MacDisplayKit=64b026c7e1c827fb11a0660415e25ccb8d3e5dd5	MacDisplayKit: exp1145: use q3 raw prores bootstrap
1146	104.17	discard	MacDisplayKit=8509fee0f97d413a92c13a205160c6fa72fb089a	MacDisplayKit: exp1146: use q8 raw prores bootstrap
1147	104.38	discard	MacDisplayKit=0ab39ce2bd49c326ab29116f21759c4d560cf9c8	MacDisplayKit: exp1147: use legacy q3 raw prores bootstrap
1148	104.17	discard	MacDisplayKit=86766d1a6b355a7d50e683ece1b5556b7c9054fc	MacDisplayKit: exp1148: widen raw prores pending slack to eleven
1149	104.17	discard	MacDisplayKit=720316f6dee2693a3c880f84435816d37c7bed66	MacDisplayKit: exp1149: use legacy request raw prores bootstrap
1150	104.38	discard	MacDisplayKit=20749605ea6e2d6a389f656cc1120ec6cdfd631f	MacDisplayKit: exp1150: widen raw prores mailbox to four
1151	104.38	discard	MacDisplayKit=a72daaaf90aa779a3b9ce7c4d44a2c51655fe7b6	MacDisplayKit: exp1151: widen raw prores mailbox to five
1152	104.38	discard	MacDisplayKit=310bd141540d356452c0ffd83938efc1174ca396	MacDisplayKit: exp1152: widen raw prores mailbox to six
1153	104.38	discard	MacDisplayKit=3e5a54edfbd7f5b3f42b9a5fd7a79e5903edd66d	MacDisplayKit: exp1153: widen raw prores mailbox to seven
1154	104.38	discard	MacDisplayKit=be2eca8f04740ac8bad16d5fa039043632268726	MacDisplayKit: exp1154: widen raw prores mailbox to eight
1155	104.17	discard	MacDisplayKit=2244a92ff7d75313cb595d70689ab3a805a7f0ce	MacDisplayKit: exp1155: lower hevc low-latency ceiling to 191mbps
1156	104.17	discard	MacDisplayKit=c819965361f1ef9c62a6b581e2c3390635adeb6d	MacDisplayKit: exp1156: soften hevc one-second burst window slightly
1157	104.38	discard	MacDisplayKit=978c53eb57bfad4d3487700e87bb152ce17db291	MacDisplayKit: exp1157: lower hevc low-latency ceiling to 190mbps
1158	104.38	discard	MacDisplayKit=3fa3689d0d2a141fb7b4164c7bdd693437a246fe	MacDisplayKit: exp1158: lower hevc low-latency ceiling to 189mbps
1159	104.17	discard	MacDisplayKit=6049d855ce9cb8958ccbc6f5d26fccdeffbcb4b9	MacDisplayKit: exp1159: lower hevc low-latency ceiling to 188mbps
1160	104.38	discard	MacDisplayKit=062822b8d4d883668f1bd9e7a3175719b0ef8fd2	MacDisplayKit: exp1160: tighten hevc quarter-second burst window
1161	104.17	discard	MacDisplayKit=6e00f117ea8313f0801a9fb75f1dfaf570fbb4df	MacDisplayKit: exp1161: tighten hevc quarter-second burst window further
1162	104.17	discard	MacDisplayKit=1743908075355d900ed33546e9f66d305c93db26	MacDisplayKit: exp1162: retune hevc quarter-second burst window midway
1163	104.38	discard	MacDisplayKit=616c6420ef35abf782ac0ea1814da6f75df23844	MacDisplayKit: exp1163: set hevc low-latency ceiling to 190.5mbps
1164	104.38	discard	MacDisplayKit=127ad7646f9d35a8f178724eac10b235bf202019	MacDisplayKit: exp1164: set hevc low-latency ceiling to 190.25mbps
1165	104.17	discard	MacDisplayKit=05cf3419098fb67bd61009f5a8059195d4490c27	MacDisplayKit: exp1165: set hevc low-latency ceiling to 190.75mbps
1166	104.38	discard	MacDisplayKit=2ffd3a639710f055e38ac3030edab43a17558396	MacDisplayKit: exp1166: set hevc low-latency ceiling to 190.375mbps
1167	104.17	discard	MacDisplayKit=1fd53d4dbe56f80f6929d0745bf02e7bf38fb428	MacDisplayKit: exp1167: set hevc low-latency ceiling to 190.625mbps
1168	104.17	discard	MacDisplayKit=17856f0c7eeef0cf6a2a287b9800516c4cb56de3	MacDisplayKit: exp1168: set hevc low-latency ceiling to 190.5625mbps
1169	104.38	discard	MacDisplayKit=d282f17fd29677106750f902dc11576fba4c335c	MacDisplayKit: exp1169: set hevc low-latency ceiling to 190.3125mbps
1170	104.17	discard	MacDisplayKit=c794383b4cf183bdbd6fd0cb4c2dd9186a431816	MacDisplayKit: exp1170: set hevc low-latency ceiling to 190.53125mbps
1171	104.17	discard	MacDisplayKit=26f3ec280656f54f1c8ef33d8b1003bb9cb4bcd7	MacDisplayKit: exp1171: set hevc low-latency ceiling to 190.4375mbps
1172	104.38	discard	MacDisplayKit=626f765ff60c2d11a76af52d634980591a85bcd4	MacDisplayKit: exp1172: set hevc low-latency ceiling to 190.40625mbps
1173	25.0	discard	MacDisplayKit=7fa19ec94c54db519c1b467a394ae380bf534938	MacDisplayKit: exp1173: set hevc low-latency ceiling to 190.421875mbps
1174	95.82	discard	MacDisplayKit=0f5e71f4b8f7694ff1c4e56e1a9df53f2e2f8579	MacDisplayKit: exp1174: set hevc low-latency ceiling to 190.390625mbps
1175	104.38	discard	MacDisplayKit=9244eae6b2bc469ef23605cf4c1ed1bbedab5b20	MacDisplayKit: exp1175: widen hevc low-latency quarter-second burst window
1176	104.17	discard	MacDisplayKit=2a80fc5e9d975eb61d0be70d2a7f6e3b95b35515	MacDisplayKit: exp1176: nudge hevc realtime ceiling to 228hz
1177	104.17	discard	MacDisplayKit=1e393d55f1ff5acce7c454aa61331d952801067b	MacDisplayKit: exp1177: nudge hevc realtime ceiling to 224hz
1178	103.96	discard	MacDisplayKit=2483363fd73a65abfd5b76e572b4bca2c5c57235	MacDisplayKit: exp1178: retune hevc pacing hint to 225hz
1179	103.96	discard	MacDisplayKit=f89e14d2642cb049a219514fbfa2590fa19c7b1d	MacDisplayKit: exp1179: stamp hevc frame duration at 240hz
1180	104.38	discard	MacDisplayKit=0d5302304907e5e767b92d8a58134a70564f7d7a	MacDisplayKit: exp1180: stamp hevc frame duration at 225hz
1181	104.17	discard	MacDisplayKit=d42baf0a60c2c44b88b3174cee9a71ba7f01a299	MacDisplayKit: exp1181: decouple hevc expected duration to 225hz
1182	104.38	discard	MacDisplayKit=53e755c31a73fa5534b55abf8943a01b1cbc7d3e	MacDisplayKit: exp1182: stamp hevc timestamps at 225hz
1183	104.38	discard	MacDisplayKit=7d4e072984606767436721f4442a73dbb8908f94	MacDisplayKit: exp1183: halve hevc keyframe duration window
1184	104.38	discard	MacDisplayKit=ee729d79e605b283549ee178f706f7a55b681f56	MacDisplayKit: exp1184: tighten hevc keyframe interval to 60
1185	104.17	discard	MacDisplayKit=64d2510e9077dd0d8e833502f47aa0d56d00e4e5	MacDisplayKit: exp1185: retune hevc keyframe interval to 90
1186	104.38	discard	MacDisplayKit=df8a2bb00f098f1b0df551c94a881b42be84ffb0	MacDisplayKit: exp1186: retune hevc keyframe duration to 0.75s
1187	104.17	discard	MacDisplayKit=5e52f95339ed9cf3d0c109df1c70890062419ae9	MacDisplayKit: exp1187: enable hevc open gop
1188	104.38	discard	MacDisplayKit=69764471ad2f06a3b99c6a9eb4bed216dd0078ac	MacDisplayKit: exp1188: enable hevc frame reordering
1189	104.38	discard	MacDisplayKit=d000ff90126f2bed476131cc161a46fb3ff5ae17	MacDisplayKit: exp1189: enable hevc power efficiency
1190	104.17	discard	MacDisplayKit=72704ee6bdd55d23368f97b33c4782970eb8566c	MacDisplayKit: exp1190: raise hevc reference buffers to 2
1191	104.17	discard	MacDisplayKit=dfb79260fbf2108bd2f255ad9e6d51a51d69fd91	MacDisplayKit: exp1191: raise hevc frame delay to 2
1192	95.42	discard	MacDisplayKit=ef582eab47164b406dbbc62d47ee4e012b37e118	MacDisplayKit: exp1192: re-enable hevc low-latency rate control
1193	104.17	discard	MacDisplayKit=aebfb2e67b4d6ac3161c6d2fa4b0e5780f7000f8	MacDisplayKit: exp1193: use startup-only hevc realtime ceiling
1194	104.17	discard	MacDisplayKit=171ec3f10234f5e0b3173feddef9ea0a72aa68c0	MacDisplayKit: exp1194: use startup-only hevc ceiling at 228hz
1195	104.17	discard	MacDisplayKit=f31b07baac8ed659b3ef53906068a4e616e42fdb	MacDisplayKit: exp1195: delay hevc steady-state ceiling by one output
1196	104.17	discard	MacDisplayKit=00954d76d7c3efdb9a95dba54368119f688eebe5	MacDisplayKit: exp1196: trim hevc startup ceiling to 226hz
1197	104.17	discard	MacDisplayKit=98643de8758b70502c9376763a090e780803da9d	MacDisplayKit: exp1197: relax startup hevc frame delay
1198	104.58	discard	MacDisplayKit=07d68b6c8c75aa9a3b021f8adccd874eb1f83993	MacDisplayKit: exp1198: tighten startup hevc gop length
1199	104.38	discard	MacDisplayKit=592b8f99c740fd263bc4903911b57ab42417de4b	MacDisplayKit: exp1199: force startup hevc keyframes
1200	104.17	discard	MacDisplayKit=4ea34bca33c28a4eb867f280c69e2eae6b770e20	MacDisplayKit: exp1200: soften startup hevc keyframe cadence
1201	104.58	discard	MacDisplayKit=227761cc4558de0abd94b59ab1dea59386267930	MacDisplayKit: exp1201: shorten startup hevc keyframe burst
1202	104.17	discard	MacDisplayKit=ace422c6012ae04f1af5cc45e78fc8e8a36c0f14	MacDisplayKit: exp1202: shorten softer startup hevc cadence
1203	104.17	discard	MacDisplayKit=e30109407cabe7f9919a00b091e1140355471c68	MacDisplayKit: exp1203: force first startup hevc keyframe
1204	104.38	discard	MacDisplayKit=9a12503b544355d8213b9801f1d692bb8a4eab9f	MacDisplayKit: exp1204: force two startup hevc keyframes
1205	104.79	discard	MacDisplayKit=772d683257a7d4c811c11d7c204eace0413f6a9a	MacDisplayKit: exp1205: extend startup hevc keyframe cadence
1206	104.58	discard	MacDisplayKit=db831190772c3dad6a8c08606e82bbe084bb4027	MacDisplayKit: exp1206: extend startup hevc cadence again
1207	104.58	discard	MacDisplayKit=98924167136c009ae7b17c0a3a4167ec65b7a974	MacDisplayKit: exp1207: stretch startup hevc cadence further
1208	104.38	discard	MacDisplayKit=10f6e5222e4328602b4438e6da33682f1feb04e8	MacDisplayKit: exp1208: tighten startup hevc keyframe duration
1209	104.17	discard	MacDisplayKit=2f7821381abc770981db88beea1f397dd646e998	MacDisplayKit: exp1209: shorten startup hevc keyframe duration
1210	104.17	discard	MacDisplayKit=9a3e8a1a2779e0942fef03042d2c84b72b8220d6	MacDisplayKit: exp1210: shorten startup hevc keyframe duration more
1211	104.17	discard	MacDisplayKit=a04324d1531be4f4cd6a47cdd85a9cecfda21452	MacDisplayKit: exp1210: ease startup hevc keyframe duration
1212	104.17	discard	MacDisplayKit=a5fd9276864ad25fca56a5f82a4bf682107e8660	MacDisplayKit: exp1212: shorten softer startup hevc duration
1213	104.38	discard	MacDisplayKit=e38aa79367594cbb59083b084bf641582869c985	MacDisplayKit: exp1213: raise hdr hevc realtime ceiling
1214	104.17	discard	MacDisplayKit=9b1adfd92578775a4cf3d12c4175f76b8f19bf05	MacDisplayKit: exp1214: align hdr hevc cadence hint
1215	104.17	discard	MacDisplayKit=40e325a0b69532a236f7aaa16741854bfd1725f0	MacDisplayKit: exp1215: tune hdr hevc cadence duration
1216	104.17	discard	MacDisplayKit=a8d556839feeef251ceaec08ea3d830cf1a49a9d	MacDisplayKit: exp1216: isolate hdr hevc cadence hint
1217	104.38	discard	MacDisplayKit=88dae3a72bf915c653dc9c5b70e93581df67cb67	MacDisplayKit: exp1217: tighten hdr hevc frame delay
1218	104.38	discard	MacDisplayKit=c2ed50df875a559717b4ea4fb74055c89aa4ea0c	MacDisplayKit: exp1218: lower hdr hevc realtime ceiling
1219	104.17	discard	MacDisplayKit=fb7d7badd5fcf0b7fd53fc692589ceeaaf0ccc50	MacDisplayKit: exp1219: disable hdr hevc temporal compression
1220	104.38	discard	MacDisplayKit=4fdcd9ee6f83f8f97e5cddab3d8b70dd1d34024c	MacDisplayKit: exp1220: apply hdr hevc quality knob
1221	96.25	discard	MacDisplayKit=20e7d0dc54466a6645d23d0ff5313d79cc4bed87	MacDisplayKit: exp1221: relax hdr hevc speed priority
1222	104.38	discard	MacDisplayKit=dc458db277533dfe51986d31ce6117912fde4903	MacDisplayKit: exp1222: soften hdr hevc bitrate profile
1223	104.17	discard	MacDisplayKit=0b486c40efeaa1f9b43f18458d4bda0c38864317	MacDisplayKit: exp1223: skip hdr hevc reference buffers
1224	104.38	discard	MacDisplayKit=d593e64207c29befc007a7e565b2382389b874f3	MacDisplayKit: exp1224: enable hdr hevc power efficiency
1225	104.17	discard	MacDisplayKit=2677bcb97cda890f9f426e8b7ffe4c7d6b0a066e	MacDisplayKit: exp1225: soften hdr hevc data limits
1226	104.17	discard	MacDisplayKit=09487daecd74be9bb25a77ade1e4d44439a3dce0	MacDisplayKit: exp1226: soften hdr hevc bitrate
1227	102.29	discard	MacDisplayKit=78400a563ebc5bca30cc314f956c9ede31660f32	MacDisplayKit: exp1227: skip hdr hevc data limits
1228	104.38	discard	MacDisplayKit=e0c1db9e831c6ab310844865188de67aef25e358	MacDisplayKit: exp1228: lengthen hdr hevc gop
1229	104.38	discard	MacDisplayKit=d307e6cecf7ce37d0985a4fa3e638f043abfd77a	MacDisplayKit: exp1229: shorten hdr hevc gop
1230	104.38	discard	MacDisplayKit=324a0b4b421572222836d59a4883c133316e768f	MacDisplayKit: exp1230: widen hdr hevc burst limits
1231	104.38	discard	MacDisplayKit=e8581ff1c07b0dbc2df76d4645911a18968911d7	MacDisplayKit: exp1231: lengthen hdr hevc keyframe interval
1232	104.38	discard	MacDisplayKit=1014530b5a2e64243a8039204c26ae62c8349ea0	MacDisplayKit: exp1232: add hdr hevc vbv buffer
1233	104.17	discard	MacDisplayKit=e8943e5cd2846d3fbf8f2872129308f01f14613f	MacDisplayKit: exp1233: enable hdr hevc reordering
1234	104.17	discard	MacDisplayKit=71a8962d1d6f3e609d893615b68444586a9b20fe	MacDisplayKit: exp1234: allow hdr hevc open gop
1235	104.17	discard	MacDisplayKit=0c4a0cb94068dba38d3cde1629d5ab966f51dec5	MacDisplayKit: exp1235: relax hdr hevc vbv delay
1236	104.38	discard	MacDisplayKit=6cd32f28fcd06f40a436cc228c8f2a48da07947e	MacDisplayKit: exp1236: skip hdr hevc profile level
1237	104.17	discard	MacDisplayKit=95fe85c8acffde0fe6e400fbf46e2104cac34df5	MacDisplayKit: exp1237: raise hevc frame delay
1238	104.17	discard	MacDisplayKit=6b9ddd26430c303df01856442ff00e28aea772fa	MacDisplayKit: exp1238: reduce hdr hevc frame hint
1239	104.17	discard	MacDisplayKit=01796588b34796bc6a9fbdf0709713e8559f8ceb	MacDisplayKit: exp1239: align hdr hevc duration
1240	104.17	discard	MacDisplayKit=e6dcb9a302568c676ff25ee09fb95754fdb1fb09	MacDisplayKit: exp1240: skip hdr hevc bit depth hint
1241	104.17	discard	MacDisplayKit=daec50cdf9b6553304c99bda62bebd56bb40cda2	MacDisplayKit: exp1241: require hdr hevc hardware encode
1242	95.42	discard	MacDisplayKit=558816a4ad72ab05ba03c88cafe747843c485066	MacDisplayKit: exp1242: request hdr hevc llrc spec
1243	104.38	discard	MacDisplayKit=951908c2ad6084d8161ab2b44a5bc1d19b8bc85c	MacDisplayKit: exp1243: skip hdr hevc duration hint
1244	104.17	discard	MacDisplayKit=bbdf458a9ee5ad98ee3e68348c0bb0716a48237c	MacDisplayKit: exp1244: skip hdr hevc frame hint
1245	104.17	discard	MacDisplayKit=9cb4a8db077370ed507b5058261b46c8932d50e1	MacDisplayKit: exp1245: skip hdr hevc keyframe duration
1246	104.38	discard	MacDisplayKit=02029e97f0cc944fb7fc8725220a7553e80f92eb	MacDisplayKit: exp1246: skip hdr hevc keyframe interval
1247	104.17	discard	MacDisplayKit=0710481280c8d624772c6e184f4851b8e7181d90	MacDisplayKit: exp1247: skip hdr hevc reordering gate
1248	104.38	discard	MacDisplayKit=83eb1927f8e4734ab2add6247bad208b4f0ad0d9	MacDisplayKit: exp1248: skip hdr hevc open gop gate
1249	104.17	discard	MacDisplayKit=d740344a61b8d6790cf3f2a2437ca8138130a86a	MacDisplayKit: exp1249: skip hdr hevc speed priority
1250	104.38	discard	MacDisplayKit=ddb0b2acc83f61cc27a0444d5856a918ca70e433	MacDisplayKit: exp1250: skip hdr hevc power property
1251	104.17	discard	MacDisplayKit=b6bad947fbb7749c485a9c9c2142fad708eb7b15	MacDisplayKit: exp1251: skip hdr hevc realtime property
1252	104.17	discard	MacDisplayKit=ef117c3413758f7278f01425a0c689482fb26af0	MacDisplayKit: exp1252: skip hdr hevc progressive scan
1253	104.38	discard	MacDisplayKit=5989efb7dbcc1e6d55f9aed14d5fa171b41f4e56	MacDisplayKit: exp1253: skip hdr hevc temporal gate
1254	104.17	discard	MacDisplayKit=b61b73303666faa1cd7e51d4eef5af9f5d107c51	MacDisplayKit: exp1254: skip hdr hevc vbv delay gate
1255	104.17	discard	MacDisplayKit=aca268ad68dcb8e0440fd2aab7da2d98629dda38	MacDisplayKit: exp1255: skip hdr hevc average bitrate
1256	104.38	discard	MacDisplayKit=00b020723b5a51ec5f8083b9ac153e5213442d58	MacDisplayKit: exp1256: skip hdr hevc realtime ceiling
1257	104.38	discard	MacDisplayKit=72078761dcff9ab21fe188beed905f1d3cd545d4	MacDisplayKit: exp1257: omit hdr hevc session attrs
1258	104.17	discard	MacDisplayKit=45180e34e2b69cae760a5e86f53e507a99550e22	MacDisplayKit: exp1258: omit hdr hevc hw enable
1259	104.38	discard	MacDisplayKit=4a79c0d79c63486cefbc64a8b06d7b1b53a36dee	MacDisplayKit: exp1259: skip hdr hevc frame delay gate
1260	104.17	discard	MacDisplayKit=61724c942ec5c55b04aa0d6956e9fd4dd4315269	MacDisplayKit: exp1260: omit hdr hevc encoder spec
1261	104.17	discard	MacDisplayKit=58bc1a28d2236924482f898c81628504f46b8a0d	MacDisplayKit: exp1261: omit hdr hevc metal attrs
1262	104.17	discard	MacDisplayKit=c36c7667a048290da79f8b53c2e560422f775f51	MacDisplayKit: exp1262: omit hdr hevc iosurface attrs
1263	104.38	discard	MacDisplayKit=fb9d3e367f7ecaa41600667ba611de2b651bc678	MacDisplayKit: exp1263: omit hdr hevc wrap attrs
1264	104.17	discard	MacDisplayKit=b298b0be86408aa82e339d1ab5e096efdb52aa9d	MacDisplayKit: exp1264: prefer hdr hevc encoder attrs
