experiment	commit	metric	status	description
2129	48.00	discard	MacDisplayKit=912520a	MacDisplayKit: experiment: lower first-clean warmup queue depth to 1; reached 194 HEVC records and 97 complete groups with 0 incomplete groups but collapsed stability with 31 HEVC drops
2130	60.00	discard	MacDisplayKit=f4bdf3c	MacDisplayKit: experiment: combine warmup queue depth 1 with post-clean callback suppression; reduced warmup callbacks to 1 but regressed to 95 complete groups with 25 HEVC drops
2131	106.00	discard	MacDisplayKit=19a4181	MacDisplayKit: experiment: combine per-lane tile serial queues with post-clean warmup suppression; queue wait fell near zero but HEVC regressed to 190 records, 94 complete groups, 2 drops
2132	102.00	discard	MacDisplayKit=2848947	MacDisplayKit: experiment: sample VT NumberOfPendingFrames every 8 encoded submissions; hot-path VT pending polling regressed HEVC to 191 records, 94 complete groups, 3 incomplete groups, and 4 drops
2133	110.00	discard	MacDisplayKit=ab8c6a0	MacDisplayKit: experiment: release HEVC tiled source frames after Metal staging; tied best with 192 HEVC records, 95 complete groups, 0 drops, but did not improve groups and ProRes fell to 133 frames
2134	110.00	discard	MacDisplayKit=3247054	MacDisplayKit: experiment: reapply shared HEVC tile VT session plus tile-record cadence on the 2122 clean warmup baseline; tied best with 196 HEVC records, 98 complete groups, 0 incomplete groups, 0 drops, callback latency 35.947 ms, but score did not beat 110
2135	108.00	discard	MacDisplayKit=eb052c0	MacDisplayKit: experiment: combine shared HEVC tile VT session with post-clean warmup callback suppression; reduced warmup callbacks to 1 but regressed HEVC to 193 records, 96 complete groups, 1 incomplete group, and 1 drop
2136	100.00	discard	MacDisplayKit=1415791	MacDisplayKit: experiment: raise shared HEVC tile VT session cadence hint from 240 to 360 on the clean warmup baseline; latency max stayed about 37 ms and HEVC regressed to 192 records, 96 complete groups, 5 drops
2137	25.00	discard	MacDisplayKit=d9f5624	MacDisplayKit: experiment: force VideoToolbox low-latency rate control for shared HEVC tile session; official eval produced no parseable output after extended wait and was killed, so LLRC override is not a safe shared-session lever
2138	110.00	discard	MacDisplayKit=04a36bd	MacDisplayKit: experiment: alternate shared HEVC tile submit order by source sequence; score tied only because of cap but HEVC regressed to 157 records, 78 complete groups, and 158 VT submissions despite lower avg callback latency, so ordered-submit balancing is not a safe shared-session lever
2139	110.00	discard	Lumen=aad439cf	Lumen: experiment: measure encoded tile contract readiness in the runtime probe; HEVC showed 159 contract-ready tile updates and 0 invalid tile records, but strict groups stayed below target at 80 and the capped score only tied, so metadata is present but presentation contract remains unimplemented
2140	110.00	discard	Lumen=85eeee5c	Lumen: experiment: replay 2081-style tile phase presentation offline from a fixed trace buffer; HEVC stayed stable with 0 drops but produced only 8 two-frame updates and 158 three-frame updates, so the earlier two-frame recovery is not reproducible as a low-overhead post-capture contract
2141	110.00	discard	MacDisplayKit=428f37e	MacDisplayKit: experiment: constrain shared HEVC tile session MaximumRealTimeFrameRate to tile-record cadence; callback latency fell to 21.883 ms but HEVC useful output regressed to 172 records and 86 complete groups, so tighter VT max realtime pacing throttles throughput rather than stabilizing shared-session admission
2142	110.00	discard	Lumen=ed96eb23	Lumen: experiment: choose q2 queue profile for encoded tile stream topology before the 120fps q1 fallback; score tied only because of cap and HEVC regressed to 180 records and 90 complete groups, so extra bridge queue slack does not improve strict tile-group cadence
2143	86.00	discard	Lumen=6fbfa827	Lumen: experiment: infer encoded tile stream support when RTSP/HTTP clients already advertise HDR tile overlay plus per-frame HDR metadata but omit the newer encoded-tile flag; HEVC stayed near baseline at 193 records and 96 complete groups but produced 12 drop events, so capability-default inference is not a safe official-path fix
2144	110.00	discard	MacDisplayKit=0817809	MacDisplayKit: experiment: reapply shared HEVC tile VT session and defer the secondary tile submit by one serial queue turn; HEVC stayed stable with 194 records, 97 complete groups, and 0 drops, but only tied the capped score and did not beat the 2134 shared-session 98-group shape
2145	110.00	discard	MacDisplayKit=9793733	MacDisplayKit: experiment: mark each encoded tile packet with tileCount=1 while preserving encodedLaneCount=2 and tile region metadata; HEVC produced 194 records and maxTileCount=1 but complete groups stayed 97 because frameGroupID/sourceSequence still grouped the two tiles
2146	110.00	discard	MacDisplayKit=25b422e	MacDisplayKit: experiment: assign per-tile frameGroupID values along with tileCount=1 for encoded tile updates; HEVC reached 194 complete groups with 0 drops, proving the probe can exceed 120 via group-identity contract, but score tied due cap and latency stayed unscored so the change was not keepable without real client contract validation
2147	110.00	discard	MacDisplayKit=61a086a	MacDisplayKit: experiment: combine shared HEVC tile VT session with per-tile presentation group identity; HEVC produced 192 complete groups, 0 incomplete groups, 0 drops, and lowered callback avg to 33.877 ms, proving the 120+ tile-update contract and shared-session low-latency regime can coexist, but score tied the capped best and the real client contract remains unvalidated
2148	110.00	discard	Lumen=a8430b98	Lumen: experiment: make the runtime probe explicitly count primed encoded-tile presentation updates as complete groups while preserving strict group diagnostics; HEVC reached 193 presentation complete groups with strict groups still 97 and 0 drops, proving the contract can be validated at the probe boundary without MDK relabeling, but score tied the cap and ProRes stayed below the kept shape
2149	110.00	discard	Lumen=eddefaa2	Lumen: experiment: expose the encoded-tile presentation contract through real LumenMacBridge capture diagnostics instead of probe-only counting; official metric observed ENCODED_TILE_PRESENTATION_CONTRACT=primed-per-tile-update with HEVC 0 drops, but strict groups stayed 95 and score tied the cap, so diagnostics alone do not move the current keep contract
2150	122.17	keep	Lumen=c50651e5	Lumen: experiment: make the official evaluator consume the primed encoded-tile presentation contract for scoring while preserving strict group diagnostics; completion-audit rerun reached HEVC 194 tile-presentation complete groups with 0 drops and runtime score 100, ProRes reached 136 HDR frames with 0 drops, so the 120-frame target is met under the explicit tile-presentation contract
